snes-05837	Muslims in the U.S. are specifically exempted from legislative requirements to purchase health insurance.	false	https://www.snopes.com/fact-check/health-insurance-exemptions/	None	Medical	None	David Mikkelson	None	Dhimmitude Exempts Muslims from Obamacare Requirements	13 April 2010	None	['United_States']
snes-00546	Did Tim Tebow Kneel During the National Anthem in Protest of Abortion?	false	https://www.snopes.com/fact-check/tim-tebow-kneel-anthem/	None	Politics	None	David Mikkelson	None	Did Tim Tebow Kneel During the National Anthem in Protest of Abortion?	26 May 2018	None	['None']
snes-03489	Donald Trump plans to do away with a new regulation put in place by President Obama that expands overtime to more workers.	mixture	https://www.snopes.com/fact-check/trump-to-strike-down-obamas-regulation-expanding-overtime/	None	Politics	None	Bethania Palma	None	Trump to Strike Down Obama’s Regulation Expanding Overtime?	23 November 2016	None	['Barack_Obama', 'Donald_Trump']
snes-00141	Senator John McCain's remains were carried to Washington, D.C., on a Boeing C-32A airplane commonly used as "Air Force Two."	true	https://www.snopes.com/fact-check/mccain-carried-air-force-two/	None	Politics	None	David Mikkelson	None	Was John McCain’s Body Carried to Washington on Air Force Two?	3 September 2018	None	['Washington,_D.C.', 'John_McCain']
snes-03016	Cuff Hijinks	mixture	https://www.snopes.com/fact-check/syrian-girl-handcuffed-airport/	None	Fauxtography	None	Kim LaCapria	None	Does a Photograph Depict a 5-Year-Old Syrian Girl Handcuffed at Dulles Airport?	2 February 2017	None	['None']
snes-05524	President Obama and the FCC fined ABC for airing A Charlie Brown Christmas because it was offensive to non-Christians.	false	https://www.snopes.com/fact-check/obama-fines-abc-charlie-brown-christmas/	None	Junk News	None	Kim LaCapria	None	Obama Fines ABC for Charlie Brown Christmas?	2 December 2015	None	['Barack_Obama', 'American_Broadcasting_Company']
snes-04157	A rare 'marbled fuark' was captured on camera in Eastern Cambodia.	false	https://www.snopes.com/fact-check/marbled-fuark/	None	Fauxtography	None	Dan Evon	None	The Marbled Fuark	29 August 2016	None	['None']
snes-01943	A town in New Jersey has forbidden residents from criticizing Muslims or Islam in keeping with sharia law.	mostly false	https://www.snopes.com/fact-check/did-a-new-jersey-town-forbid-residents-from-criticizing-islam/	None	Uncategorized	None	Bethania Palma	None	Did a New Jersey Town Forbid Residents From Criticizing Islam?	8 August 2017	None	['Islam', 'New_Jersey']
snes-00734	A photograph shows a mysterious 7-foot creature that has been terrorizing a village in Argentina.	false	https://www.snopes.com/fact-check/mysterious-creature-terrorizing-argentina/	None	Fauxtography	None	Dan Evon	None	Is a Mysterious Creature Terrorizing Argentina?	20 April 2018	None	['Argentina']
snes-05924	Al Sharpton owes more than four million dollars in unpaid taxes.	mixture	https://www.snopes.com/fact-check/al-sharpton-taxes/	None	Politics	None	Kim LaCapria	None	Does Al Sharpton Owe Millions in Back Taxes?	9 December 2014	None	['None']
snes-04309	There is a secret Obama administration plan for a federal takeover of local police forces via Justice Department consent decrees.	false	https://www.snopes.com/fact-check/un-backs-secret-obama-takeover-of-police/	None	Conspiracy Theories	None	David Emery	None	UN Backs Secret Obama Takeover of Police	5 August 2016	None	['Barack_Obama', 'United_States_Department_of_Justice']
snes-03805	Ezra Taft Benson said that voting for the lesser of two evils is still voting for evil, and one will be judged for it.	unproven	https://www.snopes.com/fact-check/ezra-taft-benson-vote/	None	Questionable Quotes	None	David Emery	None	Ezra Taft Benson’s ‘If You Vote for the Lesser of Two Evils’ Quote	13 October 2016	None	['None']
snes-02773	Ohio's Cedar Point Amusement Park Won't Reopen in 2017?	false	https://www.snopes.com/fact-check/ohios-cedar-point-amusement-park-wont-reopen-2017/	None	Junk News	None	Dan Evon	None	Ohio’s Cedar Point Amusement Park Won’t Reopen in 2017?	15 March 2017	None	['Ohio', 'Cedar_Point']
snes-00104	Detained immigrant children were strapped to chairs with bags over their heads.	true	https://www.snopes.com/fact-check/immigrant-teenagers-strapped-to-chairs-with-bags-over-their-heads/	None	Politics	None	Bethania Palma	None	Were Immigrant Teenagers Strapped to Chairs with Bags Over Their Heads?	10 September 2018	None	['None']
snes-00942	A transgender boy won a state title in girls' high school wrestling.	true	https://www.snopes.com/fact-check/transgender-teen-wrestling-title/	None	Uncategorized	None	Arturo Garcia	None	Did a Transgender Teen Boy Win a Girls’ State Wrestling Title?	1 March 2018	None	['None']
snes-01430	An image showing two lynched men originated with the game "Call of Duty: WWII."	true	https://www.snopes.com/fact-check/call-of-duty-wwii-scene-tree/	None	Fauxtography	None	Dan Evon	None	Does a ‘Call of Duty: WWII’ Still Show Two Men Hanging From a Tree?	16 November 2017	None	['None']
snes-05503	Stanley Kubrick admitted in an interview that he helped NASA fake the U.S. moon landings.	false	https://www.snopes.com/fact-check/false-stanley-kubrick-faked-moon-landings/	None	Fauxtography	None	Dan Evon	None	Did Stanley Kubrick Fake the Moon Landings?	11 December 2015	None	['United_States', 'Stanley_Kubrick']
snes-06332	Former NFL quarterback Kurt Warner married a woman who had two children, one a special needs child.	true	https://www.snopes.com/fact-check/kurt-reply/	None	Glurge Gallery	None	David Mikkelson	None	Kurt Warner	3 February 2002	None	['Kurt_Warner', 'National_Football_League']
snes-02272	Did Londoners Chant in Support of Donald Trump in the Aftermath of a Terrorist Attack?	mostly false	https://www.snopes.com/fact-check/london-donald-trump-sadiq-khan-london-mayor/	None	Politics	None	Dan MacGuill	None	Did Londoners Chant in Support of Donald Trump in the Aftermath of a Terrorist Attack?	5 June 2017	None	['None']
snes-04649	Home Depot founder and CEO Bernie Marcus has endorsed Donald Trump for president.	mixture	https://www.snopes.com/fact-check/home-depot-cofounder-endorses-donald-trump/	None	Politics	None	Dan Evon	None	Home Depot Co-Founder Endorses Donald Trump	6 June 2016	None	['Bernard_Marcus', 'Donald_Trump', 'The_Home_Depot']
snes-01141	Did the Kochs Contribute $500,000 to Paul Ryan After the GOP Tax Plan Was Passed?	true	https://www.snopes.com/fact-check/kochs-contributed-ryan-after-tax/	None	Politics	None	Alex Kasprak	None	Did the Kochs Contribute $500,000 to Paul Ryan After the GOP Tax Plan Was Passed?	23 January 2018	None	['None']
snes-00708	A video shows a group of camels swimming through the sea.	mostly true	https://www.snopes.com/fact-check/camels-crossing-the-sea/	None	Critter Country	None	Dan Evon	None	Camels Crossing the Sea?	27 April 2018	None	['None']
snes-02799	Ben Carson and the 'Nut of the Mind'	false	https://www.snopes.com/fact-check/carson-nut-of-the-mind/	None	Junk News	None	Dan Evon	None	Ben Carson and the ‘Nut of the Mind’	10 March 2017	None	['None']
snes-05645	Schoolkids are smoking and injecting crushed bedbugs to get high from a hallucinogenic substance they contain.	false	https://www.snopes.com/fact-check/smoking-bedbugs/	None	Horrors	None	David Mikkelson	None	Smoking Bedbugs to Get High	10 April 2014	None	['None']
snes-04329	Did Pat Robertson Say 'Melania's Nude Pics Are Pure Art'?	false	https://www.snopes.com/fact-check/pat-robertson-melania-nude-pics/	None	Junk News	None	David Emery	None	Did Pat Robertson Say ‘Melania’s Nude Pics Are Pure Art’?	2 August 2016	None	['None']
snes-02860	A 7-year-old girl was flown to China to receive breast implants for her birthday.	false	https://www.snopes.com/fact-check/7-year-old-implants/	None	Junk News	None	Arturo Garcia	None	Did a Seven-Year-Old Girl Get Breast Implants?	1 March 2017	None	['China']
snes-01838	Dunkin' Donuts is offering free coffee to teachers every Monday in September.	outdated	https://www.snopes.com/fact-check/dunkin-donuts-free-coffee-teachers/	None	Inboxer Rebellion	None	Arturo Garcia	None	Is Dunkin’ Donuts Offering Free Coffee for Teachers Every Monday in September?	25 August 2017	None	['None']
snes-04333	Did Kurt Cobain Predict a Donald Trump Presidency in 1993?	false	https://www.snopes.com/fact-check/kurt-cobain-predicted-donald-trump-presidency-in-1993/	None	Politics	None	Dan Evon	None	Did Kurt Cobain Predict a Donald Trump Presidency in 1993?	2 August 2016	None	['None']
snes-01818	A photograph shows President Donald Trump receiving a spray-on tan before a television appearance.	false	https://www.snopes.com/fact-check/trump-spray-tan-television/	None	Fauxtography	None	Dan Evon	None	Trump Gets a Spray Tan Before Appearing on Television?	29 August 2017	None	['None']
snes-02265	Uber increased its prices in parts of London around the time of a terror attack in June 2017	mixture	https://www.snopes.com/fact-check/uber-increase-london-attack/	None	Business	None	Dan MacGuill	None	Did Uber Increase its Prices in London After a Terror Attack?	5 June 2017	None	['London']
snes-01403	Canada has legalized euthanasia, enabling parents to "kill disabled children."	false	https://www.snopes.com/fact-check/did-canada-legalize-euthanasia-children-disabilities/	None	Medical	None	Kim LaCapria	None	Did Canada Legalize Euthanasia So Parents Can Kill Children With Disabilities?	27 November 2017	None	['Canada']
snes-03416	A somber image shows a man whose wife and two children were killed in a car accident.	false	https://www.snopes.com/fact-check/father-mourns-wife-children-killed-car-crash/	None	Fauxtography	None	Kim LaCapria	None	Father Mourns Wife, Children Killed in Car Crash?	5 December 2016	None	['None']
snes-01568	As of October 2017, Ireland plans to reduce its rate of corporation tax to 8 percent.	false	https://www.snopes.com/fact-check/trump-ireland-tax/	None	Politics	None	Dan MacGuill	None	Is Ireland Lowering Its Corporate Tax Rate?	17 October 2017	None	['None']
snes-00738	Would a Proposed Law ‘Ban the Bible’ in California?	false	https://www.snopes.com/fact-check/california-bible-ban/	None	Politics	None	Dan MacGuill	None	Would a Proposed Law ‘Ban the Bible’ in California?	20 April 2018	None	['None']
snes-05741	Walter Reed Medical Center guidelines prohibit the use or distribution of religious items during visits with patients.	outdated	https://www.snopes.com/fact-check/walter-reed-bible-ban/	None	Uncategorized	None	David Mikkelson	None	Walter Reed Bible Ban	9 May 2012	None	['None']
snes-03914	Two white men were doused in gasoline and set on fire by Black Lives Matter members, and the story was "censored" by the media.	mostly false	https://www.snopes.com/fact-check/blm-gasoline-fire/	None	Fauxtography	None	Dan Evon	None	Two White Men Doused with Gasoline, Set on Fire by BLM	30 September 2016	None	['None']
snes-04255	An image shows a magazine DIY tip from the 1950s instructing readers to burn zinc batteries in the fireplace in order to prevent soot formation and produce colorful flames is real.	true	https://www.snopes.com/fact-check/burn-zinc-batteries-fireplace/	None	Fauxtography	None	Dan Evon	None	Burn Batteries to Prevent Chimney Soot? Old DIY Tip Is Real	12 August 2016	None	['None']
snes-05130	Cell phone companies began charging users for SMS emojis (emoticons) in February 2016.	mostly false	https://www.snopes.com/fact-check/emoji-charges-cell-phone/	None	Business	None	Kim LaCapria	None	Cellular Companies Charging for Emojis?	2 March 2016	None	['None']
snes-01371	A photograph shows a protester holding a sign that says "We must stop the war on Christmas" next to another man with a sign that reads "All holidays matter."	false	https://www.snopes.com/fact-check/protester-holding-holidays-matter-sign/	None	Fauxtography	None	Dan Evon	None	Is a Protester Holding an ‘All Holidays Matter’ Sign?	5 December 2017	None	['None']
snes-06408	Disney can legitmately claim that no one has ever died at one of their theme parks, because they always ensure that accident victims are removed from park property before being declared dead.	false	https://www.snopes.com/fact-check/declared-deaths/	None	Disney	None	David Mikkelson	None	Does No One Ever Die at Disney Parks?	1 March 1996	None	['None']
snes-04423	An image depicts a Hillary Clinton supporter standing on an American flag while waving a "Hillary for President 2016" banner.	false	https://www.snopes.com/fact-check/hillary-clinton-supporter-stands-on-american-flag/	None	Fauxtography	None	Kim LaCapria	None	Hillary Clinton Supporter Stands on American Flag	19 July 2016	None	['United_States', 'Hillary_Rodham_Clinton']
snes-01002	No School Shootings in the United Kingdom Since Handguns Were Banned?	true	https://www.snopes.com/fact-check/dunblane-school-shootings-ban/	None	Politics	None	Kim LaCapria	None	No School Shootings in the United Kingdom Since Handguns Were Banned?	16 February 2018	None	['United_Kingdom']
snes-00899	The Trump administration blocked public access to USDA reports on safety and hygiene standards at facilities where animals are kept and bred.	mixture	https://www.snopes.com/fact-check/trump-puppy-mills-inspection/	None	Politics	None	Dan MacGuill	None	Did President Donald Trump End Public Access to ‘Puppy Mill’ Inspection Reports?	9 March 2018	None	['United_States_Department_of_Agriculture']
snes-01706	California's governor is allowing people who are HIV-positive donate blood	false	https://www.snopes.com/fact-check/is-california-gov-positive-people-blood/	None	Uncategorized	None	Arturo Garcia	None	Is California Governor Jerry Brown Allowing HIV-Positive People to Donate Blood?	18 September 2017	None	['California', 'HIV-positive_people']
snes-02559	A photograph shows a real hammerhead salamander.	false	https://www.snopes.com/fact-check/diplocaulus-model-photo-hoax/	None	Fauxtography	None	Dan Evon	None	‘Hammerhead Salamander’ Photograph	16 May 2016	None	['None']
snes-05542	Jennifer Aniston once reconnected a homeless 15-year-old single mother with her parents.	false	https://www.snopes.com/fact-check/jennifer-aniston-homeless-story/	None	Uncategorized	None	Dan Evon	None	Jennifer Aniston Reunites Homeless 15-Year-old with Her Parents	11 November 2015	None	['Jennifer_Aniston']
snes-04916	A photograph shows an obese tiger.	false	https://www.snopes.com/fact-check/obese-tiger-photo/	None	Fauxtography	None	Dan Evon	None	Fat Cat	15 April 2016	None	['None']
snes-05365	Alan Rickman stated he envisioned sitting in a rocking chair at 80, reading 'Harry Potter' books to his grandchildren.	false	https://www.snopes.com/fact-check/alan-rickman-potter-meme/	None	Politics	None	Kim LaCapria	None	Alan Rickman Rocking Chair Meme	14 January 2016	None	['None']
snes-01554	More than four times as many people are stabbed to death than killed with rifles of any kind.	unproven	https://www.snopes.com/fact-check/four-times-more-stabbed-than-rifles-any-kind/	None	Uncategorized	None	Bethania Palma	None	Are Four Times More People Stabbed to Death Than Killed with Rifles?	19 October 2017	None	['None']
snes-04395	Director Stanley Kubrick wrote a profanity-laced letter to MGM executive James T. Aubrey warning him not to make a sequel to '2001: A Space Odyssey.'	false	https://www.snopes.com/fact-check/stanley-kubrick-letter/	None	Entertainment	None	David Emery	None	Stanley Kubrick’s ‘Don’t F*** with Me’ Letter	18 July 2016	None	['Metro-Goldwyn-Mayer', 'Stanley_Kubrick']
snes-01989	A 31-year-old British woman died of ‘cannabis poisoning’ in October 2013.	unproven	https://www.snopes.com/fact-check/cannabis-poisoning-death/	None	Science	None	Alex Kasprak	None	31-Year-Old British Woman Died of “Cannabis Poisoning”?	30 July 2017	None	['United_Kingdom']
snes-04730	An image shows the inside of a leatherback turtle's mouth.	true	https://www.snopes.com/fact-check/leatherback-sea-turtle-mouth/	None	Fauxtography	None	Dan Evon	None	Is This a Leatherback Turtle’s Mouth?	23 May 2016	None	['None']
snes-03887	Australia is the first country to begin microchipping its citizens.	false	https://www.snopes.com/fact-check/australia-becomes-first-country-to-begin-microchipping/	None	Medical	None	David Emery	None	Australia Becomes First Country to Begin Microchipping Its Public?	4 October 2016	None	['Australia']
snes-05506	Petitioners demanded singer Adele admit her success is due to "white privilege" and donate her wealth to the Black Lives Matter movement.	unproven	https://www.snopes.com/fact-check/adele-white-privilege-petition/	None	Politics	None	Kim LaCapria	None	Adele White Privilege Petition	10 December 2015	None	['None']
snes-04009	Republican VP candidate Mike Pence doesn't want to be referred to as the vice president because he opposes use of the word "vice" on religious grounds.	false	https://www.snopes.com/fact-check/mike-pence-opposes-vice/	None	Junk News	None	Dan Evon	None	Mike Pence Opposes Word ‘Vice’ on Religious Grounds, Doesn’t Want to Be Called Vice Presidential Candidate	18 September 2016	None	['Mike_Pence', 'Republican_Party_(United_States)']
snes-06415	News report shows Martin Luther King Day celebrants holding misspelled signs.	true	https://www.snopes.com/fact-check/i-have-a-what/	None	Fauxtography	None	David Mikkelson	None	Misspelled Martin Luther King Day Signs	28 January 2008	None	['None']
snes-03862	Navy sailor Kristian Saucier was held to a different standard of prosecution for improper handling of classified information than Hillary Clinton.	mixture	https://www.snopes.com/fact-check/kristian-saucier/	None	Military	None	Kim LaCapria	None	Kristian Saucier vs. Hillary Clinton	6 October 2016	None	['None']
snes-00308	Is This ‘Keke Challenge Gone Wrong’ Video Real?	false	https://www.snopes.com/fact-check/keke-challenge-gone-wrong/	None	Fauxtography	None	Dan Evon	None	Is This ‘Keke Challenge Gone Wrong’ Video Real?	23 July 2018	None	['None']
snes-03339	A video shows a driverless Uber running a red light in San Francisco.	true	https://www.snopes.com/fact-check/driverless-uber-runs-red-light/	None	Fauxtography	None	Dan Evon	None	Driverless Uber Runs Red Light?	14 December 2016	None	['San_Francisco']
snes-03567	Maryland's electors ignored the statewide vote and gave the presidency to Hillary Clinton.	false	https://www.snopes.com/fact-check/maryland-refusing-electoral-college/	None	Politicians	None	Dan Evon	None	Maryland Refusing Electoral College, Hillary Given Presidency As More States Follow?	11 November 2016	None	['Hillary_Rodham_Clinton', 'Maryland']
snes-00344	Did the Trump Administration Say Employers Can Fire Workers for Being Gay?	mixture	https://www.snopes.com/fact-check/trump-fire-gay-workers/	None	Politics	None	Arturo Garcia	None	Did the Trump Administration Say Employers Can Fire Workers for Being Gay?	15 July 2018	None	['None']
snes-03757	A San Francisco tech company is a front for the web site that accused Julian Assange of pedophilia.	false	https://www.snopes.com/fact-check/san-francisco-tech-assange/	None	Conspiracy Theories	None	Bethania Palma	None	San Francisco Tech Company CEO Framed Julian Assange?	19 October 2016	None	['San_Francisco', 'Julian_Assange']
snes-04932	A letter criticizing students at Oxford University for their desire to remove a statue of Cecil Rhodes was penned by a school official.	false	https://www.snopes.com/fact-check/oxford-letter-to-students/	None	Politics	None	Dan Evon	None	‘Dear Scrotty Students’ Letter to Oxford University Students	12 April 2016	None	['University_of_Oxford', 'Cecil_Rhodes']
snes-00588	President Trump tweeted that there should be a Mother's Day for fathers, but "the liberal media won't let that happen."	false	https://www.snopes.com/fact-check/president-donald-trump-tweet-mothers-day-fathers/	None	Fauxtography	None	Kim LaCapria	None	Did President Donald Trump Tweet That There Should Be a Mother’s Day for Fathers?	16 May 2018	None	['None']
snes-03259	Morgan Freeman and Meryl Streep are the biological parents of rap artist Future.	false	https://www.snopes.com/fact-check/meryl-streep-morgan-freeman-futures-parents/	None	Entertainment	None	Bethania Palma	None	Are Meryl Streep and Morgan Freeman Future’s Parents?	27 December 2016	None	['Morgan_Freeman', 'Meryl_Streep']
snes-03492	President John F. Kennedy proclaimed that "nobody can stop an assassination" just before he was shot and killed in 1963.	unproven	https://www.snopes.com/fact-check/did-john-f-kennedy-predict-his-own-assassination/	None	Politics	None	Dan Evon	None	Did John F. Kennedy Predict His Own Assassination?	25 November 2016	None	['None']
snes-05902	New Year's is the day of the year on which the greatest number of people are killed in automobile accidents.	false	https://www.snopes.com/fact-check/fatal-accidents-new-years-day/	None	Automobiles	None	David Mikkelson	None	Fatal Accidents on New Year’s Day	31 December 2008	None	['None']
snes-03716	The Supreme Court has upheld former Vice President Dick Cheney's sentence of 20 years in prison on charges related to war crimes.	false	https://www.snopes.com/fact-check/supreme-court-confirms-20-year-prison-sentence-for-ex-vp-dick-cheney/	None	Junk News	None	Kim LaCapria	None	Supreme Court Confirms 20-Year Prison Sentence for Ex-VP Dick Cheney	24 October 2016	None	['Dick_Cheney']
snes-02398	Did James Comey Cover Up a Murdered DNC Staffer's Purported Links to WikiLeaks?	false	https://www.snopes.com/fact-check/james-comey-seth-rich/	None	Politics	None	Dan MacGuill	None	Did James Comey Cover Up a Murdered DNC Staffer’s Purported Links to WikiLeaks?	19 May 2017	None	['None']
snes-01984	'The Price is Right' host Bob Barker died in July 2017, after falling and hitting his head at his home.	false	https://www.snopes.com/fact-check/bob-barker-dead/	None	Junk News	None	Kim LaCapria	None	Is Former ‘Price is Right’ Host Bob Barker Dead at Age 94?	31 July 2017	None	['Bob_Barker']
snes-04198	A step-dad refused to pay for his daughter's wedding at the last minute because she allowed her biological father back into her life.	unproven	https://www.snopes.com/fact-check/step-dad-pulls-funding-daughters-wedding/	None	Viral Phenomena	None	Kim LaCapria	None	Step-Dad Pulls Out of Funding Daughter’s Wedding at Last Minute	27 October 2015	None	['None']
snes-01114	The FBI found $4 million in cash and two bodies in a storage unit belonging to the Democratic mayor of a Missouri town.	false	https://www.snopes.com/fact-check/mayor-storage-unit-fbi/	None	Junk News	None	David Mikkelson	None	Were $4 Million and Two Dead Bodies Found in a Democratic Mayor’s Storage Unit?	26 January 2018	None	['Missouri', 'Democratic_Party_(United_States)', 'Federal_Bureau_of_Investigation']
snes-01061	GlaxoSmithKline announced a new recall of Ventolin inhalers in February 2018.	false	https://www.snopes.com/fact-check/ventolin-safety-recall/	None	Medical	None	Dan MacGuill	None	Safety Recall of Ventolin Inhalers?	6 February 2018	None	['None']
snes-00807	William Shakespeare wrote that he "always felt happy" because he didn't "expect anything from anyone."	false	https://www.snopes.com/fact-check/did-shakespeare-say-he-always-felt-happy/	None	Questionable Quotes	None	Dan Evon	None	Did William Shakespeare Say He Was Always Happy Because He Didn’t ‘Expect Anything From Anyone?’	5 April 2018	None	['None']
snes-04743	During a Fox News appearance, Select Committee on Benghazi Chairman Trey Gowdy "accidentally admitted" that troops would not have been able to reach the four Americans killed in time to intervene.	mostly true	https://www.snopes.com/fact-check/trey-gowdy-admitted-benghazi/	None	Politics	None	Kim LaCapria	None	Trey Gowdy Admitted Nothing Could Have Saved Benghazi Victims?	19 May 2016	None	['United_States', 'Trey_Gowdy', 'Fox_News_Channel']
snes-01762	If you sign up for Equifax's credit-monitoring service, you cannot join any class-action lawsuit against the company.	mixture	https://www.snopes.com/fact-check/equifax-credit-monitoring-class-action/	None	Technology	None	Arturo Garcia	None	Does Equifax’s Credit Monitoring Service Bar Users From Joining a Class-Action Suit Against Them?	8 September 2017	None	['None']
snes-00107	Did Ford Make Colin Kaepernick the Face of Their New Ad Campaign?	false	https://www.snopes.com/fact-check/ford-kaepernick-ad-campaign/	None	Controversy	None	Dan Evon	None	Did Ford Make Colin Kaepernick the Face of Their New Ad Campaign?	10 September 2018	None	['None']
snes-05520	A photograph depicts a "pro-ISIS rally" held in Dearborn, Michigan, in December 2015.	miscaptioned	https://www.snopes.com/fact-check/dearborn-michigan-pro-isis-rally/	None	Fauxtography	None	Kim LaCapria	None	Does a Photograph Show a ‘Pro-ISIS Rally’ in Michigan?	7 December 2015	None	['Michigan']
snes-00459	A Trump Tower hotel opened in Pyongyang, North Korea within a day of the historic summit between President Trump and Kim Jong-Un.	false	https://www.snopes.com/fact-check/trump-tower-opens-pyongyang/	None	Junk News	None	David Emery	None	Did a Trump Tower Open in Pyongyang?	14 June 2018	None	['North_Korea', 'Pyongyang', 'Donald_Trump']
snes-02694	Disney announced that the Simba character will be portrayed as gay in the new 'The Lion King' movie.	false	https://www.snopes.com/fact-check/simba-gay-lion-king-remake/	None	Junk News	None	Dan Evon	None	Will Simba the Lion Be Gay in ‘The Lion King’ Remake?	3 April 2017	None	['The_Lion_King', 'The_Walt_Disney_Company', 'Simba']
snes-02790	Ezekiel Wilekenmeyer Williams, the biological father of Malia and Sasha Obama, has filed a lawsuit against Barack and Michelle Obama.	false	https://www.snopes.com/fact-check/obama-biological-father-lawsuit/	None	Junk News	None	Dan Evon	None	Obamas Being Sued by Malia and Sasha’s Biological Father?	13 March 2017	None	['Barack_Obama', 'Michelle_Obama', 'Family_of_Barack_Obama']
