snes-04119	The former Florida representative and wrote an angry column about 49ers quarterback Colin Kaepernick on his personal blog.	true	https://www.snopes.com/fact-check/allen-west-colin-kaepernick/	None	Fauxtography	None	Bethania Palma	None	Allen West Pens Open Letter to Colin Kaepernick	1 September 2016	None	['None']
snes-04889	Colin Powell urged people to vote for Donald Trump so that they could put a conservative on the Supreme Court.	misattributed	https://www.snopes.com/fact-check/colin-powell-supreme-court-quote/	None	Politics	None	Dan Evon	None	Colin Powell ‘Supreme Court Vacancy’ Quote	20 April 2016	None	['Colin_Powell', 'Donald_Trump']
snes-03991	A photograph shows an African tribe performing a ritual to reconnect a misbehaving person with his good nature.	false	https://www.snopes.com/fact-check/african-reconnection-ritual/	None	Fauxtography	None	Dan Evon	None	African ‘Reconnection’ Ritual	20 September 2016	None	['Africa']
snes-02492	Photograph shows an airplane shot down by Native Americans using wooden arrows.	false	https://www.snopes.com/fact-check/native-americans-airplane-arrows/	None	Fauxtography	None	Dan Evon	None	Native Americans Shot Down an Airplane with Arrows?	4 May 2017	None	['None']
snes-03751	George Soros-controlled Smartmatic manufactures the voting machines used in 16 crucial states, and those states will be rigged in favor of Hillary Clinton.	false	https://www.snopes.com/fact-check/george-soros-controls-smartmatic-voting-machines-in-16-states/	None	Uncategorized	None	David Mikkelson	None	Daily Caller Caught Lying Yet Again	20 October 2016	None	['None']
snes-03444	Trump's Attorney General pick, Jeff Sessions, blasted a federal law protecting disabled children in the classroom.	true	https://www.snopes.com/fact-check/jeff-sessions-slammed-protections-for-disabled-students/	None	Uncategorized	None	Bethania Palma	None	Jeff Sessions Slammed Protections for Disabled Students?	30 November 2016	None	['None']
snes-04137	A photograph shows a praying mantis after it killed a hummingbird.	true	https://www.snopes.com/fact-check/praying-mantis-attacking-hummingbird/	None	Fauxtography	None	Dan Evon	None	Does This Photograph Show a Praying Mantis Attacking a Hummingbird?	30 August 2016	None	['None']
snes-04873	643,000 Americans declare bankruptcy over medical bills every year.	mixture	https://www.snopes.com/fact-check/643000-bankruptcies-in-the-u-s-every-year-due-to-medical-bills/	None	Medical	None	Kim LaCapria	None	Do 643,000 Bankruptcies Occur in the U.S. Every Year Due to Medical Bills?	22 April 2016	None	['United_States']
snes-04299	Donald Trump has dropped out of the 2016 presidential race and endorsed Hillary Clinton.	false	https://www.snopes.com/fact-check/trump-drops-out-endorses-clinton/	None	Junk News	None	Dan Evon	None	Trump: You People Really Believed Me?	8 August 2016	None	['Hillary_Rodham_Clinton', 'Donald_Trump']
snes-02392	Banana Boat brand sunscreen is causing severe burns, particularly on toddlers and young children.	unproven	https://www.snopes.com/fact-check/banana-boat-sunscreen-burn/	None	Medical	None	Dan MacGuill	None	Is Banana Boat Sunscreen Causing Burns in Children?	19 May 2017	None	['None']
snes-05973	Thieves armed with "code grabbers" are breaking into cars by recording signals sent by remote keyless entry devices.	mixture	https://www.snopes.com/fact-check/code-grabbers-remote-keyless-entry/	None	Automobiles	None	David Mikkelson	None	Are Car Thieves Using ‘Code Grabbers’ to Steal Automobiles?	2 July 2008	None	['None']
snes-01062	A series of photograph show the skeletal remains of the biblical giant Goliath.	false	https://www.snopes.com/fact-check/is-this-goliath-skeleton-real/	None	Fauxtography	None	Dan Evon	None	Is This ‘Goliath Skeleton’ Real?	6 February 2018	None	['None']
snes-00200	A video shows an abnormally large leatherback turtle on a beach.	mixture	https://www.snopes.com/fact-check/large-leatherback-turtle-video/	None	Fauxtography	None	Dan Evon	None	Does This Video Show an Abnormally Large Leatherback Turtle?	15 August 2018	None	['None']
snes-05912	Michael Jordan said he doesn't care about kids dying over his shoes.	false	https://www.snopes.com/fact-check/get-shoes-or-die-tryin/	None	Media Matters	None	David Mikkelson	None	Michael Jordan on Kids Dying Over His Shoes: ‘Not My Problem’	16 December 2014	None	['Michael_Jordan']
snes-02151	A photograph shows Sen. Elizabeth Warren (D-Massachusetts) performing a pagan ritual in the nude.	false	https://www.snopes.com/fact-check/elizabeth-warren-pagan-ritual/	None	Junk News	None	Dan Evon	None	Did Senator Elizabeth Warren Perform Nude Pagan Rituals in College?	23 June 2017	None	['None']
snes-05892	A video clip shows a car with color-changing "paramagnetic paint."	false	https://www.snopes.com/fact-check/paramagnetic-paint-car/	None	Fauxtography	None	David Mikkelson	None	Does This Car Have Paramagnetic Paint That Automatically Changes Colors?	13 January 2014	None	['None']
snes-05047	Hillary Clinton overlooked Benghazi victims when she said that "we didn't lose a single person in Libya" during a campaign event on MSNBC.	mostly false	https://www.snopes.com/fact-check/hillary-clinton-benghazi-msnbc/	None	Uncategorized	None	Kim LaCapria	None	Hillary Clinton: ‘We Didn’t Lose a Single Person’ in Libya	17 March 2016	None	['Libya', 'MSNBC', 'Benghazi', 'Hillary_Rodham_Clinton']
snes-01712	Jane Fonda Betrayed American POWs?	false	https://www.snopes.com/fact-check/jane-fonda-pows/	None	Military	None	David Mikkelson	None	Did Jane Fonda Betray American POWs in North Vietnam?	21 June 2000	None	['None']
snes-01735	The makers of a television commercial for a car company were so "freaked out" by an apparent "ghostly" apparition in the raw footage that the ad was never released.	false	https://www.snopes.com/fact-check/ghost-car-commercial/	None	Fauxtography	None	David Emery	None	Does a Never-Aired ‘Ghost Car’ Commercial Depict an Unexplained Supernatural Event?	13 September 2017	None	['None']
snes-03965	Officials at Ramapo College forced students to change an "offensive" patriotic barbecue event.	unproven	https://www.snopes.com/fact-check/college-threatened-to-cancel-offensive-america-themed-bbq-event/	None	Uncategorized	None	Bethania Palma	None	College Threatened to Cancel ‘Offensive’ America-Themed BBQ Event?	23 September 2016	None	['None']
snes-00184	A viral screenshot shows a Fox News contributor debating the 'War on Christmas' while other news networks reported on Michael Cohen's guilty pleas.	false	https://www.snopes.com/fact-check/fox-news-festivus-michael-cohen/	None	Fauxtography	None	Dan MacGuill	None	Did Fox News Discuss the ‘War on Christmas’ While Other Networks Covered Michael Cohen’s Guilty Pleas?	22 August 2018	None	['Fox_News_Channel']
snes-01184	Melania Trump plagiarized a portion of a speech delivered by Michelle Obama in 2016 for her tweet commemorating Martin Luther King Day in 2018.	false	https://www.snopes.com/fact-check/melania-michelle-mlk-message/	None	Junk News	None	Dan Evon	None	Did Melania Trump Copy Michelle Obama’s MLK Day Message?	18 January 2018	None	['Michelle_Obama', 'Martin_Luther_King,_Jr._Day']
snes-02155	A nude sunbather was injured when a predatory bird ripped away one of his testicles.	false	https://www.snopes.com/fact-check/nude-sunbather-turtle-eggs/	None	Junk News	None	Dan Evon	None	Seagull Rips Off Man’s Testicle as He Sunbathes Naked?	22 June 2017	None	['None']
snes-05856	PETA workers are stealing family pets and euthanizing them.	mixture	https://www.snopes.com/fact-check/peta-taking-pets/	None	Critter Country	None	Kim LaCapria	None	Is PETA Stealing and Killing Pets?	2 February 2015	None	['None']
snes-02955	An adopted dog's former owner turned out to be a soldier who was killed in Iraq.	false	https://www.snopes.com/fact-check/false-reggie-the-adopted-lab/	None	Glurge Gallery	None	David Mikkelson	None	Reggie, the Adopted Lab	8 August 2009	None	['Iraq']
snes-05239	A Texas man was forced to take his American flag down because its display threatened Muslims.	mostly false	https://www.snopes.com/fact-check/remove-flag-muslims-offended/	None	Politics	None	Kim LaCapria	None	Texas Man Forced to Take Down U.S. Flag Because Muslims Were Offended?	10 February 2016	None	['United_States', 'Texas']
snes-05382	In 2012, 80% of murders stemmed from otherwise law-abiding citizens involved in interpersonal disputes.	unproven	https://www.snopes.com/fact-check/gun-homicides-disputes/	None	Guns	None	Kim LaCapria	None	80 Percent of Murders Involve Interpersonal Disputes	11 January 2016	None	['None']
snes-00528	A photograph shows Natalie Palmer Botes, the daughter of big game hunter Walter Palmer, with several dead wolves — including one that had recently given birth to cubs.	miscaptioned	https://www.snopes.com/fact-check/did-natalie-palmer-hunt-kill-wolves/	None	Critter Country	None	Dan Evon	None	Did Natalie Palmer Botes Hunt and Kill These Wolves?	31 May 2018	None	['None']
snes-02263	A photograph shows President Donald Trump sitting with Liberace.	false	https://www.snopes.com/fact-check/donald-trump-with-liberace/	None	Fauxtography	None	Dan Evon	None	Is this Donald Trump Sitting with Liberace?	6 June 2017	None	['None']
snes-04256	A 4-year-old boy was accused of hacking the FBI's databases.	false	https://www.snopes.com/fact-check/4-year-old-boy-accused-of-hacking-fbi-database/	None	Junk News	None	Kim LaCapria	None	4-Year-Old Boy Accused of Hacking FBI Database	12 August 2016	None	['Federal_Bureau_of_Investigation']
snes-00403	Vice President Joe Biden was refused service at the Crumb and Get It cookie shop in 2012.	mixture	https://www.snopes.com/fact-check/was-biden-refused-service-in-2012/	None	Politics	None	Dan Evon	None	Was Joe Biden Refused Service at ‘Crumb and Get It’ in 2012?	27 June 2018	None	['Joe_Biden']
snes-05639	Dearborn, Michigan, has become the first U.S. city to implement Sharia law.	false	https://www.snopes.com/fact-check/michigan-votes-sharia-law/	None	Junk News	None	David Mikkelson	None	Has a City in Michigan Become the First in the U.S. to Fully Implement Sharia Law?	28 October 2013	None	['United_States', 'Michigan']
snes-02760	British actor Rowan Atkinson, best known as 'Mr. Bean,' has died.	false	https://www.snopes.com/fact-check/rowan-atkinson-death-hoax/	None	Junk News	None	David Emery	None	Rowan Atkinson Death Hoax	15 July 2016	None	['United_Kingdom', 'Rowan_Atkinson']
snes-02340	Did Pope Francis Slap Away Donald Trump's Hand?	false	https://www.snopes.com/fact-check/pope-francis-trump-hand-slap/	None	Fauxtography	None	Dan Evon	None	Did Pope Francis Slap Away President Trump’s Hand?	26 May 2017	None	['None']
snes-00405	Did Harley Davidson’s CEO Call President Trump ‘a Moron’?	false	https://www.snopes.com/fact-check/did-ceo-harley-davidson-trump-moron/	None	Business	None	Kim LaCapria	None	Did Harley Davidson’s CEO Call President Trump ‘a Moron’?	27 June 2018	None	['None']
snes-02497	Photograph shows a newborn baby clutching an IUD in his hand.	miscaptioned	https://www.snopes.com/fact-check/baby-born-holding-iud/	None	Fauxtography	None	Bethania Palma	None	Was a Baby Born Holding an IUD?	3 May 2017	None	['None']
snes-05389	President Obama fired Rear Admiral Rick Williams for "questioning" the President's purported recent purchase of a mansion in Dubai.	false	https://www.snopes.com/fact-check/rick-williams-obamas-mansion/	None	Politicians	None	Kim LaCapria	None	FALSE: Admiral Fired for Exposing Obama’s Dubai Mansion Purchase	11 January 2016	None	['Barack_Obama', 'Dubai']
snes-02447	The horse's head that appeared in an iconic scene in the film The Godfather was real.	true	https://www.snopes.com/fact-check/godfather-horse-head/	None	Entertainment	None	Kim LaCapria	None	Was the Horse’s Head in ‘The Godfather’ Real?	8 April 2016	None	['None']
snes-02224	A California family was ticketed after holding a Viking funeral at a local lake.	false	https://www.snopes.com/fact-check/viking-funeral-california/	None	Fauxtography	None	Dan Evon	None	Was a Family Cited for a Viking Funeral on a California Lake?	12 June 2017	None	['California']
snes-00057	San Juan mayor Carmen Yulín Cruz was arrested for misusing federal disaster relief funds.	false	https://www.snopes.com/fact-check/san-juan-mayor-misuse/	None	Junk News	None	Bethania Palma	None	Was the Mayor of San Juan Arrested for Misuse of Disaster Funds?	20 September 2018	None	['San_Juan,_Puerto_Rico']
snes-03557	A woman set her husband on fire for molesting their daughter.	mostly true	https://www.snopes.com/fact-check/woman-sets-her-husband-on-fire-for-raping-daughter/	None	Uncategorized	None	Dan Evon	None	Woman Sets Her Husband on Fire for Raping Her 7-Year-Old Daughter	12 November 2016	None	['None']
snes-02841	Does a Female Praying Mantis Always Bite Off Her Mate's Head?	false	https://www.snopes.com/fact-check/preymates/	None	Critter Country	None	Alex Kasprak	None	Does a Female Praying Mantis Always Eat Her Mate’s Head?	31 October 1999	None	['None']
snes-00008	On 30 September 2018, the administration of President Donald Trump allowed the Violence Against Women Act to expire.	mostly false	https://www.snopes.com/fact-check/trump-violence-against-women-act/	None	Politics	None	Dan MacGuill	None	Did President Donald Trump Allow the Violence Against Women Act to Expire?	5 October 2018	None	['None']
snes-02214	Rapper Kanye West scored 106 points in a charity basketball game against a team of children in wheelchairs.	false	https://www.snopes.com/fact-check/ball-bearing/	None	Junk News	None	David Mikkelson	None	Kanye Scores 106 Points Against Wheelchair Basketball Team?	18 September 2014	None	['None']
snes-04800	Apple Music is purporsefully deleting files from personal computers.	mostly false	https://www.snopes.com/fact-check/apple-music-deleting-files/	None	Technology	None	Dan Evon	None	Apple Music is Deleting Files from Personal Computers	6 May 2016	None	['None']
snes-03853	Clown masks have been banned in the United States, and wearing one can result in a $50,000 fine.	false	https://www.snopes.com/fact-check/clown-masks-banned/	None	Junk News	None	Kim LaCapria	None	Clown Masks Banned in United States, Carries $50,000 Fine	7 October 2016	None	['United_States']
snes-06259	A trojan worm known as Koobface is "spreading like wildfire" via Facebook.	outdated	https://www.snopes.com/fact-check/koobface/	None	Computers	None	David Mikkelson	None	‘Koobface’ Virus Warning	14 July 2008	None	['Facebook', 'Koobface']
snes-03868	Congress passed a law authorizing citizens to shoot and kill "suspicious clowns."	false	https://www.snopes.com/fact-check/authorities-authorize-public-to-shoot-and-kill-clowns/	None	Junk News	None	David Emery	None	Authorities Authorize the Public to Legally Shoot and Kill Suspicious Clowns	5 October 2016	None	['United_States_Congress']
snes-04052	The Democratic National Committee is meeting to consider replacing presidential nominee Hillary Clinton.	unproven	https://www.snopes.com/fact-check/democratic-party-holding-emergency-meeting-to-discuss-replacing-hillary-clinton/	None	Politicians	None	Bethania Palma	None	Democratic Party Holding Emergency Meeting to Discuss Replacing Hillary Clinton?	12 September 2016	None	['Hillary_Rodham_Clinton', 'Democratic_National_Committee']
snes-00732	Did YETI Brand Coolers Cut Ties with the NRA?	mixture	https://www.snopes.com/fact-check/yeti-nra-business-ties/	None	Politics	None	Snopes Staff	None	Did YETI Brand Coolers Cut Ties with the NRA?	23 April 2018	None	['None']
snes-06423	American president George Bush asked Brazilian president Fernando Cardoso if "Brazil has blacks, too."	unproven	https://www.snopes.com/fact-check/black-tuesday/	None	Politicians	None	David Mikkelson	None	George Bush on Blacks in Brazil	6 June 2002	None	['United_States', 'Brazil', 'Fernando_Henrique_Cardoso', 'George_W._Bush']
snes-02302	In May 2017 President Trump launched a monthly "Big League Box" subscription for campaign merchandise.	true	https://www.snopes.com/fact-check/trump-subscription-box/	None	Politics	None	Kim LaCapria	None	Is the Trump Administration Selling Subscription ‘Big League Boxes’?	31 May 2017	None	['None']
snes-01618	An anonymous 4chan user predicted the October 2017 Las Vegas Strip mass shooting.	unproven	https://www.snopes.com/fact-check/4chan-user-prediction-las-vegas-shooting/	None	Uncategorized	None	Bethania Palma	None	Did an Anonymous 4chan User Predict the Las Vegas Shooting Three Weeks in Advance?	6 October 2017	None	['None']
snes-05852	Madmen are injecting HIV-infected blood into unsuspecting moviegoers and random young people dancing in bars or at raves.	false	https://www.snopes.com/fact-check/hiv-infected-needle-attacks/	None	Horrors	None	Snopes Staff	None	HIV-Infected Needle Attacks	1 March 1998	None	['None']
snes-03551	Delayed military absentee ballots would have "swung" the presidential election for Hillary Clinton if they had been counted on time.	false	https://www.snopes.com/fact-check/military-absentee-ballots-clinton/	None	Junk News	None	Kim LaCapria	None	Military Absentee Ballots Delivered One Day Late Would Have Swung Election for Clinton	14 November 2016	None	['None']
snes-06071	Flag protocol specifies that a U.S. flag should be burned if it has been allowed to touch the ground.	false	https://www.snopes.com/fact-check/flag-disposal/	None	Holidays	None	David Mikkelson	None	Should a U.S. Flag Be Burned Once It Has Touched the Ground?	14 June 2004	None	['United_States']
snes-04884	Did Harriet Tubman Say ‘I Freed a Thousand Slaves’?	false	https://www.snopes.com/fact-check/harriet-tubman-quote/	None	Politics	None	Dan Evon	None	Did Harriet Tubman Say ‘I Freed a Thousand Slaves’?	21 April 2016	None	['None']
snes-04564	Amazon is issuing credits to many customers due to the settlement of an e-book lawsuit.	true	https://www.snopes.com/fact-check/amazon-issues-credits-in-e-book-settlement/	None	Inboxer Rebellion	None	Kim LaCapria	None	Amazon Issues Credits in e-Book Settlement	23 June 2016	None	['None']
snes-04964	A photograph shows a 736-pound catfish caught in the Mississippi River.	false	https://www.snopes.com/fact-check/736-pound-catfish/	None	Fauxtography	None	Dan Evon	None	Was a 736-Pound Catfish Caught in the Mississippi River?	4 April 2016	None	['Mississippi_River']
snes-04405	A photograph shows Melania Trump wearing the 'pirate shirt' featured in a memorable episode of the TV sitcom 'Seinfeld.'	false	https://www.snopes.com/fact-check/melania-trump-pirate-shirt/	None	Fauxtography	None	Dan Evon	None	Melania Trump Wore Seinfeld’s ‘Pirate Shirt’ to the RNC	21 July 2016	None	['None']
snes-04125	A video shows a hawk snatching up a snake and dropping it amidst a family's barbecue.	false	https://www.snopes.com/fact-check/hawk-drops-snake-on-bbq/	None	Fauxtography	None	Dan Evon	None	Hawk Drops Snake on Family Barbecue	1 September 2016	None	['None']
snes-05701	CNN reporter Brooke Baldwin said "don't hire veterans, they can't be trusted with authority."	mixture	https://www.snopes.com/fact-check/brooke-baldwin-military-authority/	None	Politics	None	Dan Evon	None	Did CNN’s Brooke Baldwin Say Military Veterans Can’t Be Trusted with Authority?	12 May 2015	None	['None']
snes-01957	A federal law prohibits U.S. citizens from having contact with extraterrestrial beings.	false	https://www.snopes.com/fact-check/et-make-bail/	None	Legal Affairs	None	David Mikkelson	None	Extraterrestrial Contact Law	1 February 2002	None	['United_States']
snes-05940	Parking lot carjackers are placing flyers or $100 bills on the windows of automobiles, then taking the cars when drivers step out of their vehicles to remove them.	false	https://www.snopes.com/fact-check/carjackers-leaving-flyers-100-bills-car-windows/	None	Crime	None	David Mikkelson	None	Are Carjackers Leaving Flyers and $100 Bills on Car Windows?	29 February 2004	None	['None']
snes-01616	A poster calling Trump a "pendejo" has been posted "all over" Puerto Rico.	unproven	https://www.snopes.com/fact-check/trump-pendejo-posters-puerto-rico/	None	Viral Phenomena	None	Arturo Garcia	None	Are There Posters Calling Trump a ‘Pendejo’ Across Puerto Rico?	6 October 2017	None	['None']
snes-00775	Parent's Choice diapers are causing small children to suffer chemical burns.	unproven	https://www.snopes.com/fact-check/are-parents-choice-diapers-chemical-burns/	None	Medical	None	Kim LaCapria	None	Are Parent’s Choice Diapers Giving Babies Chemical Burns?	12 April 2018	None	['None']
snes-01603	Law enforcement agents have announced that "antifa" is planning extended violent unrest or civil war beginning on 4 November 2017.	false	https://www.snopes.com/fact-check/is-antifa-planning-a-civil-war/	None	Politics	None	Kim LaCapria	None	Is ‘Antifa’ Planning a Civil War?	10 October 2017	None	['None']
snes-03974	A Massachusetts judge passed a law making it legal for black men to run from police because they are at risk of being racially profiled.	mixture	https://www.snopes.com/fact-check/massachusetts-run-from-police/	None	Crime	None	Kim LaCapria	None	Massachusetts Passes Law Allowing Black Men to Run from Police Due to Racial Profiling?	22 September 2016	None	['Massachusetts']
snes-04779	Bernie Sanders trailed Hillary Clinton by only 271 delegates in May 2016, despite media inclusion of superdelegates in their respective totals.	mixture	https://www.snopes.com/fact-check/sanders-vs-clinton-delegate-count/	None	Ballot Box	None	Kim LaCapria	None	Sanders vs. Clinton: Delegate Count	10 May 2016	None	['Bernie_Sanders', 'Hillary_Rodham_Clinton']
snes-04218	An image shows the rejection letter Donald Trump received from Harvard University.	false	https://www.snopes.com/fact-check/donald-trumps-harvard-rejection-letter/	None	Junk News	None	Dan Evon	None	Donald Trump’s Harvard Rejection Letter	18 August 2016	None	['Harvard_University', 'Donald_Trump']
snes-06040	Account describes Muslims allegedly engaging in a "dry run" hijacking on AirTran Flight 297.	mixture	https://www.snopes.com/fact-check/flight-297/	None	Uncategorized	None	David Mikkelson	None	Did a Dry Run Hijacking Take Place on Flight 297?	4 December 2009	None	['None']
snes-02145	A news article was published claiming that Radiohead fans were embarrassed after wildly applauded a tuning session.	false	https://www.snopes.com/fact-check/radiohead-fans-left-red-faced-after-applauding-tuning-session/	None	Junk News	None	Dan Evon	None	Radiohead Fans Left Red-Faced After Applauding Tuning Session?	26 June 2017	None	['None']
snes-05619	A photograph shows Barack Obama kissing British prime minister David Cameron.	false	https://www.snopes.com/fact-check/obama-cameron-kiss/	None	Fauxtography	None	David Mikkelson	None	DId President Obama Kiss David Cameron?	1 April 2013	None	['David_Cameron', 'United_Kingdom', 'Barack_Obama']
snes-03295	On 19 December 2016 an amateur photographer snapped pictures of snow on the ground of the Algerian city of Ain Sefra, which borders the Sahara desert.	true	https://www.snopes.com/fact-check/snowfall-in-the-sahara/	None	Fauxtography	None	Alex Kasprak	None	Snowfall in the Sahara	21 December 2016	None	['Algeria', 'Sahara']
snes-04053	A black-and-white photograph shows children playing on frighteningly dangerous (by modern standards) playground equipment in a public park.	true	https://www.snopes.com/fact-check/1900s-playground-photo/	None	Fauxtography	None	Bethania Palma	None	Is This a Photograph of a Playground from 1900?	12 September 2016	None	['None']
snes-05488	An image shows a vintage 1950s Sears catalog advertisement featuring a smiling family all holding guns.	true	https://www.snopes.com/fact-check/vintage-daisy-gun-ad/	None	Fauxtography	None	Dan Evon	None	Is an Ad Touting ‘A Gun for the Whole Family’ Real?	15 December 2015	None	['None']
snes-00444	The animated film "Incredibles 2" contains scenes that prompted an epilepsy warning at movie theaters.	true	https://www.snopes.com/fact-check/incredibles-2-epilepsy-warning/	None	Entertainment	None	Dan MacGuill	None	Does ‘Incredibles 2’ Come With an Epilepsy Warning?	18 June 2018	None	['None']
snes-04197	The movie 'Brokeback Mountain' is being remade with with Margot Robbie and Emma Watson in the lead roles.	false	https://www.snopes.com/fact-check/brokeback-mountain-remake/	None	Junk News	None	Dan Evon	None	Is a Lesbian ‘Brokeback Mountain’ Remake Confirmed for 2017?	23 August 2016	None	['Emma_Watson']
snes-06443	A teacher's ad hoc class assignment is kept and treasured by her students.	true	https://www.snopes.com/fact-check/all-the-good-things/	None	Glurge Gallery	None	David Mikkelson	None	All the Good Things	8 February 1999	None	['None']
snes-01038	Was 'America First' a Slogan of the Ku Klux Klan?	true	https://www.snopes.com/fact-check/america-first-ku-klux-klan-slogan/	None	History	None	David Emery	None	Was ‘America First’ a Slogan of the Ku Klux Klan?	9 February 2018	None	['None']
snes-02121	Germany's Black Forest caused 15,000 missing person cases last year.	false	https://www.snopes.com/fact-check/did-germanys-black-forest-cause-15000-missing-person-cases-last-year/	None	Fauxtography	None	Dan Evon	None	Did Germany’s Black Forest Cause 15,000 Missing Person Cases Last Year?	30 June 2017	None	['Germany', 'Black_Forest']
snes-04168	The maternal death rate in Texas has spiked in recent years due to funding cuts for reproductive health clinics.	unproven	https://www.snopes.com/fact-check/texas-maternal-mortality-rate-doubles-after-reproductive-health-restrictions/	None	Uncategorized	None	Kim LaCapria	None	Texas Maternal Mortality Rate Doubles After Reproductive Health Restrictions?	26 August 2016	None	['Texas']
snes-05612	The Minions in the film "Despicable Me" were inspired by photographs of young Nazi poison gas test subjects.	false	https://www.snopes.com/fact-check/nazi-minions/	None	Fauxtography	None	Kim LaCapria	None	Were Minions Inspired by Nazi Poison Gas Test Subjects?	20 July 2015	None	['None']
