snes-05145	The transcript of Hillary Clinton's speech to finance giant Goldman Sachs was leaked and published online.	false	https://www.snopes.com/fact-check/hillary-clinton-goldman-sachs/	None	Junk News	None	Dan Evon	None	Transcript for Hillary Clinton’s Speech to Goldman Sachs Leaked?	29 February 2016	None	['Goldman_Sachs', 'Hillary_Rodham_Clinton']
snes-05841	Abraham Lincoln authored a list of maxims beginning with 'You cannot bring about prosperity by discouraging thrift.'"	misattributed	https://www.snopes.com/fact-check/lincoln-prosperity-quote/	None	Questionable Quotes	None	David Mikkelson	None	Abraham Lincoln on Prosperity	19 August 2009	None	['None']
snes-03896	Hillary Clinton proposed assassinating Julian Assange via drone strike to silence WikiLeaks.	unproven	https://www.snopes.com/fact-check/julian-assange-drone-strike/	None	Conspiracy Theories	None	Kim LaCapria	None	To Silence Wikileaks, Hillary Clinton Proposed Drone Strike on Julian Assange?	3 October 2016	None	['WikiLeaks', 'Julian_Assange']
snes-04097	The atheist mayor of DeQuincy, Louisiana, fired a firefighter for praying at the scene of a fire.	false	https://www.snopes.com/fact-check/fireman-suspended-by-atheist-mayor/	None	Junk News	None	Kim LaCapria	None	Fireman Suspended and Jailed by Atheist Mayor for Praying at Scene of Fire	6 September 2016	None	['Louisiana']
snes-05767	A video clip shows a subsequently suppressed Fox News broadcast about Barack Obama.	false	https://www.snopes.com/fact-check/press-release-2/	None	Politicians	None	David Mikkelson	None	Obama Admits He Is a Muslim	14 July 2014	None	['Fox_News_Channel', 'Barack_Obama']
snes-03504	The House passed a bill that allows government contractors to discriminate against lesbian, gay, bisexual and transgender people.	mostly true	https://www.snopes.com/fact-check/house-passes-bill-letting-government-contractors-fire-lgbt-people/	None	Politics	None	Bethania Palma	None	House Passes Bill Letting Government Contractors Fire LGBT People?	21 November 2016	None	['None']
snes-04854	A video shows an airport worker destroying a plane after they were fired.	mixture	https://www.snopes.com/fact-check/utair-plane-destroyed-fired/	None	Fauxtography	None	Dan Evon	None	Airport Worker Destroys Jet After Getting Fired	27 April 2016	None	['None']
snes-01701	Has President Trump Abolished Child Support?	false	https://www.snopes.com/fact-check/child-support-abolished/	None	Junk News	None	Kim LaCapria	None	Will All Child Support in the U.S. End on June 11th 2018?	20 September 2017	None	['None']
snes-04899	New York voters will be turned away from the polls if they wear shirts endorsing specific candidates, and polling hours have been deliberately shortened to suppress primary votes.	mostly false	https://www.snopes.com/fact-check/sanders-voter-suppression-ny/	None	Ballot Box	None	Kim LaCapria	None	Voter Suppression in New York?	18 April 2016	None	['None']
snes-04394	Waverly Labs' 'Pilot' earpiece can translate spoken language in real time.	unproven	https://www.snopes.com/fact-check/waverly-labs-pilot-earpiece-translates-spoken-language/	None	Technology	None	Kim LaCapria	None	Waverly Labs’ ‘Pilot’ Earpiece Translates Spoken Language	22 July 2016	None	['None']
snes-05570	A photograph depicts a new method discovered by Russian scientists to turn black skin white instantly.	false	https://www.snopes.com/fact-check/russian-laboratory-black-skin/	None	Fauxtography	None	Kim LaCapria	None	Russian Scientists Invent Instant Skin Lightener	3 August 2015	None	['Russia']
snes-03417	A photograph of a shark leaping out of the water is real and won an award from National Geographic.	false	https://www.snopes.com/fact-check/national-geographics-photograph-year/	None	Fauxtography	None	Dan Evon	None	Is This National Geographic’s ‘Photograph of the Year’?	5 December 2016	None	['None']
snes-00511	In June 2018, Ivanka Trump adopted the alias "Adrienne Vittadini" to market her fashion line to unwitting buyers.	mostly false	https://www.snopes.com/fact-check/ivanka-trumps-line-rebranded-adrienne-vittadini/	None	Business	None	Kim LaCapria	None	Has Ivanka Trump’s Line Been Rebranded as ‘Adrienne Vittadini’?	4 June 2018	None	['None']
snes-05728	Images document a Hamas-organized mass wedding of adult men and pre-pubescent girls in the Gaza Strip.	miscaptioned	https://www.snopes.com/fact-check/hamas-wedding-girls/	None	Fauxtography	None	David Mikkelson	None	Do These Photographs Show a Hamas-Organized Wedding of Men and Young Girls?	27 September 2009	None	['None']
snes-00821	Was Al Sharpton's Brother Arrested for Murder After Speaking at a March for Our Lives Rally?	mostly true	https://www.snopes.com/fact-check/was-al-sharptons-brother-arrested-for-murder/	None	Crime	None	Bethania Palma	None	Was Al Sharpton’s Brother Arrested for Murder After Speaking at a March for Our Lives Rally?	30 March 2018	None	['None']
snes-00464	Did Bill Maher Say He Hopes for a Recession ‘to Get Rid of Trump’?	true	https://www.snopes.com/fact-check/bill-maher-recession-get-rid-trump/	None	Politics	None	David Emery	None	Did Bill Maher Say He Hopes for a Recession ‘to Get Rid of Trump’?	13 June 2018	None	['None']
snes-04857	Planet Fitness issued a policy in April 2016 allowing men to use women's locker rooms and women to use men's locker rooms.	mostly false	https://www.snopes.com/fact-check/planet-fitness-locker-room-controversy/	None	Politics	None	Kim LaCapria	None	Planet Fitness Locker Room Controversy	27 April 2016	None	['None']
snes-00015	When President George W. Bush nominated him to the DC Circuit in 2003, Brett Kavanaugh had never tried a case in court and was promoted from a law clerk to a judgeship.	mixture	https://www.snopes.com/fact-check/brett-kavanaugh-never-tried-case-law-clerk/	None	Politics	None	Dan MacGuill	None	Did Brett Kavanaugh ‘Never Try a Case’ Before Being Promoted from Law Clerk to Federal Judge?	4 October 2018	None	['George_W._Bush']
snes-00020	Judge Kavanaugh, if confirmed to the Supreme Court, could be a deciding vote on a case that has the potential to dramatically increase the power of the presidential pardon.	true	https://www.snopes.com/fact-check/trump-gamble-court-case/	None	Politics	None	Alex Kasprak	None	Could a Case Currently Before the Supreme Court Result in a Stronger Presidential Pardon?	3 October 2018	None	['None']
snes-00343	Of the 154 mass shootings recorded in the U.S. in 2018 through 28 June, none of them were perpetrated by black men, undocumented immigrants, or women.	mixture	https://www.snopes.com/fact-check/mass-shootings-in-2018/	None	Crime	None	Dan MacGuill	None	Were None of 154 Mass Shootings in 2018 Committed by a Black Man, Illegal Alien, or Woman?	15 July 2018	None	['United_States']
snes-03000	Two grandchildren of John Tyler, the 10th U.S. President, are still alive.	true	https://www.snopes.com/fact-check/heir-raising-experience/	None	History	None	David Mikkelson	None	Are John Tyler’s Grandchildren Still Alive?	20 December 2013	None	['United_States', 'John_Tyler']
snes-00725	A video shows an ice fisherman getting eaten by an orca.	false	https://www.snopes.com/fact-check/did-orca-eat-an-ice-fisherman/	None	Fauxtography	None	Dan Evon	None	Did an Orca Eat an Ice Fisherman on Camera?	24 April 2018	None	['None']
snes-03470	A prankster changed the name of Trump Tower to Dump Tower in Google Maps briefly on 26 November 2016.	true	https://www.snopes.com/fact-check/trump-tower-name-changed-to-dump-tower-in-google-maps/	None	Politics	None	Bethania Palma	None	Trump Tower Name Changed to ‘Dump Tower’ In Google Maps	27 November 2016	None	['None']
snes-03304	'The Daily Stormer' called for a retaliatory 'troll storm' against Jews in Whitefish, Montana, whom they accused of causing economic hardship to the parents of white supremacist Richard Spencer.	true	https://www.snopes.com/fact-check/daily-stormer-whitefish-montana/	None	Politics	None	David Emery	None	White Supremacist Web Site Calls for Online Attacks Against Jews in Whitefish, Montana	19 December 2016	None	['Montana', 'Jews']
snes-02859	During pregnancy, if the mother suffers organ damage, the baby in the womb sends stem cells to repair the damaged organ.	mostly true	https://www.snopes.com/fact-check/fetus-can-send-stem-cells-repair-mothers-damaged-organs/	None	Science	None	Alex Kasprak	None	Can a Fetus Send Its Own Stem Cells to Repair Its Mother’s Damaged Organs?	8 December 2016	None	['None']
snes-01938	A photograph shows Pope Francis kissing the hand of David Rockefeller, Henry Kissinger, or one of many other people targeted by conspiracy theorists as being part of a vast global conspiracy.	false	https://www.snopes.com/fact-check/pope-francis-kisses-david-rockefellers-hand/	None	Fauxtography	None	Dan Evon	None	Pope Francis Kisses David Rockefeller’s Hand?	9 August 2017	None	['David_Rockefeller', 'Henry_Kissinger']
snes-04895	"American Chopper" star Paul Teutul, Sr. was killed in a motorcycle accident in April 2016.	false	https://www.snopes.com/fact-check/paul-teutul-death-hoax/	None	Junk News	None	Dan Evon	None	Paul Teutul Death Hoax	19 April 2016	None	['None']
snes-05792	A 1981 Columbia University student ID card identifies Barack Obama as a foreign student named Barry Soetoro.	false	https://www.snopes.com/fact-check/obama-student-id/	None	Politicians	None	David Mikkelson	None	Did Barack Obama Attend Columbia University as a Foreign Student?	9 February 2012	None	['Barack_Obama', 'Columbia_University']
snes-04090	Image depicts a huge, inexplicably half-eaten shark found on a Florida beach.	mixture	https://www.snopes.com/fact-check/half-eaten-shark-washes-up-in-daytona/	None	Fauxtography	None	Kim LaCapria	None	Half-Eaten Shark Washes Up in Daytona	6 September 2016	None	['None']
snes-05384	A photograph shows a frozen spider web.	miscaptioned	https://www.snopes.com/fact-check/frozen-spider-web-sculpture/	None	Fauxtography	None	Dan Evon	None	Does a Photograph Show a Frozen Spider Web?	11 January 2016	None	['None']
snes-05459	Miss Colombia committed suicide after she the mistaken that accidentally crowned her Miss Universe was rectified.	false	https://www.snopes.com/fact-check/false-miss-colombia-suicide/	None	Junk News	None	Dan Evon	None	Miss Colombia Didn’t Commit Suicide	21 December 2015	None	['Miss_Universe']
snes-02936	Has A Russian Spy Ship Been Spotted Off the U.S. East Coast?	true	https://www.snopes.com/fact-check/russian-spy-ship-east-coast/	None	Uncategorized	None	Bethania Palma	None	Has a Russian Spy Ship Been Spotted Near the East Coast of the United States?	14 February 2017	None	['None']
snes-00518	Martha Stewart said she'd refuse to accept a pardon from President Donald Trump.	false	https://www.snopes.com/fact-check/martha-stewart-pardon-tweet/	None	Junk News	None	Arturo Garcia	None	Did Martha Stewart Say She’d Refuse to Accept a Pardon from President Trump?	2 June 2018	None	['Martha_Stewart', 'Donald_Trump']
snes-04740	Albert Einstein Rejection Letter	false	https://www.snopes.com/fact-check/einstein-rejection-letter/	None	Fauxtography	None	Dan Evon	None	Albert Einstein Rejection Letter	20 May 2016	None	['None']
snes-03969	Charlotte "rioters" will lose all government benefits if caught "looting" during protests after the death of Keith Lamont Scott.	false	https://www.snopes.com/fact-check/charlotte-tells-rioters-anyone-caught-looting-will-lose-welfare-and-food-stamps-permanently/	None	Junk News	None	Kim LaCapria	None	Charlotte Tells Rioters Anyone Caught Looting Will Lose Welfare and Food Stamps Permanently	23 September 2016	None	['None']
snes-01806	A photograph shows two women holding anti-Father's Day signs in protest of that day's designation.	false	https://www.snopes.com/fact-check/fathers-day-protest-photo/	None	Uncategorized	None	Dan Evon	None	Protests Seek to #EndFathersDay?	28 March 2016	None	['None']
snes-01329	Donald Trump was not accused of sexual assault until he ran for President in 2016.	false	https://www.snopes.com/fact-check/was-donald-trump-accused-of-sexual-assault-prior-to-the-2016-election/	None	Junk News	None	Dan Evon	None	Did Sexual Assault Allegations Against Donald Trump Only Start With the 2016 Election?	14 December 2017	None	['None']
snes-03461	Michigan is about to sell 100 million gallons of groundwater to Nestlé for $200.	mixture	https://www.snopes.com/fact-check/michigan-is-about-to-sell-100-million-gallons-of-groundwater-to-nestle-for-200/	None	Business	None	Kim LaCapria	None	Is Michigan About to Sell 100 Million Gallons of Groundwater to Nestlé for $200?	29 November 2016	None	['Michigan', 'Nestlé']
snes-04982	Donald Trump said there should be "some form of punishment" for women who have abortions.	mixture	https://www.snopes.com/fact-check/donald-trump-punishment-for-abortion/	None	Uncategorized	None	Kim LaCapria	None	Donald Trump Supports ‘Some Form of Punishment’ for Abortions	30 March 2016	None	['None']
snes-02578	An x-ray image shows a live cockroach in a patient's chest in Zimbabwe.	false	https://www.snopes.com/fact-check/cockroach-zimbabwe-x-ray/	None	Fauxtography	None	Dan Evon	None	Did Doctors Discover a Live Cockroach in a Patient’s Chest in Zimbabwe?	19 April 2017	None	['Zimbabwe']
snes-02523	Actor Denzel Washington was killed in a drive-by shooting in New York.	false	https://www.snopes.com/fact-check/denzel-washington-death-hoax/	None	Junk News	None	David Mikkelson	None	Denzel Washington Death Hoax	29 April 2017	None	['New_York_City', 'Denzel_Washington']
snes-03761	President Obama signed an executive order mandating the loser of the 2016 election forever leave the country on 9 November 2016.	false	https://www.snopes.com/fact-check/obama-signs-eo-loser-leaves-us/	None	Junk News	None	Kim LaCapria	None	Obama Signs Executive Order Requiring Loser of Presidential Election to Leave Country	19 October 2016	None	['Barack_Obama']
snes-06035	A video clip shows a NASA studio-produced 'outtake' of the first manned moon landing.	false	https://www.snopes.com/fact-check/moon-truth/	None	Fauxtography	None	David Mikkelson	None	Is This an Apollo 11 Moon Landing Footage Out-Take?	27 January 2003	None	['None']
snes-03589	Americans crashed Canada's immigration web site immediately after Donald Trump was elected.	true	https://www.snopes.com/fact-check/canadas-immigration-web-site-crashed-after-2016-election/	None	Politics	None	Kim LaCapria	None	Canada’s Immigration Web Site Crashed After 2016 U.S. Election?	9 November 2016	None	['Canada', 'United_States', 'Donald_Trump']
snes-06150	Hillary Clinton supported and helped free two Black Panthers accused of torturing and murdering Alex Rackley.	false	https://www.snopes.com/fact-check/black-panthers/	None	Uncategorized	None	David Mikkelson	None	Black Panthers	30 June 1999	None	['Black_Panther_Party']
snes-03218	The modern image of Jesus is modeled on Cesare Borgia, a gangster's son.	false	https://www.snopes.com/fact-check/jesus-modeled-on-borgia/	None	History	None	Kim LaCapria	None	Is the Modern Face of Jesus Modeled on a ‘Gangster’s Son’?	2 January 2017	None	['Jesus', 'Cesare_Borgia']
snes-00512	The National Cancer Institute has "admitted" that "cannabis kills cancer."	false	https://www.snopes.com/fact-check/did-nci-admit-marijuana-kills-cancer/	None	Medical	None	Alex Kasprak	None	Did the National Cancer Institute ‘Finally Admit’ That Marijuana Kills Cancer?	4 June 2018	None	['None']
snes-01493	Did Jared Kushner Go to Saudi Arabia Because it Doesn't Have an Extradition Treaty With the US?	false	https://www.snopes.com/fact-check/jared-kushner-go-saudi-arabia-doesnt-extradition-treaty-us/	None	Politics	None	Bethania Palma	None	Did Jared Kushner Go to Saudi Arabia Because it Doesn’t Have an Extradition Treaty With the US?	31 October 2017	None	['None']
snes-02923	Did President Trump Send Federal Troops, Armored Vehicles to Chicago?	false	https://www.snopes.com/fact-check/trump-federal-troops-chicago/	None	Fauxtography	None	Dan Evon	None	Did President Trump Send Federal Troops, Armored Vehicles to Chicago?	16 February 2017	None	['None']
snes-01716	Photographs show a mule attacking and killing a mountain lion.	miscaptioned	https://www.snopes.com/fact-check/mule-vs-mountain-lion/	None	Fauxtography	None	David Mikkelson	None	Mule vs. Mountain Lion	2 December 2004	None	['None']
snes-05972	Starbucks is awarding social media users free gift cards who click, like, and share Facebook posts.	scam	https://www.snopes.com/fact-check/free-starbucks-gift-card-scam/	None	Fraud & Scams	None	David Mikkelson	None	Free Starbucks Gift Card Scam	18 October 2011	None	['Facebook']
snes-01597	Friday the 13th is a day fraught with peril.	legend	https://www.snopes.com/fact-check/friday-the-13th/	None	Luck	None	Snopes Staff	None	Why Is Friday the 13th Unlucky?	13 May 2005	None	['None']
snes-04536	A mother was arrested for tattooing her 2-year-old boy and trading him for drugs.	false	https://www.snopes.com/fact-check/mother-arrested-after-tattooing-her-son/	None	Junk News	None	Dan Evon	None	Mother Arrested After Tattooing Her Son and Attempting to Trade Him for Drugs	28 June 2016	None	['None']
snes-00670	Actor Samuel L. Jackson tweeted a lament about overpaid "modern mumble" rap artists and underpaid teachers.	false	https://www.snopes.com/fact-check/samuel-l-jackson-rappers-tweet/	None	Viral Phenomena	None	Kim LaCapria	None	Did Samuel L. Jackson Tweet About Overpaid ‘Modern Mumble Rappers’ and Teachers’ Pay?	3 May 2018	None	['None']
snes-00579	Facebook vice president Jeff Rothschild said "In order to finalize the New World Order process we need a 3rd world war to exterminate 90% of the world's population."	false	https://www.snopes.com/fact-check/jeff-rothschild-third-world-war/	None	Questionable Quotes	None	David Emery	None	Did Facebook Executive Jeff Rothschild Say ‘We Need a Third World War’?	18 May 2018	None	['None']
snes-00744	Did Hillary Clinton Found an Anti-Trump Website with Taxpayer Dollars?	false	https://www.snopes.com/fact-check/hillary-clinton-anti-trump-website/	None	Junk News	None	David Mikkelson	None	Did Hillary Clinton Found an Anti-Trump Website with Taxpayer Dollars?	18 April 2018	None	['None']
snes-04077	Prophylactic maker Durex is producing an eggplant-flavored condom.	false	https://www.snopes.com/fact-check/durex-to-produce-eggplant-flavored-condoms/	None	Politics	None	Dan Evon	None	Durex to Produce Eggplant-Flavored Condoms	8 September 2016	None	['None']
snes-05320	A group of Trump supporters misspelled the candidate's name on their shirts.	false	https://www.snopes.com/fact-check/donald-trump-shirts-trmup/	None	Politics	None	Dan Evon	None	FALSE: Trump Supporters Misspelled His Name with Shirts	24 January 2016	None	['None']
snes-05891	Experiment proves water that has been boiled in a microwave oven is harmful to plants.	false	https://www.snopes.com/fact-check/boiling-point/	None	Science	None	David Mikkelson	None	Microwaved Water — See What It Does to Plants	27 August 2006	None	['None']
snes-06387	Baby left in a high chair to await the coming of the sitter is discovered dead by the vacationing parents when they return weeks later.	legend	https://www.snopes.com/fact-check/high-chair-to-heaven/	None	Horrors	None	David Mikkelson	None	Baby High Chair Death	23 March 2001	None	['None']
snes-04722	A drawing of a sex act can be spotted in the closing scenes of the movie "Monsters, Inc."	false	https://www.snopes.com/fact-check/monsters-inc-sex-drawing/	None	Disney	None	Dan Evon	None	Hidden Sex Drawing in ‘Monsters, Inc.’ Scene	24 May 2016	None	['None']
snes-03040	Constitutional Upendment	mostly false	https://www.snopes.com/fact-check/did-trump-alter-the-constitution/	None	Politicians	None	Dan Evon	None	Did President Trump Alter the United States Constitution?	31 January 2017	None	['None']
snes-03123	Speaker Paul Ryan is blocking all incoming calls and faxes to his various offices.	mixture	https://www.snopes.com/fact-check/paul-ryan-blocking-calls-and-faxes/	None	Politicians	None	Kim LaCapria	None	Is Paul Ryan Blocking All Calls and Faxes?	17 January 2017	None	['None']
snes-01675	Astronaut and former NFL player Leland Melvin wrote an open letter to Donald Trump concerning the President's comments about the "Take a Knee" protest.	correct attribution	https://www.snopes.com/fact-check/leland-melvin-pen-open-letter-donald-trump/	None	Questionable Quotes	None	Dan Evon	None	Did Leland Melvin Pen an Open Letter to Donald Trump?	25 September 2017	None	['Donald_Trump', 'National_Football_League', 'Leland_D._Melvin']
snes-04839	Nike makes their sneakers with elephant skins.	false	https://www.snopes.com/fact-check/nike-elephant-shoes-rumor/	None	Business	None	Dan Evon	None	Nike Doesn’t Make Elephant Skin Shoes	29 April 2016	None	['None']
snes-03357	Candy canes were created as Christian symbols representing the blood and purity of Jesus.	false	https://www.snopes.com/fact-check/raising-cane/	None	Holidays	None	David Mikkelson	None	Did Candy Canes Originate as Religious Symbols?	7 December 2000	None	['Jesus']
snes-05745	Former NBA superstar Michael Jordan has died in his sleep of a heart attack.	false	https://www.snopes.com/fact-check/michael-jordan-death-hoax/	None	Inboxer Rebellion	None	David Mikkelson	None	Michael Jordan Death Hoax	23 April 2015	None	['Michael_Jordan', 'National_Basketball_Association']
snes-03178	Meryl Streep applauded for Roman Polanski at the Academy Awards in 2003.	true	https://www.snopes.com/fact-check/meryl-streep-applaud-roman-polanski/	None	Politicians	None	Dan Evon	None	Did Meryl Streep Applaud Roman Polanski at the Academy Awards?	9 January 2017	None	['Roman_Polanski', 'Academy_Awards', 'Meryl_Streep']
snes-01280	During a 'Rolling Stone' interview, U2 singer Bono proclaimed that "Donald Trump is destroying America, [and] we must stop him."	false	https://www.snopes.com/fact-check/bono-trump-destroy-america/	None	Junk News	None	David Mikkelson	None	Did Bono Say ‘Donald Trump Is Destroying America, We Must Stop Him’?	1 January 2018	None	['Bono', 'United_States', 'Donald_Trump']
snes-05421	Archaeologists dug up an 800-year-old alien cellphone in Austria.	false	https://www.snopes.com/fact-check/alien-cellphone-found/	None	Fauxtography	None	Dan Evon	None	Did Archaeologists Dig Up an 800-Year-Old Alien Cellphone?	4 January 2016	None	['Austria']
snes-03849	Hillary Clinton's campaign purchased political ads on the Weather Channel during Hurricane Matthew.	true	https://www.snopes.com/fact-check/hillary-clinton-buys-weather-channel-ads-during-hurricane-matthew/	None	Politicians	None	Bethania Palma	None	Hillary Clinton Buys Weather Channel Ads During Hurricane Matthew?	7 October 2016	None	['The_Weather_Channel']
snes-05180	Was a Nazi Submarine Found in the Great Lakes?	false	https://www.snopes.com/fact-check/nazi-sub-found-in-great-lakes/	None	Junk News	None	Kim LaCapria	None	Was a Nazi Submarine Found in the Great Lakes?	20 February 2016	None	['None']
snes-04645	A man came forward and claimed he had been paid $3,500 to protest at a Donald Trump rally.	false	https://www.snopes.com/fact-check/donald-trump-protester-speaks-out/	None	Junk News	None	Snopes Staff	None	Donald Trump Protester Speaks Out: “I Was Paid $3,500 to Protest Trump’s Rally”	6 June 2016	None	['None']
snes-05565	A "female physician in Munich" penned an alarming warning letter about refugees.	unproven	https://www.snopes.com/fact-check/female-physician-munich/	None	Immigration	None	Kim LaCapria	None	Face the Munich	19 October 2015	None	['Munich']
snes-04383	A list tallies some of the good deeds accomplished by Republican presidential candidate Donald Trump.	mixture	https://www.snopes.com/fact-check/so-you-think-you-know-donald-trump/	None	Politicians	None	Dan Evon	None	So You Think You Know the Real Donald Trump?	25 July 2016	None	['Republican_Party_(United_States)', 'Donald_Trump']
snes-03520	Monica Petersen was killed after she discovered that the Clinton Foundation was involved in a child sex trafficking ring in Haiti.	unproven	https://www.snopes.com/fact-check/monica-petersen-killed/	None	Conspiracy Theories	None	Dan Evon	None	Monica Petersen Killed for Investigating Clinton-Related Sex Trafficking in Haiti?	18 November 2016	None	['Clinton_Foundation', 'Haiti']
snes-00367	A photograph shows an optical illusion on the floor of a school hallway that was designed to prevent children from running.	miscaptioned	https://www.snopes.com/fact-check/hallway-stop-running/	None	Fauxtography	None	Dan Evon	None	Was This Hallway Designed to Prevent Children from Running?	7 July 2018	None	['None']
snes-02848	Saudi scientists announced that theyhad determined women were mammals but not humans.	false	https://www.snopes.com/fact-check/saudi-scientists-women/	None	Junk News	None	Snopes Staff	None	Saudi Arabia: Panel of Scientists Admits Women Are Mammals, Yet ‘Not Human’?	2 March 2017	None	['Saudi_Arabia']
snes-00426	The Trump administration is paying Southwest Key $458 million to run immigrant child detention centers, and its CEO earns a $1.5 million salary.	true	https://www.snopes.com/fact-check/is-trump-administration-southwest-key-458-million/	None	Politics	None	Bethania Palma	None	Is the Trump Administration Paying Southwest Key $458 Million to Run Immigrant Child Detention Centers?	22 June 2018	None	['None']
snes-04754	Police warned that using "Facebook Reactions" is dangerous.	mostly false	https://www.snopes.com/fact-check/facebook-reactions-is-dangerous/	None	Technology	None	Kim LaCapria	None	Police Warn Using ‘Facebook Reactions’ Is Dangerous	17 May 2016	None	['None']
snes-06208	Ronald Reagan once said that "an AK-47 is not a sporting weapon nor needed for defense of a home."	true	https://www.snopes.com/fact-check/true-arms-talks/	None	Guns	None	David Mikkelson	None	Ronald Reagan on AK-47s	11 January 2013	None	['Ronald_Reagan', 'AK-47']
