snes-02073	Was Malia Obama Fired from an Internship at the Spanish Embassy?	false	https://www.snopes.com/fact-check/malia-obama-fired-internship/	None	Junk News	None	David Emery	None	Was Malia Obama Fired from an Internship at the Spanish Embassy?	14 July 2017	None	['None']
snes-05799	A veterinary pathologist testified that being immersed in a can of Mountain Dew would turn a mouse into a "jelly-like" substance.	true	https://www.snopes.com/fact-check/mountain-ewww/	None	Food	None	David Mikkelson	None	Will Mountain Dew Dissolve a Mouse?	22 July 2014	None	['None']
snes-02305	President Donald Trump got five million new Twitter followers in three days, and most of them are bots.	mostly false	https://www.snopes.com/fact-check/trump-new-bot-followers/	None	Uncategorized	None	Bethania Palma	None	Did President Trump’s Twitter Account Gain Five Million New Bot Followers in Three Days?	31 May 2017	None	['None']
snes-00737	Did the BBC Report on a Nuclear War Between NATO and Russia?	false	https://www.snopes.com/fact-check/bbc-nato-russia-nuclear-incident/	None	Fauxtography	None	Dan Evon	None	Did the BBC Report on a Nuclear War Between NATO and Russia?	20 April 2018	None	['None']
snes-03110	Donald Trump posed for a fake speechwriting photograph at an auction house's receptionist's desk.	false	https://www.snopes.com/fact-check/trump-staged-speechwriting-picture/	None	Fauxtography	None	Kim LaCapria	None	Did Donald Trump Use a Receptionist’s Desk and Notepad to Stage a Speechwriting Picture?	19 January 2017	None	['None']
snes-01340	Vegetarians live longer than meat eaters.	unproven	https://www.snopes.com/fact-check/do-vegetarians-live-longer-than-meat-eaters/	None	Medical	None	Alex Kasprak	None	Do Vegetarians Live Longer Than Meat Eaters?	12 December 2017	None	['None']
snes-06392	A brave little boy agrees to transfuse his ailing little sister, thinking the procedure will kill him even as it saves her life.	legend	https://www.snopes.com/fact-check/transfusion-confusion/	None	Glurge Gallery	None	Snopes Staff	None	Transfusion Confusion	25 November 2000	None	['None']
snes-02742	Did President Trump Bestow $100 Million Upon Flint, Michigan?	mixture	https://www.snopes.com/fact-check/epa-grant-flint-water/	None	Politics	None	Dan Evon	None	Did President Trump Bestow $100 Million Upon Flint, Michigan?	22 March 2017	None	['None']
snes-05508	The British government banned the Lord's Prayer in cinemas but then allowed Islamic messages to appear on London buses.	mixture	https://www.snopes.com/fact-check/prophet-mohammed-london-buses/	None	Fauxtography	None	Kim LaCapria	None	Prophet Mohammed London Buses	10 December 2015	None	['United_Kingdom', 'London', 'Islam']
snes-05884	Terrorists have acquired a large number of "missing" UPS uniforms.	false	https://www.snopes.com/fact-check/false-terrorists-buy-ups-uniforms/	None	September 11th	None	David Mikkelson	None	UPS Uniforms Stolen by Terrorists?	2 March 2003	None	['None']
snes-00792	A California bill would unduly penalize police if they shot people carrying pellet guns or malfunctioning firearms.	unproven	https://www.snopes.com/fact-check/california-bill-police-imitation-weapons/	None	Politics	None	Arturo Garcia	None	Would a California Bill Stop Police From Shooting People Carrying ‘Imitation Weapons’?	9 April 2018	None	['California']
snes-01480	Was the Texas Church Shooter an Antifa Member Who Vowed to Start Civil War?	false	https://www.snopes.com/fact-check/texas-church-shooter-antifa/	None	Junk News	None	David Mikkelson	None	Was the Texas Church Shooter an Antifa Member Who Vowed to Start Civil War?	5 November 2017	None	['None']
snes-02063	Large concrete arrows set on the ground guided early airmail pilots across the U.S.	true	https://www.snopes.com/fact-check/mysterious-arrows/	None	History	None	Snopes Staff	None	Concrete Arrows Across the U.S.	30 August 2013	None	['United_States']
snes-03344	People for the Ethical Treatment of Animals (PETA) "rescued" a number of lobsters headed to dinner plates before promptly killing them all by releasing them into lethal freshwater in Nebraska.	unproven	https://www.snopes.com/fact-check/peta-lobster-rescue-in-nebraska-kills-captive-creatures/	None	Critter Country	None	Kim LaCapria	None	PETA Lobster Rescue in Nebraska Kills Captive Creatures?	14 December 2016	None	['Nebraska', 'People_for_the_Ethical_Treatment_of_Animals']
snes-05974	Cheerleader Poops at Football Game?	false	https://www.snopes.com/fact-check/cheerleader-accident/	None	Fauxtography	None	Snopes Staff	None	Cheerleader Poops at Football Game?	6 October 2014	None	['None']
snes-06039	A 1979 Pakistan airline advertisement showed the shadow of a jetliner on the World Trade Center.	true	https://www.snopes.com/fact-check/pakistan-airline-ad-wtc/	None	September 11th	None	David Mikkelson	None	Did a 1979 Pakistan Airline Advertisement Show an Airliner’s Shadow on the World Trade Center?	24 October 2010	None	['Pakistan']
snes-02899	A transcript reproduces '60 Minutes' commentator Andy Rooney's explaining his political views.	misattributed	https://www.snopes.com/fact-check/andy-rooney-politics/	None	Soapbox	None	David Mikkelson	None	Andy Rooney’s Political Views	21 April 2003	None	['Andy_Rooney']
snes-03561	Anti-Trump protesters beat a homeless veteran to death in Philadelphia.	false	https://www.snopes.com/fact-check/protesters-beat-homeless-veteran/	None	Politics	None	David Emery	None	Protesters Beat Homeless Veteran to Death in Philadelphia	12 November 2016	None	['Philadelphia']
snes-01895	Iceland has virtually removed the occurrence of Down syndrome from their population through abortion.	mixture	https://www.snopes.com/fact-check/iceland-eliminated-syndrome-abortion/	None	Medical	None	Alex Kasprak	None	Has Iceland Eliminated Down Syndrome Through Abortion?	15 August 2017	None	['Iceland']
snes-04403	A shelter rented dogs for embarrassed adult Pokemon Go players and raked in tons of cash before all their dogs were swiftly adopted.	mostly false	https://www.snopes.com/fact-check/pokemon-go-dog-walking-program/	None	Viral Phenomena	None	Kim LaCapria	None	Pokemon Go Program Clears Shelter of Dogs Awaiting Adoption	21 July 2016	None	['None']
snes-01090	MIT offers a "pirate certificate" to students who complete four physical education courses.	true	https://www.snopes.com/fact-check/mit-pirate-certificate/	None	Viral Phenomena	None	Dan MacGuill	None	Does MIT Offer Students a ‘Pirate Certificate’?	31 January 2018	None	['None']
snes-01986	Anthony Scaramucci posted nude photographs of his wife in order to get revenge for her filing for divorce.	false	https://www.snopes.com/fact-check/scaramucci-nude-photos-wife-revenge-divorce/	None	Junk News	None	Dan Evon	None	Scaramucci Posts Nude Photos of His Wife as Revenge for Divorce?	31 July 2017	None	['None']
snes-04999	Alaska, Hawaii, Washington states are overwhelmingly "white" and "rural."	false	https://www.snopes.com/fact-check/alaska-hawaii-washington-voters/	None	Uncategorized	None	Brooke Binkowski	None	Alaska, Hawaii, Washington State Overwhelmingly ‘White, Rural’?	28 March 2016	None	['Hawaii', 'Alaska', 'Washington,_D.C.']
snes-00837	David Hogg gave a Nazi salute at the end of his "March for Our Lives" speech.	false	https://www.snopes.com/fact-check/david-hogg-give-nazi-salute/	None	Fauxtography	None	Dan Evon	None	Did David Hogg Give a Nazi Salute?	27 March 2018	None	['None']
snes-05866	Cats have been gravely injured or killed after seeking warmth by hiding in wheel wells or under cars.	true	https://www.snopes.com/fact-check/bang-honk-save-cats-sleeping-tires/	None	Critter Country	None	David Mikkelson	None	Should You Bang or Honk to Save Cats Sleeping on Tires?	26 January 2015	None	['None']
snes-01230	University of Alabama running back Bo Scarbrough lost his scholarship over an anti-Trump outburst.	false	https://www.snopes.com/fact-check/scarbrough-scholarship-trump/	None	Junk News	None	David Mikkelson	None	Did a Black Alabama Running Back Lose His Scholarship Over Anti-Trump Comments?	10 January 2018	None	['None']
snes-01271	Did Queen Elizabeth Suspend the Wedding of Prince Harry and Meghan Markle?	false	https://www.snopes.com/fact-check/queen-elizabeth-suspends-wedding/	None	Junk News	None	David Emery	None	Did Queen Elizabeth Suspend the Wedding of Prince Harry and Meghan Markle?	3 January 2018	None	['Prince_Harry']
snes-05487	ABC Family aired "Christian content warnings" before "A Charlie Brown Christmas."	false	https://www.snopes.com/fact-check/charlie-brown-christmas-christian-content-warnings/	None	Junk News	None	Kim LaCapria	None	Charlie Brown Christmas ‘Christian Content’ Warnings	15 December 2015	None	['None']
snes-03041	NASA now says that burning fossil fuels cools the planet.	false	https://www.snopes.com/fact-check/nasa-fossil-fuels-cool/	None	Science	None	Alex Kasprak	None	Did a NASA Study Conclude That Burning Fossil Fuels Cools the Planet?	30 January 2017	None	['None']
snes-06149	Image shows radioactive seepage spreading across the Pacific Ocean from the Fukushima nuclear plant.	false	https://www.snopes.com/fact-check/fukushima-emergency/	None	Fauxtography	None	David Mikkelson	None	Fukushima Radioactive Water Leak Chart	28 August 2013	None	['None']
snes-05223	Setting your Apple device's date to 1 January 1970 will reveal a retro-themed Easter egg.	false	https://www.snopes.com/fact-check/apples-blast-from-the-past/	None	Technology	None	Brooke Binkowski	None	Apple’s Blast from the Past?	12 February 2016	None	['None']
snes-06393	Chocolate milk is made from "regular" milk rejected for containing too much cow's blood.	false	https://www.snopes.com/fact-check/cow-blood-chocolate-milk/	None	Horrors	None	David Mikkelson	None	Cow Blood in Chocolate Milk	7 July 2008	None	['None']
snes-05584	Will Smith and Jada Pinkett Smith donated $150,000 to a "black Muslim" who called for the murder of all whites.	mixture	https://www.snopes.com/fact-check/million-man-march-will-smith/	None	Politics	None	Dan Evon	None	Did Will Smith Donate $150,000 to a ‘Terrorist Organization’?	14 September 2015	None	['Islam']
snes-04640	The Federal Emergency Management Agency scheduled a massive earthquake preparedness drill on the same day as the California primary.	mostly false	https://www.snopes.com/fact-check/fema-drill-disrupting-california-primary/	None	Ballot Box	None	Kim LaCapria	None	FEMA Earthquake Drill Disrupting California Primary	7 June 2016	None	['California']
snes-04786	China is making corned beef with dead bodies, then selling the products to Africa.	false	https://www.snopes.com/fact-check/china-corned-beef-dead-bodies/	None	Junk News	None	Dan Evon	None	China Producing Corned Beef with Dead Bodies	10 May 2016	None	['China', 'Africa']
snes-06221	A message provides useful instructions for cookomg corn on the cob in a portable picnic cooler.	mixture	https://www.snopes.com/fact-check/cooler-corn/	None	Food	None	Snopes Staff	None	Cooking Corn on the Cob in a Cooler	26 October 2011	None	['None']
snes-00462	Does This Photograph Show Two Boys — One Vaccinated, One Not — Who Were Exposed to Smallpox?	true	https://www.snopes.com/fact-check/one-vaccinated-one-not-smallpox/	None	Medical	None	Dan Evon	None	Does This Photograph Show Two Boys — One Vaccinated, One Not — Who Were Exposed to Smallpox?	13 June 2018	None	['None']
snes-03739	A photograph captures a rare seal with a symmetrical stripe pattern on its pelt.	true	https://www.snopes.com/fact-check/ribbon-seal/	None	Science	None	Bethania Palma	None	Seal with Unusual Stripe-Pattern Markings Spotted in Washington	21 October 2016	None	['None']
snes-03129	President-elect Donald Trump's inauguration will be the first presidential inauguration that Rep. John Lewis has skipped.	false	https://www.snopes.com/fact-check/lewis-skip-inauguration/	None	Politicians	None	Kim LaCapria	None	Did Rep. John Lewis Skip Any Previous Inaugurations?	17 January 2017	None	['Donald_Trump']
snes-01307	Three poll workers in Birmingham were arrested for voter fraud in connection with the special Alabama Senate election.	false	https://www.snopes.com/fact-check/alabama-poll-workers-arrest/	None	Junk News	None	David Mikkelson	None	Did Alabama State Police Arrest 3 Poll Workers in Birmingham?	23 December 2017	None	['Birmingham', 'Alabama']
snes-06109	The 1980s sitcom 'Joanie Loves Chachi' garnered tremendous ratings in Korea due to an inadvertent language issue.	false	https://www.snopes.com/fact-check/joanie-loves-chachi/	None	Entertainment	None	David Mikkelson	None	Was ‘Joanie Loves Chachi’ the Highest-Rated TV Show Ever in Korea?	24 June 2000	None	['None']
snes-00527	The decision to cancel the show 'Roseanne' was made by ABC Senior Vice President of Programming Mutafa Ka'Plese.	false	https://www.snopes.com/fact-check/did-abcs-vp-programming-cancel-roseanne/	None	Junk News	None	Dan Evon	None	Did ABC’s Senior Vice President of Programming Mutafa Ka’Plese Decide to Cancel ‘Roseanne’?	31 May 2018	None	['None']
snes-04769	Do Red Lights Outside Homes Indicate Anti-Gun Solidarity?	false	https://www.snopes.com/fact-check/red-lights-for-anti-gun-solidarity/	None	Media Matters	None	Brooke Binkowski	None	Do Red Lights Outside Homes Indicate Anti-Gun Solidarity?	13 May 2016	None	['None']
snes-05801	Does Mountain Dew Contain the Dangerous Chemical BVO?	mixture	https://www.snopes.com/fact-check/mountain-dew-contain-chemical-known-bvo/	None	Food	None	Snopes Staff	None	Does Mountain Dew Contain the Dangerous Chemical BVO?	8 March 2013	None	['None']
snes-03937	Donald Trump threatened to skip the remaining presidential debates if Hillary Clinton showed up.	false	https://www.snopes.com/fact-check/trump-threatens-to-skip-debates/	None	Junk News	None	Dan Evon	None	Trump Threatens to Skip Remaining Debates If Hillary Is There	27 September 2016	None	['Hillary_Rodham_Clinton', 'Donald_Trump']
snes-04249	Fox News Channel CEO Roger Ailes said that 'the truth is whatever people will believe.'	false	https://www.snopes.com/fact-check/roger-ailes-truth-believe/	None	Politics	None	Dan Evon	None	Roger Ailes: ‘The Truth Is Whatever People Will Believe’	14 August 2016	None	['Roger_Ailes']
snes-03369	The National Park Service specifically blocked the Million Women March as well as all other demonstrations through March 2017.	mostly false	https://www.snopes.com/fact-check/national-park-service-denying-inauguration-protest-permits/	None	Politics	None	Kim LaCapria	None	National Park Service Denying Inauguration Protest Permits?	12 December 2016	None	['None']
snes-01016	Tamiflu is responsible for the increased number of deaths this flu season.	false	https://www.snopes.com/fact-check/tamiflu-causing-increased-number-deaths-flu-season/	None	Medical	None	Alex Kasprak	None	Is Tamiflu Causing Increased Deaths from Flu?	14 February 2018	None	['None']
snes-06198	A TV station was pranked with fake names for pilots involved in an airline crash.	true	https://www.snopes.com/fact-check/news-you-can-lose/	None	Media Matters	None	David Mikkelson	None	KTVU Makes Racist Plane Crash Gaffe	13 July 2013	None	['None']
snes-01521	Baseball's championship competition is known as the "World Series" because it was originally sponsored by the New York World newspaper.	false	https://www.snopes.com/fact-check/world-series/	None	Sports	None	David Mikkelson	None	World Series Origins	12 July 2001	None	['New_York_World']
snes-01324	President Donald Trump hosted the National Rifle Association at the White House on the anniversary of the Sandy Hook massacre.	mixture	https://www.snopes.com/fact-check/president-host-nra-anniversary-sandy-hook/	None	Politics	None	Kim LaCapria	None	Did President Donald Trump Host the NRA on the Anniversary of the Sandy Hook Massacre?	16 December 2017	None	['White_House', 'Donald_Trump', 'Sandy_Hook', 'National_Rifle_Association']
snes-04214	Donald Trump said that Harriet Tubman's face belongs on food stamps, not the $20 bill.	false	https://www.snopes.com/fact-check/donald-trump-tubman/	None	Junk News	None	Dan Evon	None	Donald Trump Says Harriet Tubman Face Belongs on Foodstamps	19 August 2016	None	['Donald_Trump']
snes-00638	A "Welcome to Kansas City" sign features an amusing, but unfortunate typo welcoming 25 million visitors "anally," not "annually."	false	https://www.snopes.com/fact-check/does-welcome-sign-kansas-city-typo/	None	Fauxtography	None	Dan Evon	None	Does a ‘Welcome to Kansas City’ Sign Contain an Unfortunate Typo?	8 May 2018	None	['Kansas_City,_Missouri']
snes-02271	CNN posted and then deleted an article which defended Bill Maher's use of the n-word.	false	https://www.snopes.com/fact-check/cnn-article-bill-maher/	None	Politics	None	Dan Evon	None	Did CNN Delete an Article Defending Bill Maher’s Use of a Racial Slur?	5 June 2017	None	['Bill_Maher', 'CNN']
snes-03028	A chart documents that nationals from the seven countries included in President Trump's U.S. entry restriction have not killed any American citizens since 1975.	mixture	https://www.snopes.com/fact-check/terrorist-attacks-entry-restriction/	None	Uncategorized	None	Dan Evon	None	No Deadly Terrorist Attacks by People from Countries Included in Foreign Entry Restriction?	1 February 2017	None	['United_States']
snes-05321	A photograph shows a JetBlue airliner buried in snow.	miscaptioned	https://www.snopes.com/fact-check/jetblue-snow-blizzard-photo/	None	Fauxtography	None	Dan Evon	None	MISCAPTIONED: JetBlue Plane Buried by Snow	24 January 2016	None	['None']
snes-00336	A photograph shows accused Russian spy Mariia Butina in an Oval Office meeting with President Trump.	false	https://www.snopes.com/fact-check/accused-russian-spy-mariia-butina-photographed-oval-office/	None	Fauxtography	None	Dan Evon	None	Was Accused Russian Spy Mariia Butina Photographed in the Oval Office?	17 July 2018	None	['Russia']
snes-00548	A German football club was banned from playing games outside Germany in 1934, after they failed to give a Nazi salute.	mostly true	https://www.snopes.com/fact-check/german-football-club-banned-failing-give-nazi-salute/	None	Politics	None	Dan Evon	None	Was a German Football Club Banned After Failing to Give a Nazi Salute?	25 May 2018	None	['Germany']
snes-05227	Republicans attempted to stall the release of American prisoners held in Iran in a failed 'October Surprise' ploy.	unproven	https://www.snopes.com/fact-check/gop-delayed-iran-prisoner-release-election/	None	Politics	None	Kim LaCapria	None	GOP Delayed Iran Prisoner Release for Election?	11 February 2016	None	['United_States', 'Iran', 'Republican_Party_(United_States)']
snes-04064	Hillary Clinton said that she would be 'disappointed' if her daughter Chelsea married a black man.	false	https://www.snopes.com/fact-check/hillary-clinton-told-seventeen-magazine-she-didnt-want-her-daughter-marrying-a-black-man/	None	Politicians	None	Dan Evon	None	Hillary Clinton Told ‘Seventeen’ Magazine She Didn’t Want Her Daughter Marrying a Black Man?	10 September 2016	None	['Chelsea_Clinton', 'Hillary_Rodham_Clinton']
snes-05271	President Obama demanded that an admiral stop distributing Bibles.	false	https://www.snopes.com/fact-check/obama-admiral-stop-bibles/	None	Politicians	None	Brooke Binkowski	None	Obama Demanded This Admiral Stop Giving Out Bibles?	3 February 2016	None	['Barack_Obama', 'Bible']
snes-01691	Did the Red Cross Steal Donations in Texas, Empowered by an Obama-Era Executive Order?	mostly false	https://www.snopes.com/fact-check/red-cross-steals-texas/	None	Viral Phenomena	None	Dan MacGuill	None	Did the Red Cross Steal Donations in Texas, Empowered by an Obama-Era Executive Order?	21 September 2017	None	['Texas']
snes-03854	A photograph shows Daytona International Speedway flooded during Hurricane Matthew in October 2016.	miscaptioned	https://www.snopes.com/fact-check/daytona-international-speedway-flooded/	None	Fauxtography	None	Dan Evon	None	Daytona International Speedway Flooded	7 October 2016	None	['None']
snes-05451	Lindsey Graham badmouthed the Republican Party after suspending his 2016 presidential campaign.	false	https://www.snopes.com/fact-check/lindsey-graham-statement-presidential-race-fake/	None	Junk News	None	Dan Evon	None	Lindsey Graham Didn’t Badmouth Republicans	22 December 2015	None	['Lindsey_Graham', 'Republican_Party_(United_States)']
snes-02361	An image depicts Ariana Grande defiling the American flag.	false	https://www.snopes.com/fact-check/ariana-grande-american-flag-photograph/	None	Fauxtography	None	Kim LaCapria	None	Did Ariana Grande Defile the American Flag?	24 May 2017	None	['United_States']
snes-01377	Portugal doesn't have net neutrality regulations, and is an example of what happens without such laws; for example, a Portuguese telecommunications company, MEO, is parceling out access to specific broadband apps and content on a fee-for-service basis.	mostly false	https://www.snopes.com/fact-check/portugal-net-neutrality/	None	Politics	None	David Emery	None	Is Portugal an Example of What Happens Without Net Neutrality?	4 December 2017	None	['Portugal']
snes-06086	The city of Yreka, California, was named for a backwards bakery sign.	false	https://www.snopes.com/fact-check/yreka-bakery/	None	Language	None	David Mikkelson	None	Place Name Origins: Yreka, California	28 August 2007	None	['California']
snes-02951	Were More People Deported Under the Obama Administration Than Any Other?	mixture	https://www.snopes.com/fact-check/obama-deported-more-people/	None	Politics	None	Bethania Palma	None	Were More People Deported Under the Obama Administration Than Any Other?	20 October 2016	None	['None']
snes-05626	You can now order pizza from pizza vending machines.	mixture	https://www.snopes.com/fact-check/pizza-vending-machine/	None	Food	None	Kim LaCapria	None	Pizza Vending Machines	2 July 2015	None	['None']
snes-05064	Notorious criminal Charles Manson has endorsed Donald Trump for president.	false	https://www.snopes.com/fact-check/charles-manson-endorses-trump/	None	Uncategorized	None	Kim LaCapria	None	Charles Manson Endorses Trump	15 March 2016	None	['Charles_Manson', 'Donald_Trump']
snes-00903	Did a Captured Islamic State Leader Have Barack Obama On Speed Dial?	false	https://www.snopes.com/fact-check/did-captured-islamic-state-obama/	None	Junk News	None	Kim LaCapria	None	Did a Captured Islamic State Leader Have Barack Obama On Speed Dial?	13 March 2018	None	['None']
snes-01192	Author Robert Reich published a list of ten rules to help "resist" the Trump administration in 2018.	misattributed	https://www.snopes.com/fact-check/robert-reichs-rules-2018/	None	Questionable Quotes	None	Dan Evon	None	Robert Reich’s Rules for 2018?	17 January 2018	None	['Robert_Reich']
snes-01291	President Trump issued an order authorizing the U.S. Treasury to freeze the assets of two former First Families, the Obamas and Clintons.	false	https://www.snopes.com/fact-check/trump-eo-seize-assets/	None	Junk News	None	David Mikkelson	None	Did Trump Sign an Executive Order to Seize the Assets of Clinton and Obama?	28 December 2017	None	['Bill_Clinton', 'United_States_Department_of_the_Treasury', 'Family_of_Barack_Obama']
snes-00778	Did President Donald Trump Exempt His Daughter’s Clothing Line From China Tariffs?	mixture	https://www.snopes.com/fact-check/president-donald-trump-exempt-daughters-clothing-line-china-tariffs/	None	Politics	None	Dan Evon	None	Did President Donald Trump Exempt His Daughter’s Clothing Line From China Tariffs?	11 April 2018	None	['None']
snes-02748	A blow to the testicles can kill a man.	unproven	https://www.snopes.com/fact-check/swift-kick-groin-die/	None	Science	None	Alex Kasprak	None	Is It Possible to Kill a Man With a Swift Kick to the Groin?	21 March 2017	None	['None']
snes-04912	A photograph shows a female wolf protecting a male's throat during a fight.	miscaptioned	https://www.snopes.com/fact-check/wolf-fight-female-throat/	None	Fauxtography	None	Dan Evon	None	Female Wolf Protects Male’s Throat During Fight	15 April 2016	None	['None']
snes-04747	Dallas Cowboys quarterback Tony Romo was arrested for using a men's bathroom in North Carolina.	false	https://www.snopes.com/fact-check/tony-romo-arrested-in-nc/	None	Junk News	None	David Mikkelson	None	Tony Romo Arrested in North Carolina for Using Men’s Bathroom	18 May 2016	None	['Tony_Romo', 'Dallas_Cowboys', 'North_Carolina']
snes-03472	Edward Snowden claimed that Russia fixed the 2016 general election so Donald Trump would win.	false	https://www.snopes.com/fact-check/edward-snowden-said-russia-successfully-rigged-u-s-elections-in-favor-of-trump/	None	Junk News	None	Kim LaCapria	None	Edward Snowden Said Russia Successfully Rigged U.S. Elections In Favor Of Trump	27 November 2016	None	['Russia', 'Donald_Trump']
snes-02442	Sargento cheese was recalled on 9 May 2017 (or in August/September 2017), because it might kill your whole family.	outdated	https://www.snopes.com/fact-check/sargento-recall-fake-news/	None	Junk News	None	Kim LaCapria	None	Was Sargento Brand Cheese Recalled in August or September 2017?	12 May 2017	None	['None']
snes-04022	A Certified Registration of Birth issued in Kenya documents that Barack Obama was born in that country.	false	https://www.snopes.com/fact-check/kenyan-mistake/	None	Politicians	None	David Mikkelson	None	Obama’s Kenyan Certified Registration of Birth	7 August 2009	None	['Kenya', 'Barack_Obama']
snes-04067	A photograph taken by a responding police officer shows a couple passed out in their vehicle from a suspected heroin overdose, with their child in the back seat.	true	https://www.snopes.com/fact-check/heroin-od-with-child-in-car/	None	Fauxtography	None	Bethania Palma	None	Ohio Police Post Graphic Photograph of Adults Passed Out from Heroin with Child in Car	9 September 2016	None	['None']
snes-06169	An illustration from a withdrawn Yellow Pages ad reveals a risqué image when a portion of it is viewed upside-down.	true	https://www.snopes.com/fact-check/i-am-curious-yellow-pages/	None	Risqué Business	None	David Mikkelson	None	I Am Curious (Yellow Pages)	7 January 2006	None	['None']
