tron-00224	The new September 11 postage stamp	fiction!	https://www.truthorfiction.com/9-11stamp/	None	9-11-attack	None	None	None	The new September 11 postage stamp	Mar 17, 2015	None	['None']
tron-00696	Paul Harvey and David Limbaugh review “The Passion”	truth! & fiction!	https://www.truthorfiction.com/passion-reviews/	None	celebrities	None	None	None	Paul Harvey and David Limbaugh review “The Passion”	Mar 17, 2015	None	['None']
tron-01123	Mother of Officer Killed by Illegal Immigrant Wrote President Obama	truth!	https://www.truthorfiction.com/brandon-mendoza/	None	crime-police	None	None	None	Mother of Officer Killed by Illegal Immigrant Wrote President Obama	Mar 17, 2015	None	['None']
tron-02805	Obama said he campaigned in 57 U.S. states	truth! & fiction!	https://www.truthorfiction.com/obama-57-states/	None	obama	None	None	None	Obama said he campaigned in 57 U.S. states	Mar 17, 2015	None	['United_States', 'Barack_Obama']
tron-00850	Democratic Senator Hal Lindsay Arrested, Dies in Custody	fiction!	https://www.truthorfiction.com/hal-lindsay-arrested-dies-custody/	None	clintons	None	None	['congress', 'conspiracy', 'fake news', 'the clintons']	Democratic Senator Hal Lindsay Arrested, Dies in Custody	Jun 12, 2017	None	['None']
tron-03000	Trump Accuser Jessica Leads Tied to Clinton Foundation	fiction!	https://www.truthorfiction.com/trump-accuser-jessica-leads-tied-clinton-foundation/	None	politics	None	None	['2016 election', 'donald trump', 'hillary clinton']	Trump Accuser Jessica Leads Tied to Clinton Foundation	Oct 14, 2016	None	['None']
tron-00470	Burning mouse takes revenge by burning down house	fiction!	https://www.truthorfiction.com/mouse-revenge/	None	animals	None	None	None	Burning mouse takes revenge by burning down house	Mar 17, 2015	None	['None']
tron-00212	Koran 9:11 refers to the war in iraq?	fiction!	https://www.truthorfiction.com/koran-war/	None	9-11-attack	None	None	None	Koran 9:11 refers to the war in iraq?	Mar 17, 2015	None	['None']
tron-00079	DNC Staffer Leaked Emails to Wikileaks, Not Russia	disputed!	https://www.truthorfiction.com/dnc-staffer-leaked-emails-wikieaks-not-russia/	None	9-11-attack	None	None	['2016 election', 'dnc', 'foreign leaders']	DNC Staffer Leaked Emails to Wikileaks, Not Russia	Dec 20, 2016	None	['None']
tron-03451	Soviet Scientists drilled into hell	fiction!	https://www.truthorfiction.com/drillingtohell/	None	religious	None	None	None	Soviet Scientists drilled into hell	Mar 17, 2015	None	['None']
tron-03235	Meet Maine ‘s New Governor Paul R. LePage	opinion!	https://www.truthorfiction.com/meet-lepage/	None	politics	None	None	None	Meet Maine ‘s New Governor Paul R. LePage	Mar 17, 2015	None	['None']
tron-02726	Malia Obama Expelled From Harvard for Smoking Marijuana	fiction!	https://www.truthorfiction.com/malia-obama-expelled-harvard/	None	obama	None	None	['barack obama', 'michelle obama', 'obama family']	Malia Obama Expelled From Harvard for Smoking Marijuana	Apr 10, 2017	None	['None']
tron-02103	Stray Dog Rescues Abandoned Baby	truth!	https://www.truthorfiction.com/dog-rescues-baby/	None	inspirational	None	None	None	Stray Dog Rescues Abandoned Baby	Mar 17, 2015	None	['None']
tron-02368	Parents of Fallen SEAL Team 6 Officer Call for Obama’s Resignation	authorship confirmed!	https://www.truthorfiction.com/vaughn-letter/	None	military	None	None	None	Parents of Fallen SEAL Team 6 Officer Call for Obama’s Resignation–Authorship Confirmed!	Mar 17, 2015	None	['None']
tron-01745	Burlington Northern Santa Fe Railroad is Why Keystone Was Not Approved	fiction!	https://www.truthorfiction.com/burlington-rail-road/	None	government	None	None	None	Burlington Northern Santa Fe Railroad is Why Keystone Was Not Approved	Mar 17, 2015	None	['None']
tron-03028	The Media Is Lying: Trump is Actually Beating Clinton in Polls	mostly fiction!	https://www.truthorfiction.com/media-lying-trump-actually-beating-clinton-polls/	None	politics	None	None	['2016 election', 'donald trump', 'hillary clinton', 'media']	The Media Is Lying: Trump is Actually Beating Clinton in Polls	Aug 24, 2016	None	['None']
tron-01007	Military Plans to Confiscate Guns From Private American Citizens	fiction!	https://www.truthorfiction.com/military-plans-confiscate-privately-owned-guns-americans-fiction/	None	crime-police	None	None	['2nd amendment', 'florida', 'guns', 'mass shooting']	Military Plans to Confiscate Privately-Owned Guns From Americans	Feb 26, 2018	None	['None']
tron-02021	10,000 Passports Seized in Bulgaria Were Bound for Islamic Terrorists	truth! & fiction!	https://www.truthorfiction.com/10000-passports-seized-in-bulgaria-were-bound-for-islamic-terrorists/	None	immigration	None	None	None	10,000 Passports Seized in Bulgaria Were Bound for Islamic Terrorists	Oct 12, 2015	None	['Bulgaria']
tron-02403	Military Service of Jeremiah Wright	truth!	https://www.truthorfiction.com/jeremiah-wright/	None	military	None	None	None	Military Service of Jeremiah Wright	Mar 17, 2015	None	['None']
tron-00765	Madonna is doing a scene of the crucifixion	truth!	https://www.truthorfiction.com/madonna-cross/	None	celebrities	None	None	None	Madonna is doing a scene of the crucifixion	Mar 17, 2015	None	['None']
tron-00735	George Carlin or Bill Boudreax comment on New Orleans	fiction!	https://www.truthorfiction.com/carlin-on-new-orleans/	None	celebrities	None	None	None	George Carlin or Bill Boudreax comment on New Orleans	Mar 17, 2015	None	['New_Orleans']
tron-02927	Judge Orders Vince Foster Exhumed in Clinton Murder Investigation	fiction!	https://www.truthorfiction.com/judge-orders-vince-foster-exhumed/	None	politics	None	None	['congress', 'conspiracy', 'fbi', 'hillary clinton', 'the clintons']	Judge Orders Vince Foster Exhumed in Clinton Murder Investigation	Mar 23, 2017	None	['None']
tron-01621	Call Governor Rick Perry’s Office in Texas to Get Prayer Back in Schools	fiction!	https://www.truthorfiction.com/texas-schoolprayer/	None	government	None	None	None	Call Governor Rick Perry’s Office in Texas to Get Prayer Back in Schools	Mar 17, 2015	None	['Texas', 'Rick_Perry']
tron-02746	President Obama Is a Secret Member of the New Black Panther Party	fiction!	https://www.truthorfiction.com/president-obama-secret-member-new-black-panther-party/	None	obama	None	None	None	President Obama Is a Secret Member of the New Black Panther Party	Jul 15, 2016	None	['None']
tron-00446	Giant Squid Washes up on Santa Monica Beach	fiction!	https://www.truthorfiction.com/giant-squid/	None	animals	None	None	None	Giant Squid Washes up on Santa Monica Beach	Mar 17, 2015	None	['None']
tron-03402	Paul Harvey commentary on faith in America	fiction!	https://www.truthorfiction.com/gholson/	None	religious	None	None	None	Paul Harvey commentary on faith in America	Mar 17, 2015	None	['None']
tron-00273	Fashion Designer Michael Kors Tired of Pretending to Like Black People	fiction!	https://www.truthorfiction.com/fashion-designer-michael-kors-tired-of-pretending-to-like-black-people/	None	9-11-attack	None	None	None	Fashion Designer Michael Kors Tired of Pretending to Like Black People – Fiction!	Mar 17, 2015	None	['None']
tron-03478	Green Moon Will Be Seen in May 2016	fiction!	https://www.truthorfiction.com/green-moon-will-seen-may-2016/	None	space-aviation	None	None	None	Green Moon Will Be Seen in May 2016	Mar 29, 2016	None	['None']
tron-02411	Fort Hood Shooter Still on Payroll	truth!	https://www.truthorfiction.com/ft-hood-shooter-paycheck-052513/	None	military	None	None	None	Fort Hood Shooter Still on Payroll	Mar 17, 2015	None	['None']
tron-02075	The President and a soldier whose hand was amputated	mostly truth!	https://www.truthorfiction.com/bush-tilley/	None	inspirational	None	None	None	The President and a soldier whose hand was amputated	Mar 17, 2015	None	['None']
tron-02683	List of Senior Discounts	truth! & fiction!	https://www.truthorfiction.com/list-of-senior-discounts/	None	money-financial	None	None	['Trending Rumors']	List of Senior Discounts	Apr 9, 2015	None	['None']
tron-00397	Saudi Arabian Racehorse Executed for Being Homosexual	fiction!	https://www.truthorfiction.com/saudi-arabian-racehorse-executed-for-being-homosexual/	None	animals	None	None	None	Saudi Arabian Racehorse Executed for Being Homosexual	Dec 8, 2015	None	['None']
tron-00717	Ben Stein’s Last Column	truth!	https://www.truthorfiction.com/benstein/	None	celebrities	None	None	None	Ben Stein’s Last Column	Mar 17, 2015	None	['None']
tron-00131	Sharia Showdown Looms in Brussels	outdated!	https://www.truthorfiction.com/sharia-showdown-looms-in-brussels/	None	9-11-attack	None	None	None	Sharia Showdown Looms in Brussels	Dec 21, 2015	None	['None']
tron-02093	John McCain Just Got Baptized	fiction!	https://www.truthorfiction.com/mccainbaptized/	None	inspirational	None	None	None	John McCain Just Got Baptized	Mar 17, 2015	None	['None']
tron-00156	The Cross in the Flag	truth!	https://www.truthorfiction.com/cross-flag/	None	9-11-attack	None	None	None	The Cross in the Flag	Mar 28, 2015	None	['None']
tron-00103	Eric Bonner on Hillary Clinton	unproven!	https://www.truthorfiction.com/eric-bonner-on-hillary-clinton/	None	9-11-attack	None	None	None	Eric Bonner on Hillary Clinton	Aug 2, 2016	None	['None']
tron-03373	A Florida Couple Was Arrested for Selling Golden Tickets to Heaven	fiction!	https://www.truthorfiction.com/a-florida-couple-was-arrested-for-selling-golden-tickets-to-heaven/	None	religious	None	None	None	A Florida Couple Was Arrested for Selling Golden Tickets to Heaven	Jun 4, 2015	None	['None']
tron-01741	President’s Brother-In-Law’s Job Saved By Economic Stimulus Check	fiction!	https://www.truthorfiction.com/craig-robinsion-job/	None	government	None	None	None	President’s Brother-In-Law’s Job Saved By Economic Stimulus Check	Mar 17, 2015	None	['None']
tron-01564	Nuclear Deal Sends $150 Billion to Iran	mostly truth!	https://www.truthorfiction.com/nuclear-deal-sends-150-billion-to-iran/	None	government	None	None	None	Nuclear Deal Sends $150 Billion to Iran	Aug 17, 2015	None	['None']
tron-02630	Australian Government Official Says Muslims Who Want to Live by Sharia Law Not Welcome There	truth!	https://www.truthorfiction.com/australian-costello-shari/	None	miscellaneous	None	None	None	Australian Government Official Says Muslims Who Want to Live by Sharia Law Not Welcome There – Truth!	Mar 17, 2015	None	['None']
tron-03625	Ford Motor Company’s support of Gay and Lesbian causes	truth!	https://www.truthorfiction.com/ford-gays/	None	warnings	None	None	None	Ford Motor Company’s support of Gay and Lesbian causes	Mar 17, 2015	None	['None']
tron-00251	Obama Agrees to Resettle 70,000 Muslim Refugees	fiction!	https://www.truthorfiction.com/obama-agrees-to-resettle-70k-muslim-refugees/	None	9-11-attack	None	None	None	Obama Agrees to Resettle 70,000 Muslim Refugees – Fiction!	Mar 17, 2015	None	['None']
tron-03017	Hillary Clinton Meltdown After Matt Lauer Interview	unproven!	https://www.truthorfiction.com/hillary-clinton-meltdown-matt-lauer-interview/	None	politics	None	None	['2016 election', 'hillary clinton', 'media']	Hillary Clinton Meltdown After Matt Lauer Interview	Sep 13, 2016	None	['None']
tron-03208	Sarah Palin NRA Poster Girl?	fiction!	https://www.truthorfiction.com/palin-bikini/	None	politics	None	None	None	Sarah Palin NRA Poster Girl?	Mar 17, 2015	None	['None']
tron-01392	Subway Removes Ham and Bacon to Appease Muslims	truth!	https://www.truthorfiction.com/subway-pork-halal/	None	food	None	None	None	Subway Removes Ham and Bacon to Appease Muslims	Mar 17, 2015	None	['None']
tron-03280	Clinton Email Asks, “Is This What Broke Looks Like”	fiction!	https://www.truthorfiction.com/clinton-email-asks-is-this-what-broke-looks-like/	None	politics	None	None	None	Clinton Email Asks, “Is This What Broke Looks Like” – Fiction!	Mar 13, 2015	None	['None']
tron-01642	A military draft in 2005?	fiction!	https://www.truthorfiction.com/draft/	None	government	None	None	None	A military draft in 2005?	Mar 17, 2015	None	['None']
tron-02097	The Story of Kyle, saved from suicide by a friend	fiction!	https://www.truthorfiction.com/kyle/	None	inspirational	None	None	None	The Story of Kyle, saved from suicide by a friend	Mar 17, 2015	None	['None']
tron-00965	A Funeral Notice by Email	virus!	https://www.truthorfiction.com/funeral-notice/	None	computers	None	None	None	A Funeral Notice by Email	 Mar 17, 2015	None	['None']
tron-03053	Marco Rubio: Orlando Shooting God’s Sign I’m Needed in Senate	fiction!	https://www.truthorfiction.com/marco-rubio-orlando-shooting-sign-im-needed-senate/	None	politics	None	None	None	Marco Rubio: Orlando Shooting God’s Sign I’m Needed in Senate	Jun 24, 2016	None	['None']
tron-02846	Obama the Antichrist?	none	https://www.truthorfiction.com/obama-antichrist/	None	obama	None	None	None	Obama the Antichrist?	Mar 17, 2015	None	['None']
tron-02304	Amateur Divers Find Long-Lost Nuclear Warhead	fiction!	https://www.truthorfiction.com/amateur-divers-find-long-lost-nuclear-warhead/	None	military	None	None	None	Amateur Divers Find Long-Lost Nuclear Warhead	Mar 19, 2015	None	['None']
tron-00093	First Grandma Marian Robinson to Receive $160,000 Lifetime Pension	fiction!	https://www.truthorfiction.com/first-grandma-marian-robinson-receive-160000-lifetime-pension/	None	9-11-attack	None	None	['barack obama', 'government waste', 'satire']	First Grandma Marian Robinson to Receive $160,000 Lifetime Pension	Oct 19, 2016	None	['None']
tron-01427	McDonald’s Busted for Human Meat Fillers	fiction!	https://www.truthorfiction.com/mcdonalds-pink-slime/	None	food	None	None	None	McDonald’s Busted for Human Meat Fillers	Mar 17, 2015	None	['None']
tron-03468	NASA Confirms 15 Days of Darkness in June 2017	fiction!	https://www.truthorfiction.com/15-days-darkness-march-2017/	None	space-aviation	None	None	['conspiracy', 'NASA', 'warnings']	NASA Confirms 15 Days of Darkness in June 2017	Feb 24, 2017	None	['None']
tron-02770	Obama’s Daughters Listed as Senior Staffers on Africa Trip	disputed!	https://www.truthorfiction.com/obama-daughters-staffers-051512/	None	obama	None	None	None	Obama’s Daughters Listed as Senior Staffers on Africa Trip	Mar 17, 2015	None	['None']
tron-01351	Dick Smith Warns of Halal Certification Extortion	fiction!	https://www.truthorfiction.com/dick-smith-warns-of-halal-certification-extortion/	None	food	None	None	None	Dick Smith Warns of Halal Certification Extortion	Dec 2, 2015	None	['None']
tron-02280	Myeshia Johnson “Setting the Record Straight” Facebook Post About Husband’s Death	fiction!	https://www.truthorfiction.com/myeshia-johnson-setting-the-record-straight-facebook-post/	None	military	None	None	['congress', 'donald trump', 'military', 'niger']	Myeshia Johnson “Setting the Record Straight” Facebook Post About Husband’s Death	Oct 23, 2017	None	['None']
tron-00590	CIA Agent Confesses to Murdering Bob Marley on Deathbed	fiction!	https://www.truthorfiction.com/cia-agent-confesses-to-murdering-bob-marle/	None	celebrities	None	None	['assinations', 'celebrities', 'CIA', 'conspiracy']	CIA Agent Confesses to Murdering Bob Marley on Deathbed	Dec 4, 2017	None	['None']
tron-02913	Bernie Sanders Drives $170,000 Audi R8 Sport Car	fiction!	https://www.truthorfiction.com/bernie-sanders-drives-170000-audi-r8-sport-car-fiction/	None	politics	None	None	['2016 election', 'bernie sanders', 'dnc', 'hillary clinton']	Bernie Sanders Drives $170,000 Audi R8 Sport Car	Jun 19, 2017	None	['None']
tron-00059	Clinton Estate a Crime Scene, Steel Barrel Graves Found	fiction!	https://www.truthorfiction.com/clinton-estate-steel-barrel-graves/	None	9-11-attack	None	None	['bill clinton', 'conspiracy', 'hillary clinton', 'the clintons']	Clinton Estate a Crime Scene, Steel Barrel Graves Found	Jun 23, 2017	None	['None']
tron-03308	Free British Airways tickets	fiction!	https://www.truthorfiction.com/britishair/	None	promises	None	None	None	Free British Airways tickets	Mar 16, 2015	None	['British_Airways']
tron-03379	Walmart Started a “Watch List” for Christian Employees	fiction!	https://www.truthorfiction.com/walmart-started-a-watch-list-for-christian-employees/	None	religious	None	None	['Trending Rumors']	Walmart Started a “Watch List” for Christian Employees	Apr 8, 2015	None	['None']
tron-00318	Klingerman Virus is coming to people’s homes in blue envelopes	fiction!	https://www.truthorfiction.com/klingermanvirus/	None	9-11-attack	None	None	None	Klingerman Virus is coming to people’s homes in blue envelopes	Mar 17, 2015	None	['None']
tron-02013	“I Smell a Rat” Column on Syrian Refugees by Eli Gordon	fiction!	https://www.truthorfiction.com/i-smell-a-rat-column-on-syrian-refugees-by-eli-gordon/	None	immigration	None	None	None	“I Smell a Rat” Column on Syrian Refugees by Eli Gordon	Jan 19, 2016	None	['None']
tron-00654	Jake from State Farm Actor Found Dead	fiction!	https://www.truthorfiction.com/jake-from-state-farm-actor-found-dead/	None	celebrities	None	None	None	Jake from State Farm Actor Found Dead	Nov 4, 2015	None	['None']
tron-02256	Five-year-old Faith Hoemspine has cancer and wants all the greeting cards she can get	fiction!	https://www.truthorfiction.com/faithhoemspine/	None	medical	None	None	None	Five-year-old Faith Hoemspine has cancer and wants all the greeting cards she can get	Mar 17, 2015	None	['None']
tron-02561	Quote from Theodore Roosevelt on immigration	truth!	https://www.truthorfiction.com/roosevelt-immigration/	None	miscellaneous	None	None	None	Quote from Theodore Roosevelt on immigration	Mar 17, 2015	None	['Theodore_Roosevelt']
tron-02173	Burn Victim Safyre Terry Asks for Christmas Cards	truth!	https://www.truthorfiction.com/burn-victim-safyre-terry-asks-for-christmas-cards/	None	internet	None	None	None	Burn Victim Safyre Terry Asks for Christmas Cards	Dec 9, 2015	None	['None']
tron-02745	President Obama Adds Islamic Symbols to White House Fence	fiction!	https://www.truthorfiction.com/president-obama-adds-islamic-symbols-white-house-fence/	None	obama	None	None	None	President Obama Adds Islamic Symbols to White House Fence	Jul 22, 2016	None	['None']
tron-01530	Obama Declares June LGBT Pride Month	truth!	https://www.truthorfiction.com/obama-declares-june-lgbt-pride-month/	None	government	None	None	None	Obama Declares June LGBT Pride Month	Jun 2, 2016	None	['None']
tron-03239	Lee Iacocca regarding leadership in America	truth!	https://www.truthorfiction.com/lee-iacocca/	None	politics	None	None	None	Lee Iacocca regarding leadership in America	Mar 17, 2015	None	['None']
tron-03032	Vincent Fleck Found Dead After Hillary Clinton’s Medical Records Leaked	fiction!	https://www.truthorfiction.com/vincent-fleck-found-dead-after-hillary-clintons-medical-records-leaked/	None	politics	None	None	None	Vincent Fleck Found Dead After Hillary Clinton’s Medical Records Leaked	Aug 16, 2016	None	['None']
tron-01852	Procter & Gamble supports a Gay Rights Proposal as Well as Gay Marriage	truth! & fiction!	https://www.truthorfiction.com/pandg-gaymarriage/	None	household	None	None	None	Procter & Gamble supports a Gay Rights Proposal as Well as Gay Marriage	Mar 17, 2015	None	['None']
tron-00099	Olympian Kim Rhode Shunned Because She Loves Guns, Trump	truth! & fiction!	https://www.truthorfiction.com/olympian-kim-rhode-shunned-loves-guns-trump/	None	9-11-attack	None	None	['conservative agenda', 'guns', 'patriotism', 'sports']	Olympian Kim Rhode Shunned Because She Loves Guns, Trump	Aug 19, 2016	None	['None']
tron-01575	Obama Issues Executive Order to Strip Texas of Statehood Ahead of Jade Helm 15	fiction!	https://www.truthorfiction.com/obama-issues-executive-order-to-strip-texas-of-statehood-ahead-of-jade-helm-15/	None	government	None	None	None	Obama Issues Executive Order to Strip Texas of Statehood Ahead of Jade Helm 15	May 26, 2015	None	['None']
tron-02492	Rare Meteor Shower Expected to Delight Sky Watchers	truth! & fiction!	https://www.truthorfiction.com/perseid-meteor-shower/	None	miscellaneous	None	None	None	Rare Meteor Shower Expected to Delight Sky Watchers	Mar 17, 2015	None	['None']
tron-02064	“Eternity” the story of the homeless man in Sydney, Australia who went down in history	truth!	https://www.truthorfiction.com/stace/	None	inspirational	None	None	None	“Eternity” the story of the homeless man in Sydney, Australia who went down in history	Mar 17, 2015	None	['Australia', 'Sydney']
tron-01383	Lawsuit Claims California Wines Have Unsafe Amounts of Arsenic	truth! & misleading!	https://www.truthorfiction.com/lawsuit-claims-california-wines-have-unsafe-amounts-of-arsenic/	None	food	None	None	None	Lawsuit Claims California Wines Have Unsafe Amounts of Arsenic – Truth! & Misleading!	Mar 23, 2015	None	['None']
tron-00233	Guitarist Willie Nelson Has Died	fiction!	https://www.truthorfiction.com/guitarist-willie-nelson-has-died/	None	9-11-attack	None	None	None	Guitarist Willie Nelson Has Died	Mar 17, 2015	None	['None']
tron-01704	2015 Rates for Medicare Part A, Part B Withheld	fiction!	https://www.truthorfiction.com/medicare-ratebook-2015/	None	government	None	None	None	2015 Rates for Medicare Part A, Part B Withheld	Mar 17, 2015	None	['None']
tron-03286	Alabama Coach Paul “Bear” Bryant Carried a Prayer in His Wallet	truth!	https://www.truthorfiction.com/alabama-coach-paul-bear-bryant-carried-a-prayer-in-his-wallet/	None	prayers	None	None	None	Alabama Coach Paul “Bear” Bryant Carried a Prayer in His Wallet	Oct 26, 2015	None	['Alabama']
tron-02969	Hillary Clinton Had Drunken Meltdown after Election Loss	unproven!	https://www.truthorfiction.com/hillary-clinton-drunken-meltdown-election-loss-unproven/	None	politics	None	None	['2016 election', 'donald trump', 'hillary clinton']	Hillary Clinton Had Drunken Meltdown after Election Loss	Nov 16, 2016	None	['None']
tron-02418	Military Members Who Share Their Christian Faith Could Face Court Martial	disputed!	https://www.truthorfiction.com/christians-military-proselytizing-050313/	None	military	None	None	None	Military Members Who Share Their Christian Faith Could Face Court Martial	Mar 17, 2015	None	['None']
tron-03005	Hillary Clinton Wanted to Drone Strike Julian Assange	unproven!	https://www.truthorfiction.com/hillary-clinton-wanted-drone-strike-julian-assange/	None	politics	None	None	['2016 election', 'conspiracy', 'hillary clinton', 'media']	Hillary Clinton Wanted to Drone Strike Julian Assange	Oct 4, 2016	None	['None']
tron-00988	New CD-ROM computer game features panty raids	truth!	https://www.truthorfiction.com/pantyraids/	None	computers	None	None	None	New CD-ROM computer game features panty raids	Mar 17, 2015	None	['None']
tron-02193	Warning of Valentine Virus	truth!	https://www.truthorfiction.com/valentine-virus/	None	internet	None	None	None	Warning of Valentine Virus	Mar 17, 2015	None	['None']
tron-02026	Journalist Tina Griego Penned a Column Titled “Mexican Visitor’s Lament”	incorrect attribution!	https://www.truthorfiction.com/journalist-tina-griego-penned-a-column-titled-mexican-visitors-lament/	None	immigration	None	None	None	Journalist Tina Griego Penned a Column Titled “Mexican Visitor’s Lament”	Aug 5, 2015	None	['None']
tron-02187	Warnings About New Hackers on Facebook	fiction!	https://www.truthorfiction.com/warnings-about-new-hackers-on-facebook/	None	internet	None	None	None	Warnings About New Hackers on Facebook	Aug 12, 2015	None	['None']
tron-00885	Video Warning about Head and Shoulders or Dove Shampoo	fiction!	https://www.truthorfiction.com/head-and-shoulders-warning/	None	computers	None	None	None	Video Warning about Head and Shoulders or Dove Shampoo	Mar 17, 2015	None	['None']
tron-00139	Painting of Dr. Ben Carson and Jesus	truth!	https://www.truthorfiction.com/painting-of-dr-ben-carson-and-jesus/	None	9-11-attack	None	None	None	Painting of Dr. Ben Carson and Jesus	Nov 12, 2015	None	['None']
tron-03368	Gay Man Sues Bible Publishers for Inclusion of “Homosexuality” in the Bible	outdated!	https://www.truthorfiction.com/gay-man-sues-bible-publishers-inclusion-homosexuality-bible/	None	religious	None	None	None	Gay Man Sues Bible Publishers for Inclusion of “Homosexuality” in the Bible	Jul 23, 2015	None	['None']
tron-02708	Help the Victims of the Tsunami	none	https://www.truthorfiction.com/tsunamirelief/	None	natural-disasters	None	None	None	Help the Victims of the Tsunami	Mar 17, 2015	None	['None']
tron-01748	“Brain Surgeon” Confirms Obamacare Strategy To Use Death Panels For Seniors Who Require Advanced Neurological Treatment	fiction!	https://www.truthorfiction.com/brain-surgeon-obamacare/	None	government	None	None	None	“Brain Surgeon” Confirms Obamacare Strategy To Use Death Panels For Seniors Who Require Advanced Neurological Treatment	Mar 17, 2015	None	['None']
tron-01404	Free salads from McDonald’s	fiction!	https://www.truthorfiction.com/freesalad/	None	food	None	None	None	Free salads from McDonald’s	Mar 17, 2015	None	['None']
tron-02811	Barack Obama Said That His Father Served in World War II	truth!	https://www.truthorfiction.com/obama-sr-wwii/	None	obama	None	None	None	Barack Obama Said That His Father Served in World War II	Mar 17, 2015	None	['None']
tron-00821	Write In Bill Cosby For President	fiction!	https://www.truthorfiction.com/bill-cosby-president/	None	celebrities	None	None	None	Write In Bill Cosby For President	Mar 17, 2015	None	['None']
tron-01921	President Obama Reported Sedated After Emotional Breakdown	fiction! & satire!	https://www.truthorfiction.com/potus-breakdown-092413/	None	humorous	None	None	None	President Obama Reported Sedated After Emotional Breakdown	Mar 17, 2015	None	['None']
tron-00537	Walmart Coupon: 85% Off Any Purchase to Celebrate Shopping Week	scam!	https://www.truthorfiction.com/walmart-coupon-85-percent/	None	business	None	None	['coupons', 'facebook', 'walmart']	Walmart Coupon: 85% Off Any Store Wide Purchase	Jul 15, 2017	None	['None']
