snes-01683	Donald Trump Doesn't Salute the Flag?	false	https://www.snopes.com/fact-check/donald-trump-flag-salute/	None	Politics	None	David Mikkelson	None	Donald Trump Doesn’t Salute the Flag?	20 December 2015	None	['None']
snes-01583	Barack Obama said he would replace the U.S. national anthem with the song 'I'd Like to Teach the World to Sing.'	false	https://www.snopes.com/fact-check/national-anthem-stance/	None	Junk News	None	David Mikkelson	None	Obama Explains National Anthem Stance?	15 February 2008	None	['United_States', 'Barack_Obama']
snes-01503	Poisoned Halloween Candy	false	https://www.snopes.com/fact-check/halloween-non-poisonings/	None	Horrors	None	Snopes Staff	None	Poisoned Halloween Candy	2 November 2000	None	['None']
snes-02222	"A furious Chelsea Clinton" was handcuffed and dragged away after Sen. Hal Lindsay exposed Clinton corruption.	false	https://www.snopes.com/fact-check/chelsea-clinton-arrested/	None	Junk News	None	Dan Evon	None	Was Chelsea Clinton ‘Thrown to the Floor’ and Handcuffed?	12 June 2017	None	['Chelsea_Clinton', 'Bill_Clinton']
snes-04858	A transgender woman was arrested to taking pictures of underage girls at a Target in Dallas.	false	https://www.snopes.com/fact-check/transgender-arrested-target-photos/	None	Junk News	None	Dan Evon	None	Transgender Woman Arrested for Taking Pictures of Underage Girls at Target	27 April 2016	None	['Dallas']
snes-03521	The characteristics of stereotypical millennial liberals make them less competitive, because they are in discord with the natural world.	false	https://www.snopes.com/fact-check/liberal-college-millennials-less-biologically-fit/	None	Science	None	Alex Kasprak	None	Liberal College Millennials Are Less Biologically Fit Than ‘Real Americans’?	17 November 2016	None	['None']
snes-06215	Article details treatment of women in the Muslim world.	mixture	https://www.snopes.com/fact-check/joys-muslim-women-nonie-darwish/	None	Uncategorized	None	David Mikkelson	None	Joys of Muslim Women – Nonie Darwish	30 August 2010	None	['None']
snes-03048	White House Press Secretary Sean Spicer retweeted a satirical item from 'The Onion' about himself.	true	https://www.snopes.com/fact-check/sean-spicer-onion-retweet/	None	Fauxtography	None	Kim LaCapria	None	Did Sean Spicer Retweet a Satirical Onion Video About Himself?	30 January 2017	None	['None']
snes-03755	President Obama passed a law enabling food stamp recipients to use their benefits to purchase hot food.	false	https://www.snopes.com/fact-check/obama-hot-food-stamps/	None	Junk News	None	Kim LaCapria	None	President Obama Allows Hot Food to be Purchased with Food Stamps	20 October 2016	None	['Barack_Obama']
snes-01697	Jeff Goldblum criticized Mark Zuckerberg and Elon Musk for being capitalists during an MTV interview.	false	https://www.snopes.com/fact-check/jeff-goldblum-musk-zuckerberg/	None	Entertainment	None	Dan Evon	None	Did Jeff Goldblum ‘Trash’ Elon Musk and Mark Zuckerberg?	20 September 2017	None	['Mark_Zuckerberg', 'Elon_Musk', 'MTV']
snes-00646	A photograph shows a purple horned winged lizard.	false	https://www.snopes.com/fact-check/purple-horned-winged-lizard/	None	Fauxtography	None	Dan Evon	None	Is This a Purple Horned Winged Lizard?	7 May 2018	None	['None']
snes-04263	Fifty Republican former national security officials issued an open letter affirming they would not vote for Donald Trump and deeming him dangerously unqualified.	true	https://www.snopes.com/fact-check/national-security-officials-disavow-trump/	None	Ballot Box	None	Kim LaCapria	None	Fifty Former National Security Officials Disavow Trump in Formal Statement	11 August 2016	None	['Republican_Party_(United_States)', 'Donald_Trump']
snes-04416	Michelle Obama plagiarized parts of her 2008 Democratic National Convention speech from 'The 7 Habits of Highly Effective People' author Stephen R. Covey.	false	https://www.snopes.com/fact-check/michelle-obama-plagiarized-stephen-r-covey/	None	Politics	None	David Emery	None	Michelle Obama Plagiarized Her 2008 DNC Speech from Stephen R. Covey	19 July 2016	None	['Michelle_Obama', 'Democratic_National_Convention']
snes-03537	Russian President Vladimir Putin issued an arrest warrant for George Soros.	false	https://www.snopes.com/fact-check/putin-issues-arrest-warrant-for-george-soros/	None	Junk News	None	Bethania Palma	None	Did Putin Issue an Arrest Warrant for George Soros?	15 November 2016	None	['Russia', 'Vladimir_Putin', 'George_Soros']
snes-00203	U.S. Supreme Court nominee Brett Kavanaugh argued that disabled people could be forced to have elective surgeries, including abortions.	mixture	https://www.snopes.com/fact-check/kavanaugh-disabilities-elective-surgeries/	None	Politics	None	Bethania Palma	None	Did Brett Kavanaugh Argue That People with Disabilities Could Be Forced to Undergo Elective Surgeries, Including Abortions?	16 August 2018	None	['None']
snes-04234	Police opened fire on a store mannequin after it failed to follow their orders.	false	https://www.snopes.com/fact-check/police-shoot-department-store-mannequin-67-times-after-mistaking-it-for-gunman/	None	Junk News	None	Kim LaCapria	None	Police Shoot Department Store Mannequin 67 Times After Mistaking it for Gunman	16 August 2016	None	['None']
snes-04252	Mike Pence once said that condoms are "too modern" and "too liberal" and offer a poor defense against sexually transmitted diseases.	mostly true	https://www.snopes.com/fact-check/mike-pence-condoms-are-too-modern-and-liberal/	None	Politics	None	Kim LaCapria	None	Mike Pence: ‘Condoms Are Too Modern and Liberal’	14 August 2016	None	['Mike_Pence']
snes-02048	Detergent pods eventually cause the clogging of household drains, leading to expensive repair bills.	unproven	https://www.snopes.com/fact-check/detergent-pods-warning/	None	Inboxer Rebellion	None	Kim LaCapria	None	Do Detergent Pods Clog Drains?	18 July 2017	None	['None']
snes-04146	Eleven states have banned the use of electronic cigarettes inside cars.	false	https://www.snopes.com/fact-check/11-states-ban-ecigs-in-cars/	None	Junk News	None	Kim LaCapria	None	11 States Ban the Use of Electronic Cigarettes in Vehicles?	29 August 2016	None	['None']
snes-05481	Toddlers killed more Americans than terrorists in 2015.	true	https://www.snopes.com/fact-check/toddlers-killed-americans-terrorists/	None	Guns	None	Kim LaCapria	None	Toddlers Killed More Americans than Terrorists in 2015	17 December 2015	None	['United_States']
snes-00032	Did Christine Blasey Ford’s Brother Work with a Close Relative of Peter Strzok’s?	false	https://www.snopes.com/fact-check/christine-blasey-ford-peter-strzok/	None	Politics	None	David Emery	None	Did Christine Blasey Ford’s Brother Work with a Close Relative of Peter Strzok’s?	1 October 2018	None	['None']
snes-00554	Was CNN Raided by the FCC for ‘Deceiving the American Public’?	false	https://www.snopes.com/fact-check/cnn-fcc-broadcast-journalism/	None	Junk News	None	David Mikkelson	None	Was CNN Raided by the FCC for ‘Deceiving the American Public’?	24 May 2018	None	['None']
snes-05117	A bloody knife was recently uncovered on the grounds of O.J. Simpson's former home.	mixture	https://www.snopes.com/fact-check/o-j-simpson-case-knife-claim/	None	Crime	None	Kim LaCapria	None	O.J. Simpson Case Knife Claim	4 March 2016	None	['O._J._Simpson']
snes-02344	Bill Murray and Hunter S. Thompson were photographed wearing shirts reading "Buy Me Brunch" and "Polite as Fuck."	false	https://www.snopes.com/fact-check/bill-murray-hunter-s-thompson-t-shirts/	None	Fauxtography	None	Dan Evon	None	Bill Murray and Hunter S. Thompson Wore Vulgar T-Shirts?	25 May 2017	None	['Bill_Murray', 'Hunter_S._Thompson']
snes-04430	Donald Trump and Mike Pence did not steal their campaign logo from a Nevada brothel.	false	https://www.snopes.com/fact-check/donald-trump-mike-pence-logo/	None	Fauxtography	None	Dan Evon	None	Trump/Pence Logo Taken from ‘T Laying P Ranch’	18 July 2016	None	['Nevada', 'Donald_Trump', 'Mike_Pence']
snes-05929	Listing provides statistics about the number and costs of undocumented immigrants in Los Angeles County.	mixture	https://www.snopes.com/fact-check/just-one-state-cost-illegals-los-angeles/	None	Immigration	None	David Mikkelson	None	Just One State – Cost of ‘Illegals’ in Los Angeles	3 May 2006	None	['Los_Angeles_County,_California']
snes-03866	Jodi Arias was granted an early release from prison after an incident with correctional officers	false	https://www.snopes.com/fact-check/jodi-arias-to-be-released/	None	Junk News	None	Kim LaCapria	None	Was Jodi Arias Released from Prison After ‘Incident’ with Correctional Officers?	6 October 2016	None	['None']
snes-05201	Marine vet Christopher Marquez was assaulted at a Washington, D.C., McDonald's retaurant by Black Lives Matter activists.	mixture	https://www.snopes.com/fact-check/marine-attack-blm-claim/	None	Politics	None	Kim LaCapria	None	Marine Assaulted at McDonald’s by Black Lives Matter Activists?	17 February 2016	None	['Washington,_D.C.']
snes-05256	A photograph shows Mother Teresa at age 18.	false	https://www.snopes.com/fact-check/mother-teresa-age-18/	None	Fauxtography	None	Dan Evon	None	Mother Teresa at 18	6 February 2016	None	['Mother_Teresa']
snes-04298	Donald Trump donated $50,000 to ensure suspected Charleston church shooter Dylann Roof was transferred to a "safer" prison.	false	https://www.snopes.com/fact-check/trump-donates-50k-to-charleston-shooter-family-to-move-him-to-safer-prison/	None	Junk News	None	Kim LaCapria	None	Trump Donates 50k to Charleston Shooter Family to Move Him to Safer Prison	8 August 2016	None	['None']
snes-01857	Green Bay Packers coach Mike McCarthy put something on the field that "pissed off" his "racist" players.	false	https://www.snopes.com/fact-check/green-bay-coach-racist-field/	None	Uncategorized	None	Bethania Palma	None	Did the Green Bay Packers Coach Just ‘Piss Off’ His ‘Racist’ Players With What He Put on the Field?	23 August 2017	None	['Green_Bay_Packers', 'Mike_McCarthy_(American_football)']
snes-04565	Yellowstone was evacuated in June 2016 after experts warned of an imminent volcanic eruption.	false	https://www.snopes.com/fact-check/yellowstone-evacuation-volcano/	None	Junk News	None	Dan Evon	None	Yellowstone Evacuated Due to Volcanic Eruption	23 June 2016	None	['None']
snes-05709	A few drops of Visine brand eye drops taken internally will induce uncontrollable diarrhea.	false	https://www.snopes.com/fact-check/visine-diarrhea-prank/	None	Medical	None	Snopes Staff	None	Will a Few Drops of Visine Taken Internally Cause Diarrhea?	2 September 2003	None	['None']
snes-01558	An image shows a lawmaker's underwear as she leans over a desk.	false	https://www.snopes.com/fact-check/lawmakers-thong-shows-during-swearing-in/	None	Fauxtography	None	Dan Evon	None	Lawmaker’s Thong Showed During Swearing-In Ceremony?	19 October 2017	None	['None']
snes-00860	People have begun licking toilets as a form of protest against United States President Donald Trump.	false	https://www.snopes.com/fact-check/toilet-licking-trump-protest/	None	Politics	None	Dan MacGuill	None	Did People Start Licking Toilets as a Protest Against Donald Trump?	21 March 2018	None	['United_States', 'Donald_Trump']
snes-02034	That Hillary Clinton opposed sanctions against Russia because of speaking fees her husband received from a Russian bank, and that the Clinton campaign used undue influence to kill a Bloomberg story about the incident.	unproven	https://www.snopes.com/fact-check/hillary-bill-clinton-russia-sanctions-speech/	None	Uncategorized	None	Bethania Palma	None	Did Hillary Clinton Side With Kremlin on Sanctions Due to a $500,000 Payment to Bill?	20 July 2017	None	['Russia', 'Bill_Clinton', 'Hillary_Rodham_Clinton', 'Bloomberg_L.P.']
snes-03888	Donald Trump said veterans suffering from PTSD are "weak," "unfit," and "can't handle" military service.	mostly false	https://www.snopes.com/fact-check/donald-trump-didnt-say-vets-with-ptsd-are-weak/	None	Ballot Box	None	Kim LaCapria	None	Donald Trump Didn’t Say Vets with PTSD Are ‘Weak’	4 October 2016	None	['Posttraumatic_stress_disorder']
snes-03897	Pat Robertson advised men whose wives are voting for Hillary Clinton to "boycott sex" until they changed their minds.	false	https://www.snopes.com/fact-check/pat-robertson-boycott-hillary/	None	Junk News	None	Kim LaCapria	None	Pat Robertson Says Husbands Must Boycott Sex with Wives Voting Hillary	3 October 2016	None	['Pat_Robertson', 'Hillary_Rodham_Clinton']
snes-03708	A photograph shows a man with the word "Trump" tattooed across his forehead.	false	https://www.snopes.com/fact-check/trump-forehead-tattoo/	None	Fauxtography	None	Dan Evon	None	Trump Forehead Tattoo	25 October 2016	None	['None']
snes-02259	Fox News showed a parody account for Reality Winner during a live broadcast.	false	https://www.snopes.com/fact-check/fox-news-reality-winner-parody-account-broadcast/	None	Fauxtography	None	Dan Evon	None	Did Fox News Use a Reality Winner Parody Twitter Account During a Live Broadcast?	6 June 2017	None	['None']
snes-03510	Time itself is speeding up and we actually perceive a 24-hour day as a 16-hour day.	false	https://www.snopes.com/fact-check/our-days-feel-shorter-because-time-is-literally-speeding-up/	None	Science	None	Alex Kasprak	None	Our Days Feel Shorter Because Time Is Literally Speeding Up	19 November 2016	None	['None']
snes-01624	Australian Gun Stats	false	https://www.snopes.com/fact-check/australian-guns/	None	Politics	None	David Mikkelson	None	Australian Gun Stats	20 August 2001	None	['None']
snes-01643	The Hollywood Reporter published a column in 1937 criticizing actors for speaking out against Nazi Germany.	true	https://www.snopes.com/fact-check/thr-nazis-1937/	None	Politics	None	Arturo Garcia	None	Did the Hollywood Reporter Criticize Actors Who Opposed Nazi Germany in 1937?	1 October 2017	None	['None']
snes-00562	In May 2018, Oklahoma gubernatorial candidate Christopher Barnett advocated euthanasia for disabled people and those on benefits.	unproven	https://www.snopes.com/fact-check/oklahoma-euthanasia-christopher-barnett/	None	Politics	None	Dan MacGuill	None	Did a Candidate for Governor of Oklahoma Call for Disabled People to be Euthanized?	22 May 2018	None	['Oklahoma']
snes-05204	Donald Trump boasted in a tweet that Jeb Bush failed to renew his domain registration, enabling Trump's campaign to redirect it to Trump's web site.	mixture	https://www.snopes.com/fact-check/trump-taunts-bush-twitter/	None	Politicians	None	Kim LaCapria	None	Donald Trump Taunts Jeb Bush on Twitter over Domain?	16 February 2016	None	['Donald_Trump', 'Jeb_Bush']
snes-04219	A tweet reproduces a 90-second long sentence from a Donald Trump speech.	true	https://www.snopes.com/fact-check/donald-trump-sentence/	None	Politics	None	David Mikkelson	None	Donald Trump’s ‘Nuclear’ Speech	17 August 2016	None	['None']
snes-00576	Eddie Murphy Death	false	https://www.snopes.com/fact-check/eddie-murphy-death-hoax/	None	Junk News	None	Kim LaCapria	None	Eddie Murphy Death Hoax	19 May 2018	None	['None']
snes-06068	President Obama has issued a whopping 923 executive orders, many of which give the government unprecedented power to take over control of civilian institutions.	false	https://www.snopes.com/fact-check/false-executive-orders/	None	Politicians	None	David Mikkelson	None	Executive Orders	4 September 2012	None	['Barack_Obama']
snes-02544	Was Chelsea Clinton Arrested for Having Sex With a 13 Year-Old Boy?	false	https://www.snopes.com/fact-check/chelsea-clinton-arrest-13-year-old/	None	Junk News	None	Dan Evon	None	Chelsea Clinton Was Arrested for Having Sex With a 13 Year-Old Boy?	25 April 2017	None	['Chelsea_Clinton']
snes-03095	Capsaicin, the spice-causing molecule in chili peppers, can help beat breast cancer.	unproven	https://www.snopes.com/fact-check/spicy-peppers-breast-cancer/	None	Medical	None	Alex Kasprak	None	Can a Chemical in Spicy Peppers Help Cure Breast Cancer?	20 January 2017	None	['None']
snes-04705	Donald Trump improperly received $150,000 in federal aid earmarked for small businesses damaged by the 9/11 attacks, despite the fact his business was neither small nor damaged in the attacks.	mostly false	https://www.snopes.com/fact-check/trump-911-small-business-fund/	None	Politics	None	Snopes Staff	None	Did Donald Trump Take $150K from the 9/11 Small Business Fund?	26 May 2016	None	['None']
snes-01601	Did Colin Kaepernick Say He Would Stand for the National Anthem If Signed by an NFL Team?	false	https://www.snopes.com/fact-check/kaepernick-anthemk-stand-if-signed/	None	Sports	None	Dan MacGuill	None	Did Colin Kaepernick Say He Would Stand for the National Anthem If Signed by an NFL Team?	11 October 2017	None	['None']
snes-05049	Floyd Mayweather wore a Muslim headscarf to a Donald Trump rally.	false	https://www.snopes.com/fact-check/floyd-mayweather-muslim-headwear/	None	Uncategorized	None	Dan Evon	None	Floyd Mayweather Wore Hijab to Donald Trump Rally	17 March 2016	None	['Donald_Trump', 'Floyd_Mayweather,_Jr.']
snes-03196	A photograph shows Jesse Owens and Hitler shaking hands at the 1936 Olympics.	false	https://www.snopes.com/fact-check/jesse-owens-and-hitler-handshake/	None	Fauxtography	None	Dan Evon	None	Jesse Owens and Hitler Shook Hands at the 1936 Summer Olympics?	6 January 2017	None	['Jesse_Owens', 'Adolf_Hitler']
snes-02564	Julian Assange was kidnapped from the Ecuadorean embassy in London and murdered in April 2017.	false	https://www.snopes.com/fact-check/assange-dead-london-alley/	None	Junk News	None	Kim LaCapria	None	Was Julian Assange Found Dead in a London Alley?	21 April 2017	None	['London', 'Ecuador', 'Julian_Assange']
snes-00918	Amazon's Alexa randomly plays a "creepy laugh."	mixture	https://www.snopes.com/fact-check/is-amazons-alexa-emitting-unprompted-creepy-laughing/	None	Business	None	Kim LaCapria	None	Is Amazon’s Alexa Creepily Laughing for No Apparent Reason?	8 March 2018	None	['None']
snes-04271	Actor Gary Sinise posted a witty retort after Hillary Clinton tweeted a message about gun control.	false	https://www.snopes.com/fact-check/gary-sinise-hillary-clinton-twitter/	None	Junk News	None	Dan Evon	None	Gary Sinise Tweets Hillary Clinton About Guns	11 August 2016	None	['None']
snes-00806	The Environmental Protection Agency will ban manmade snow after dihydrogen monoxide was found.	false	https://www.snopes.com/fact-check/will-the-epa-ban-manmade-snow/	None	Humor	None	Bethania Palma	None	Is the EPA Banning Manmade Snow Due to High Concentrations of Dihydrogen Monoxide?	5 April 2018	None	['None']
snes-01473	Meteorologists predicted a "devastating snowfall" for parts of Montana in early 2018.	false	https://www.snopes.com/fact-check/devastating-snowfall-predicted-nw-montana-early-2018/	None	Junk News	None	Kim LaCapria	None	Devastating Snowfall Predicted For NW Montana In Early 2018?	6 November 2017	None	['Montana']
snes-03422	Recount observers in Wisconsin discovered voting machines seals had been compromised after the 2016 general election.	false	https://www.snopes.com/fact-check/wisconsin-recount-observers-find-voting-machines-broken-seals/	None	Conspiracy Theories	None	Kim LaCapria	None	Wisconsin Recount Observers Find Voting Machines with Broken Seals?	3 December 2016	None	['Wisconsin']
snes-02096	A lottery winner died after attempting to gold-plate his testicles.	false	https://www.snopes.com/fact-check/lottery-winner-dies-gold-plating/	None	Junk News	None	Kim LaCapria	None	Atlanta Lottery Winner Dies After Gold Plating His Testicles?	29 November 2015	None	['None']
snes-05195	Donald Trump bashed Jesus, saying that he could save America without some "silly cross."	false	https://www.snopes.com/fact-check/donald-trump-bashes-jesus/	None	Junk News	None	Dan Evon	None	Donald Trump Bashes Jesus, Says He Can Save America?	18 February 2016	None	['United_States', 'Jesus', 'Donald_Trump']
snes-05812	The Dick Act passed in 1903 "invalidates all gun control laws" in the U.S.	false	https://www.snopes.com/fact-check/dick-act-of-1902/	None	Guns	None	David Mikkelson	None	Dick Act of 1902	2 February 2013	None	['United_States']
snes-00126	An image shows a pumpkin spice bologna product from Oscar Mayer.	false	https://www.snopes.com/fact-check/oscar-mayer-offer-pumpkin-spice-bologna/	None	Fauxtography	None	Dan Evon	None	Does Oscar Mayer Offer Pumpkin Spice Bologna?	6 September 2018	None	['None']
snes-05046	Keith Richards once pulled a knife on Donald Trump.	mixture	https://www.snopes.com/fact-check/keith-richards-knife-donald-trump/	None	Uncategorized	None	Dan Evon	None	Keith Richards Pulled a Knife on Donald Trump	18 March 2016	None	['Keith_Richards', 'Donald_Trump']
snes-01999	Penn State's Joe Paterno said "when you get into the end zone, act like you've been there before."	true	https://www.snopes.com/fact-check/act-like-youve-been-there-before/	None	Sports	None	Dan Evon	None	What Football Coach Said ‘Act Like You’ve Been There Before’?	27 July 2017	None	['None']
snes-00497	Did Paul Krugman Say the Internet’s Effect on the World Economy Would Be ‘No Greater Than the Fax Machine’s’?	true	https://www.snopes.com/fact-check/paul-krugman-internets-effect-economy/	None	Questionable Quotes	None	David Emery	None	Did Paul Krugman Say the Internet’s Effect on the World Economy Would Be ‘No Greater Than the Fax Machine’s’?	7 June 2018	None	['Paul_Krugman']
snes-00747	Is Starbucks Offering Coupons for Black Customers Only?	false	https://www.snopes.com/fact-check/starbucks-coupon-for-black-customers-only/	None	Fauxtography	None	Dan Evon	None	Is Starbucks Offering Coupons for Black Customers Only?	18 April 2018	None	['None']
snes-06065	The number of hooves lifted into the air on equestrian statues reveals how the riders died.	false	https://www.snopes.com/fact-check/statue-of-limitations/	None	History	None	David Mikkelson	None	Rider on Horseback Statue Code	31 December 1998	None	['None']
snes-03292	Donald Jr. and Eric Trump sold access to their father via an expensive hunting fundraiser.	mixture	https://www.snopes.com/fact-check/trump-sons-fundraiser/	None	Politicians	None	Dan Evon	None	Trump Sons Sell Access to Father for Hunting Trip Fundraiser	21 December 2016	None	['None']
snes-02750	Anthony Weiner Placed in Protective Custody -- Will Turn State’s Evidence Against Hillary?	false	https://www.snopes.com/fact-check/anthony-weiner-protective-custody/	None	Junk News	None	Dan Evon	None	Anthony Weiner Placed in Protective Custody — Will Turn State’s Evidence Against Hillary?	21 March 2017	None	['None']
snes-03358	There are more trees on Earth than there are stars in the Milky Way galaxy.	true	https://www.snopes.com/fact-check/are-there-more-trees-on-earth-than-there-are-stars-in-the-milky-way/	None	Science	None	Alex Kasprak	None	Are There More Trees on Earth Than There Are Stars in the Milky Way?	12 December 2016	None	['Milky_Way', 'Earth']
snes-01959	List describes the duties and obligations of honor guards at the Tomb of the Unknown Soldier.	mixture	https://www.snopes.com/fact-check/honor-guard/	None	Uncategorized	None	David Mikkelson	None	Honor Guard at Arlington National Cemetery	13 June 2004	None	['None']
snes-03219	MMA fighter Ronda Rousey has been found dead in her bathtub.	false	https://www.snopes.com/fact-check/ronda-rousey-death-hoax/	None	Junk News	None	Kim LaCapria	None	Ronda Rousey Death Hoax	3 January 2017	None	['None']
snes-01491	Two Clinton Employees Arrested For Destroying Evidence As Uranium Probe Begins?	false	https://www.snopes.com/fact-check/two-clinton-employees-arrested-destroying-evidence-uranium-probe-begins/	None	Junk News	None	Dan Evon	None	Two Clinton Employees Arrested For Destroying Evidence As Uranium Probe Begins?	1 November 2017	None	['None']
snes-05591	A federal judge ordered Brandon High School in Mississippi to remove the hymn "How Great Thou Art" from its marching band's halftime show.	mixture	https://www.snopes.com/fact-check/brandon-high-school-mississippi/	None	Politics	None	Kim LaCapria	None	Was a High School Band Ordered to Stop Performing ‘How Great Thou Art’?	25 August 2015	None	['None']
snes-06319	Photos show an alligator swimming across a lake with a deer clutched in its jaws.	true	https://www.snopes.com/fact-check/gatorade/	None	Fauxtography	None	David Mikkelson	None	Gatorade	10 August 2004	None	['None']
snes-00361	The University of Louisville Hospital confirmed the deaths of 16 people from a rare strain of the "HR3211 virus."	false	https://www.snopes.com/fact-check/deadly-hr3211-virus-louisville-kentucky/	None	Junk News	None	David Emery	None	Did an Outbreak of a Deadly ‘HR3211 Virus’ Occur in Louisville, Kentucky?	9 July 2018	None	['None']
snes-00549	A gay baboon terrorized a South African village and raped several men.	false	https://www.snopes.com/fact-check/did-baboon-terrorize-village/	None	Junk News	None	Dan Evon	None	Did a Gay Baboon Terrorize an African Village?	24 May 2018	None	['South_Africa']
snes-00678	Is a Neo-Nazi Running as a Republican For the U.S. Senate in California?	true	https://www.snopes.com/fact-check/patrick-little-neo-nazi-california/	None	Politics	None	Dan MacGuill	None	Is a Neo-Nazi Running as a Republican for the U.S. Senate in California?	1 May 2018	None	['United_States', 'Republican_Party_(United_States)', 'California']
snes-04458	A billionaire has offered $1 billion to "breed" Lebron James and Serena Williams.	false	https://www.snopes.com/fact-check/lebron-james-serena-williams-billionaire-offer/	None	Junk News	None	Dan Evon	None	White Billionaire Offers $1 Billion to Breed Lebron and Serena	13 July 2016	None	['Serena_Williams', 'LeBron_James']
snes-02133	Does Donald Trump Have Fake 'Time' Magazine Covers Displayed at His Resorts?	true	https://www.snopes.com/fact-check/trump-fake-time-covers/	None	Politics	None	Arturo Garcia	None	Does Donald Trump Have Fake ‘Time’ Magazine Covers Displayed at His Resorts?	27 June 2017	None	['None']
