afck-00070	“The debt that is guaranteed by the state in Eskom is R350 billion. In SANRAL, it’s R38.9 billion. In South African Airways, it’s R19.1 billion. In Denel, it’s R1.8 billion. In the Road Accident Fund, it’s R8.5 billion.”	mostly-correct	https://africacheck.org/reports/verifying-key-claims-in-the-2018-state-of-the-nation-debate/	None	None	None	None	None	Verifying key claims in SA’s 2018 State of the Nation address debate	2018-02-19 02:56	None	['None']
afck-00103	“ A newborn has a higher chance of dying at birth in Nairobi than in Mandera”	mostly-correct	https://africacheck.org/reports/mothers-newborns-run-higher-risk-dying-nairobi-new-governor-sonko-said/	None	None	None	None	None	Do mothers & newborns run a higher risk of dying in Nairobi, as governor Sonko said?	2017-08-24 12:58	None	['Nairobi']
afck-00367	“The economy regained the 1-million jobs lost as the results of the 2008 global recession. Employment is now higher than it has ever been.”	misleading	https://africacheck.org/reports/does-the-anc-have-a-good-story-to-tell-we-examine-key-election-claims/	None	None	None	None	None	Does the ANC have a ‘good story to tell’? We examine key election claims	2014-04-25 05:00	None	['None']
afck-00408	“On average, the economy has grown at 3,2 percent a year from 1994 to 2012 despite the global recession which claimed a million jobs.”	mostly-correct	https://africacheck.org/reports/a-first-look-at-president-jacob-zumas-2014-state-of-the-nation-address/	None	None	None	None	None	President Jacob Zuma’s sixth State of the Nation address fact-checked	2014-02-14 12:39	None	['None']
afck-00116	“Our unemployment [rate] is over 40%…”	incorrect	https://africacheck.org/reports/man-debated-2-claims-kenya-presidency-hopeful-rated/	None	None	None	None	None	The man who debated himself: 2 claims by Kenya presidency hopeful rated	2017-07-21 07:42	None	['None']
afck-00219	“The DA is making great strides compared to other metros in the country – as of February 2015, Nelson Mandela Bay had 50,000 outstanding title deeds”	correct	https://africacheck.org/reports/does-the-da-create-change-that-moves-sa-forward-we-weigh-up-key-claims/	None	None	None	None	None	Does the DA create ‘change that moves SA forward’? We weigh up key claims	2016-06-02 06:07	None	['None']
afck-00228	“…in 2002, the infant mortality rate was 51.2 babies per 1,000 live births. In 2015, infant mortality rate decreased to 34.4 deaths per 1,000 live births.”	correct	https://africacheck.org/reports/is-the-anc-advancing-peoples-power-we-fact-check-key-election-claims/	None	None	None	None	None	Is the ANC ‘advancing people’s power’? We fact-check key election claims	2016-05-19 06:39	None	['None']
afck-00024	“Only 54% transit to junior secondary schools.”	exaggerated	https://africacheck.org/reports/crisis-in-nigerian-schooling-grading-three-claims-by-presidential-hopeful/	None	None	None	None	None	Crisis in Nigerian schooling? Grading three claims by presidential hopeful	2018-07-31 09:43	None	['None']
afck-00084	It is also sad to note that water sold in informal settlements is the most expensive water in Nairobi County.	correct	https://africacheck.org/reports/nairobis-water-2-claims-losses-high-cost-slums-evaluated/	None	None	None	None	None	Nairobi’s water supply: 2 claims about losses & high prices in slums evaluated	2018-02-12 10:19	None	['None']
afck-00372	“In the ANC’s last year in government, not one department received a clean audit. In the DA’s first year, seven departments received clean audits.”	correct	https://africacheck.org/reports/is-the-das-western-cape-story-a-good-story-to-tell-we-examine-the-claims/	None	None	None	None	None	Is the DA’s Western Cape Story a ‘good story to tell’? We examine the claims	2014-03-28 05:02	None	['None']
afck-00171	“The expanded public works program has since 2014 created more than 2 million work opportunities towards the attainment of the target of 6 million work opportunities by the end of March 2019.”	correct	https://africacheck.org/reports/facts-alternative-facts-zumas-10th-state-nation-address-checked/	None	None	None	None	None	Facts or alternative facts? Zuma’s 10th State of the Nation Address checked	2017-02-10 07:12	None	['None']
afck-00121	“Only half the children who complete primary school are proceeding to secondary school…”	incorrect	https://africacheck.org/reports/checked-5-claims-kenya-nasa-opposition-manifesto/	None	None	None	None	None	Fact-checked: 5 claims in Kenya Nasa opposition manifesto	2017-07-07 06:32	None	['None']
afck-00298	“South Africa has one of the highest rates of rape in the world.”	correct	https://africacheck.org/reports/british-paper-mangles-sa-rape-statistics/	None	None	None	None	None	British paper mangles SA rape statistics	2015-05-28 03:00	None	['South_Africa']
afck-00074	“Our state employs some one million public servants.”	incorrect	https://africacheck.org/reports/state-of-the-nation-address-1-president-cyril-ramaphosas-claims-weighed-up/	None	None	None	None	None	Fact-checked: Pres Cyril Ramaphosa’s first-ever State of the Nation Address	2018-02-16 06:36	None	['None']
afck-00199	“[Sugar-sweetened drinks] account for just 3% of daily calorie intake in South Africa.”	misleading	https://africacheck.org/reports/sas-proposed-sugar-tax-claims-calories-job-losses-checked/	None	None	None	None	None	SA’s proposed sugar tax: claims about calories & job losses checked	2016-08-31 10:31	None	['South_Africa']
afck-00363	“In 1994, 5.5-million households had access to electricity.”	incorrect	https://africacheck.org/reports/does-the-anc-have-a-good-story-to-tell-we-examine-key-election-claims/	None	None	None	None	None	Does the ANC have a ‘good story to tell’? We examine key election claims	2014-04-25 05:00	None	['None']
afck-00317	“Our economy has lost R300-billion since 2008 because, without a stable electricity supply, manufacturers cannot produce, investors are driven away and jobs are lost.”	mostly-correct	https://africacheck.org/reports/mmusi-maimane-sona-2015-response-fact-checked/	None	None	None	None	None	Mmusi Maimane’s SONA 2015 response fact-checked	2015-02-25 01:20	None	['None']
afck-00373	“The country’s top three government departments since 2011 have all been in the Western Cape.”	correct	https://africacheck.org/reports/is-the-das-western-cape-story-a-good-story-to-tell-we-examine-the-claims/	None	None	None	None	None	Is the DA’s Western Cape Story a ‘good story to tell’? We examine the claims	2014-03-28 05:02	None	['None']
afck-00293	The employment tax incentive “had supported the creation of 216,000 young workers in December 2014.”	incorrect	https://africacheck.org/reports/national-youth-policy-unemployment-and-education/	None	None	None	None	None	National Youth Policy: unemployment and education claims fact-checked	2015-06-10 01:12	None	['None']
afck-00332	“There are still 3.4 million households in the country without electricity”	unproven	https://africacheck.org/reports/sona-2015-key-claims-fact-checked-part-1/	None	None	None	None	None	SONA 2015: Key claims fact-checked	2015-02-13 03:07	None	['None']
afck-00230	“Of the target of 6 million between 2014 and 2019, 1.24 million work opportunities were already created by the end of March 2015. This figure surpassed the target of 1.04 million for that period. This is [a] 119% achievement.”	unproven	https://africacheck.org/reports/is-the-anc-advancing-peoples-power-we-fact-check-key-election-claims/	None	None	None	None	None	Is the ANC ‘advancing people’s power’? We fact-check key election claims	2016-05-19 06:39	None	['None']
afck-00432	“With regard to social infrastructure, a total of 98 new schools will have been built by the end of March, of which more than 40 are in the Eastern Cape that are replacing mud schools.”	misleading	https://africacheck.org/reports/the-state-of-the-nation-address-fact-checked/	None	None	None	None	None	The State of the Nation Address: fact-checked	2013-02-15 12:06	None	['None']
afck-00109	“Functional illiteracy [has decreased] nearly by half from 34% to 19%.”	understated	https://africacheck.org/reports/sas-secret-ballot-debate-6-anc-achievements-scrutinised/	None	None	None	None	None	SA’s secret-ballot debate: 6 ANC achievements scrutinised	2017-08-17 08:52	None	['None']
afck-00270	“White families earn six times more than what black families earn. A black family’s annual income is R60,000 whereas a white family earns an annual income of R360,000.”	mostly-correct	https://africacheck.org/reports/race-poverty-and-inequality-black-first-land-first-claims-fact-checked/	None	None	None	None	None	Race, poverty and inequality: Black First Land First claims fact-checked	2015-08-27 02:44	None	['None']
afck-00259	“Black life expectancy defied AIDS and rose from age 53 to 60 in five years between 2006 and 2011.”	mostly-correct	https://africacheck.org/reports/more-claims-of-south-africas-spectacular-transformation-fact-checked/	None	None	None	None	None	More claims of S. Africa’s ‘spectacular transformation’ fact-checked	2015-11-19 11:28	None	['None']
afck-00379	“In 2009, the ANC left the province with over 6,000 health department vacancies. The vacancy rate for nurses was 34%. By 2013, the DA had brought this down to just 1%.”	unproven	https://africacheck.org/reports/is-the-das-western-cape-story-a-good-story-to-tell-we-examine-the-claims/	None	None	None	None	None	Is the DA’s Western Cape Story a ‘good story to tell’? We examine the claims	2014-03-28 05:02	None	['None']
afck-00394	“80% of the R2 billion spent by the Western Cape Government on tenders during 2012/2013 was paid to #BEEbusinesses. #DAdelivers”	correct	https://africacheck.org/reports/does-south-africas-democratic-alliance-really-deliver-we-assess-their-claims/	None	None	None	None	None	Does South Africa’s Democratic Alliance really deliver? We assess their claims	2014-03-25 08:47	None	['None']
afck-00431	“You will also recall that Census 2011 outlined the successes in extending basic services. The report said the number of households with access to electricity is now at 12.1 million, which translates to 85%. Nine out of 10 households have access to water.”	correct	https://africacheck.org/reports/the-state-of-the-nation-address-fact-checked/	None	None	None	None	None	The State of the Nation Address: fact-checked	2013-02-15 12:06	None	['None']
afck-00029	“It is important to note that up to the 2017/18 financial year, county governments have received cumulative of KSh1.25 trillion shillings as equitable share…”	mostly-correct	https://africacheck.org/reports/hit-or-miss-5-claims-by-kenyan-governors-fact-checked/	None	None	None	None	None	Hit or miss? 5 claims by Kenyan governors fact-checked	2018-07-04 01:06	None	['None']
afck-00056	“Black students obtaining a university degree are more than double the number of white students at the moment.”	correct	https://africacheck.org/reports/verifying-key-claims-in-the-2018-state-of-the-nation-debate/	None	None	None	None	None	Verifying key claims in SA’s 2018 State of the Nation address debate	2018-02-19 02:56	None	['None']
afck-00150	“Every year, the Jubilee government’s development budget has exceeded the national revenue share of the counties.”	correct	https://africacheck.org/reports/fact-checked-claims-from-kenyas-alternative-state-of-the-nation/	None	None	None	None	None	Fact-checked: Claims from Kenya’s ‘alternative’ State of the Nation	2017-03-31 06:08	None	['None']
afck-00248	“The multiple bid windows of the Renewable Independent Power Producer Programme have attracted an investment of R194 billion.”	mostly-correct	https://africacheck.org/reports/did-zuma-get-his-sona2016-facts-straight/	None	None	None	None	None	Did Zuma get his #SoNA2016 facts straight?	2016-02-11 07:51	None	['None']
afck-00045	“We have increased health facilities from 9,000 in 2013 to 11,000 in 2017.”	incorrect	https://africacheck.org/reports/uhuru-kenyattas-2018-state-of-the-nation-address-fact-checked/	None	None	None	None	None	Uhuru Kenyatta’s 2018 State of The Nation Address fact-checked	2018-05-02 06:20	None	['None']
afck-00053	The world’s average water consumption is 185 litres per person per day.	unproven	https://africacheck.org/reports/south-africans-guzzle-235-litres-water-per-day/	None	None	None	None	None	Does South Africa guzzle 235 litres of water per person daily?	2018-04-11 09:52	None	['None']
afck-00081	“Agriculture has made the largest contribution… to the improved growth of our economy in the second and third quarters of 2017.”	correct	https://africacheck.org/reports/state-of-the-nation-address-1-president-cyril-ramaphosas-claims-weighed-up/	None	None	None	None	None	Fact-checked: Pres Cyril Ramaphosa’s first-ever State of the Nation Address	2018-02-16 06:36	None	['None']
afck-00302	“In a related survey, a quarter of Soweto schoolboys described “jackrolling” – a local term for gang rape – as ‘fun’.”	unproven	https://africacheck.org/reports/british-paper-mangles-sa-rape-statistics/	None	None	None	None	None	British paper mangles SA rape statistics	2015-05-28 03:00	None	['None']
afck-00435	“There is increased visibility of the police which contributes to the reduction in the levels of serious crime. The operations focusing on illegal firearms, stolen and robbed vehicles, liquor and drugs which are regarded as main generators of crime have assisted in crime reduction.”	mostly-correct	https://africacheck.org/reports/the-state-of-the-nation-address-fact-checked/	None	None	None	None	None	The State of the Nation Address: fact-checked	2013-02-15 12:06	None	['None']
afck-00035	“The inflationary rate has consistently declined every month since January 2017″	correct	https://africacheck.org/reports/buharis-2018-democracy-day-speech-7-main-claims-under-scrutiny/	None	None	None	None	None	Buhari’s 2018 Democracy Day speech: 7 main claims under scrutiny	2018-05-29 01:51	None	['None']
afck-00099	“Eating yam increases the chances of having twins.”	unproven	https://africacheck.org/reports/does-nigerias-yoruba-tribe-have-the-worlds-highest-twin-birth-rate-and-are-yams-to-blame/	None	None	None	None	None	Do Nigeria’s Yoruba people have the world’s highest twin birth rate? (And are yams to blame?)	2017-10-05 08:24	None	['None']
afck-00018	“Oil still earns 90% of Nigeria’s foreign exchange”	mostly-correct	https://africacheck.org/reports/nigerias-economy-services-drive-gdp-but-oil-still-dominates-exports/	None	None	None	None	None	Nigeria’s economy: services drive GDP, but oil still dominates exports	2018-08-29 09:15	None	['None']
afck-00326	“The fight against corruption continues to be taken forward by the Anti-Corruption Inter-Ministerial Committee. Government has in place seven anti-corruption institutions and 17 pieces of legislation which are intended to combat corruption. This demonstrates a concerted effort by government to break the back of this scourge in the country. In the 2013/14 financial year, 52 persons were convicted in cases involving more than R5-million. Thirty one public servants were convicted in the first quarter of 2014/15 and freezing orders to the value of R430-million were obtained.”	understated	https://africacheck.org/reports/sona-2015-more-key-claims-fact-checked/	None	None	None	None	None	SONA 2015: More key claims fact-checked	2015-02-17 09:03	None	['None']
afck-00266	“The percentage of black judges increased 248% from 25% to 62% between 2000 and 2012.”	incorrect	https://africacheck.org/reports/claims-of-south-africas-spectacular-transformation-fact-checked/	None	None	None	None	None	Claims of South Africa’s ‘spectacular transformation’ fact-checked	2015-10-23 06:12	None	['None']
afck-00197	“[South Africa’s] unemployment rate is one of the highest in the world.”	correct	https://africacheck.org/reports/sa-deputy-president-correct-on-countrys-unemployment/	None	None	None	None	None	SA deputy president correct on country’s unemployment	2016-10-11 10:06	None	['None']
afck-00247	“There has been no load-shedding since August last year.”	incorrect	https://africacheck.org/reports/did-zuma-get-his-sona2016-facts-straight/	None	None	None	None	None	Did Zuma get his #SoNA2016 facts straight?	2016-02-11 07:51	None	['None']
afck-00264	“The number of black people earning more than R400,000 a year grew 1,000% from 120,000 to 1.2 million between 2000 and last year; 90% are in the private sector.”	unproven	https://africacheck.org/reports/claims-of-south-africas-spectacular-transformation-fact-checked/	None	None	None	None	None	Claims of South Africa’s ‘spectacular transformation’ fact-checked	2015-10-23 06:12	None	['None']
afck-00093	“Over 200,000 unemployed graduates have been employed under the N-Power Scheme in education, health and agriculture.”	unproven	https://africacheck.org/reports/hit-or-miss-taking-stock-of-5-claims-in-buharis-2018-budget-speech/	None	None	None	None	None	Hit or miss? Taking stock of 5 claims in Buhari’s 2018 budget speech	2017-11-29 11:15	None	['None']
afck-00430	The petrol price went from R1.73 to R12.83 per litre in the past 19 years.	correct	https://africacheck.org/reports/is-sa-worse-off-now-than-19-years-ago-the-facts-behind-that-facebook-post/	None	None	None	None	None	Is SA worse off now than 19 years ago? The facts behind THAT Facebook post	2013-11-28 05:16	None	['None']
afck-00321	“An average of 49% of the learners who should have sat for exams in 2014 dropped out of school.”	mostly-correct	https://africacheck.org/reports/julius-malemas-sona-2015-debate-speech-fact-checked/	None	None	None	None	None	Julius Malema’s SONA 2015 debate speech fact-checked	2015-02-25 01:19	None	['None']
afck-00038	“[Government] has ensured proper funding at the Basic Education level with the disbursement of N42.2 billion UBE Matching Grant to 26 States and the FCT”	unproven	https://africacheck.org/reports/buharis-2018-democracy-day-speech-7-main-claims-under-scrutiny/	None	None	None	None	None	Buhari’s 2018 Democracy Day speech: 7 main claims under scrutiny	2018-05-29 01:51	None	['None']
afck-00271	“On average, a black family comprises six people compared with a white family of three people.”	incorrect	https://africacheck.org/reports/race-poverty-and-inequality-black-first-land-first-claims-fact-checked/	None	None	None	None	None	Race, poverty and inequality: Black First Land First claims fact-checked	2015-08-27 02:44	None	['None']
afck-00207	“According to South African Police Service figures, 60% of crimes nationally were related to substance abuse.”	unproven	https://africacheck.org/reports/do-15-of-s-africans-have-a-drug-problem-we-fact-check-4-shocking-drug-statistics/	None	None	None	None	None	Do 15% of SA’s population have a drug problem? We fact-check 4 ‘shocking stats’	2016-06-23 05:37	None	['None']
afck-00272	“Whites are only 10% of the economically active population but occupy more than 60% of the top management positions.”	mostly-correct	https://africacheck.org/reports/race-poverty-and-inequality-black-first-land-first-claims-fact-checked/	None	None	None	None	None	Race, poverty and inequality: Black First Land First claims fact-checked	2015-08-27 02:44	None	['None']
afck-00400	“We have created 3.7 million work opportunities over the past five years.”	unproven	https://africacheck.org/reports/a-first-look-at-president-jacob-zumas-2014-state-of-the-nation-address/	None	None	None	None	None	President Jacob Zuma’s sixth State of the Nation address fact-checked	2014-02-14 12:39	None	['None']
afck-00028	“Electricity production was 1.8 TWh in 2003 and 2017..”	incorrect	https://africacheck.org/reports/eskom-and-the-viral-infographic-do-the-numbers-add-up/	None	None	None	None	None	Eskom and the viral infographic: do the numbers add up?	2018-07-09 07:54	None	['None']
afck-00014	“Nigeria’s voting population is six times smaller than India’s.”	incorrect	https://africacheck.org/reports/checked-two-claims-about-the-astronomical-cost-of-nigerias-election/	None	None	None	None	None	Checked: Two claims about the ‘astronomical’ cost of Nigeria’s election	2018-09-05 10:53	None	['India', 'Nigeria']
afck-00156	“Our ratio of police to the population is 1 officer for 380 citizens, better than the prescribed UN ratio of 1 officer for every 450 citizens.”	incorrect	https://africacheck.org/reports/fact-checked-kenyattas-2017-state-nation-address/	None	None	None	None	None	Fact-checked: Kenyatta’s 2017 State of the Nation Address	2017-03-17 08:39	None	['None']
afck-00155	“Girls who get pregnant below the age of 15 are 5 times as likely to die as girls who get pregnant at the age of 20.”	unproven	https://africacheck.org/reports/nigerian-girls-plight-claims-teen-marriage-pregnancy-fact-checked/	None	None	None	None	None	Nigerian girls’ plight: Claims about teen marriage & pregnancy fact-checked	2017-03-29 10:24	None	['None']
afck-00335	“More than 20 million South Africans have taken the HIV test since the launch of the campaign in 2011 which indicates confidence in the health system.”	understated	https://africacheck.org/reports/2014-sona-claims-revisited-zuma-on-hivaids/	None	None	None	None	None	2014 SONA claims revisited: Zuma on HIV/Aids	2015-02-12 03:11	None	['None']
afck-00159	“Our debt is at about 50% of our gross domestic product.”	understated	https://africacheck.org/reports/fact-checked-kenyattas-2017-state-nation-address/	None	None	None	None	None	Fact-checked: Kenyatta’s 2017 State of the Nation Address	2017-03-17 08:39	None	['None']
afck-00368	“Nearly 80,000 land claims, totalling 3.4 million hectares, have been settled. 1.8 million people have benefited.”	mostly-correct	https://africacheck.org/reports/does-the-anc-have-a-good-story-to-tell-we-examine-key-election-claims/	None	None	None	None	None	Does the ANC have a ‘good story to tell’? We examine key election claims	2014-04-25 05:00	None	['None']
afck-00090	“This administration was able to invest an unprecedented sum of over N1.2 trillion in capital projects through the 2016 budget… the highest ever in the history of this country.”	incorrect	https://africacheck.org/reports/hit-or-miss-taking-stock-of-5-claims-in-buharis-2018-budget-speech/	None	None	None	None	None	Hit or miss? Taking stock of 5 claims in Buhari’s 2018 budget speech	2017-11-29 11:15	None	['None']
afck-00376	“The [Western Cape] was also the only province with no irregular or unauthorised spending.”	unproven	https://africacheck.org/reports/is-the-das-western-cape-story-a-good-story-to-tell-we-examine-the-claims/	None	None	None	None	None	Is the DA’s Western Cape Story a ‘good story to tell’? We examine the claims	2014-03-28 05:02	None	['None']
afck-00283	“[The] prevention of mother-to-child transmission of HIV improved from 1.8% in 2013-2014 to 0.09% in the first quarter of 2014-2015.”	incorrect	https://africacheck.org/reports/crisis-what-crisis-africa-check-tests-free-state-health-claims/	None	None	None	None	None	Crisis? What crisis? Africa Check tests Free State health claims	2015-06-12 05:45	None	['None']
afck-00059	“We boast the highest unemployment rate in the world”	incorrect	https://africacheck.org/reports/verifying-key-claims-in-the-2018-state-of-the-nation-debate/	None	None	None	None	None	Verifying key claims in SA’s 2018 State of the Nation address debate	2018-02-19 02:56	None	['None']
afck-00301	“According to research by the anti-violence NGO, CIET, 20% of men said the victim ‘asked for it’.”	incorrect	https://africacheck.org/reports/british-paper-mangles-sa-rape-statistics/	None	None	None	None	None	British paper mangles SA rape statistics	2015-05-28 03:00	None	['None']
afck-00117	“In South Africa, every 8 hours a woman is killed…”	incorrect	https://africacheck.org/reports/femicide-sa-3-numbers-murdering-women-investigated/	None	None	None	None	None	Femicide in South Africa: 3 numbers about the murdering of women investigated	2017-07-13 08:08	None	['South_Africa']
afck-00095	“Over five million Nigerians are living with either the type 1 or type 2 diabetes.”	mostly-correct	https://africacheck.org/reports/nigeria-people-diabetes-sub-saharan-africa/	None	None	None	None	None	Does Nigeria have the most people with diabetes in sub-Saharan Africa?	2017-11-01 07:44	None	['None']
afck-00325	“We are a democratic state and recognise the community’s right to protest. We however appeal that these protests should be within the ambit of the law and must be peaceful as stated in the Constitution. The police successfully brought under control 13,575 recorded public order incidents, comprising 1,907 unrest-related and 11,668 peaceful incidents.”	unproven	https://africacheck.org/reports/sona-2015-more-key-claims-fact-checked/	None	None	None	None	None	SONA 2015: More key claims fact-checked	2015-02-17 09:03	None	['None']
afck-00397	“8 of the top 10 South African municipalities in the Municipal IQ’s Productivity Index are governed by @DA_News. #DAdelivers”	mostly-correct	https://africacheck.org/reports/does-south-africas-democratic-alliance-really-deliver-we-assess-their-claims/	None	None	None	None	None	Does South Africa’s Democratic Alliance really deliver? We assess their claims	2014-03-25 08:47	None	['South_Africa']
afck-00061	“27% of children under the age of 5 are stunted, nearly 30% of boys and 25% of girls.”	correct	https://africacheck.org/reports/verifying-key-claims-in-the-2018-state-of-the-nation-debate/	None	None	None	None	None	Verifying key claims in SA’s 2018 State of the Nation address debate	2018-02-19 02:56	None	['None']
