snes-02556	Three power outages that coincided in Los Angeles, San Francisco and New York were caused by Russian hacking.	false	https://www.snopes.com/fact-check/power-outages-la-sf-nyc/	None	Uncategorized	None	Bethania Palma	None	Were Power Outages in Los Angeles, San Francisco and New York Caused by Cyberattacks?	22 April 2017	None	['San_Francisco', 'Los_Angeles', 'Russia', 'New_York_City']
snes-02672	A dragon skeleton was discovered in northern Iceland.	false	https://www.snopes.com/fact-check/dragon-skeleton-discovered-iceland/	None	Junk News	None	Dan Evon	None	Dragon Skeleton Discovered in Iceland?	6 April 2017	None	['Iceland']
snes-01920	President Trump inherited a White House infested with cockroaches due to the careless behavior of his predecessor, Barack Obama.	false	https://www.snopes.com/fact-check/obama-left-trump-a-white-house-full-of-roaches/	None	Politics	None	Dan Evon	None	Obama Left Trump a White House Full of Roaches?	11 August 2017	None	['White_House', 'Barack_Obama']
snes-03012	Did Neil Gorsuch Found a High School 'Fascism Forever' Club?	false	https://www.snopes.com/fact-check/neil-gorsuchs-fascism-forever-club/	None	Questionable Quotes	None	Kim LaCapria	None	Did Neil Gorsuch Found a High School ‘Fascism Forever’ Club?	2 February 2017	None	['None']
snes-05953	A machine-shop worker tore his scrotum in a piece of machinery and then stapled it back together.	true	https://www.snopes.com/fact-check/suture-self/	None	Medical	None	David Mikkelson	None	Scrotum Self-Repair?	17 March 1999	None	['None']
snes-02426	A man was hospitalized after a fidget spinner became lodged in his anus.	false	https://www.snopes.com/fact-check/fidget-spinner-fake-news/	None	Junk News	None	Kim LaCapria	None	Was a Man Hospitalized to Remove a Lodged Fidget Spinner?	16 May 2017	None	['None']
snes-04897	A boy is suing his parents for allowing him to be born with red hair.	false	https://www.snopes.com/fact-check/red-haired-teen-sues-his-parents/	None	Junk News	None	David Mikkelson	None	Red-Haired Teen Sues His Parents for $2M for Being Born “Ginger”	18 April 2016	None	['None']
snes-03091	Official Department of Interior Twitter accounts were temporarily deactivated after the National Park Service account was used to retweet negative information about the incoming Trump administration.	true	https://www.snopes.com/fact-check/nps-twitter-account-shut-down/	None	Politics	None	David Emery	None	National Park Service Twitter Account Shut Down After Anti-Trump Retweets	21 January 2017	None	['National_Park_Service']
snes-01302	Former NBA superstar won a hefty award in 2015 after filing suit against a grocery chain that used his name in an advertisement without his permission.	true	https://www.snopes.com/fact-check/michael-jordan-sue-grocery-store-10-million/	None	Legal Affairs	None	David Mikkelson	None	Did Michael Jordan Sue a Grocery Store for $10 Million?	24 December 2017	None	['None']
snes-04931	New York State Gov. Andrew Cuomo issued a multi-state "travel ban" involving states with "lax gun laws."	false	https://www.snopes.com/fact-check/new-york-state-gun-travel-ban/	None	Junk News	None	Kim LaCapria	None	New York State Gun Travel Ban	12 April 2016	None	['None']
snes-04782	Anti-abortion groups are claiming every sperm cell is "a life."	false	https://www.snopes.com/fact-check/every-sperm-is-sacred/	None	Junk News	None	Kim LaCapria	None	Pro-Lifers Declare Every Sperm Is Sacred	10 May 2016	None	['None']
snes-02465	A Syrian refugee receives close to $400,000 in benefits a year from the German government in order to take care of his wives and children.	mostly false	https://www.snopes.com/fact-check/muslim-migrant-benefits/	None	Politics	None	Dan Evon	None	Does a ‘Muslim Migrant’ from Syria with Four Wives, 23 Children Receive $390,000 a Year in Benefits?	9 May 2017	None	['Germany', 'Syria']
snes-01696	Are Facebook Users Secretly Following You?	false	https://www.snopes.com/fact-check/facebook-paying-spies/	None	Technology	None	Kim LaCapria	None	Are Facebook Users Secretly Following You?	5 January 2017	None	['None']
snes-01923	In August 2017, the Texas House of Representatives passed a bill that would force women to purchase "rape insurance."	mixture	https://www.snopes.com/fact-check/texas-rape-insurance/	None	Politics	None	Dan MacGuill	None	Did the Texas House of Representatives Pass a Law Requiring Women to Buy ‘Rape Insurance’?	11 August 2017	None	['Texas_House_of_Representatives']
snes-04324	Actor Denzel Washington announced he is switching his support to Donald Trump in the 2016 presidential election.	false	https://www.snopes.com/fact-check/denzel-washington-switches-trump/	None	Junk News	None	David Emery	None	Denzel Washington Switches to Trump	3 August 2016	None	['Donald_Trump', 'Denzel_Washington']
snes-01157	Does a Video Show a Muslim Engaging in a 'Halal Slash'?	miscaptioned	https://www.snopes.com/fact-check/halal-slash-video/	None	Fauxtography	None	Dan Evon	None	Does a Video Show a Muslim Engaging in a ‘Halal Slash’?	22 January 2018	None	['None']
snes-00714	A "new" study has demonstrated that marijuana leads to a "complete remission" of Crohn's disease.	false	https://www.snopes.com/fact-check/new-study-marijuana-crohns/	None	Medical	None	Alex Kasprak	None	Did a New Study Show That Marijuana Leads to a Complete Remission of Crohn’s Disease?	25 April 2018	None	['None']
snes-00335	The Trump administration made immigrants pay $800 for DNA tests in order to get back children taken under its "zero tolerance" policy.	unproven	https://www.snopes.com/fact-check/immigrants-dna-tests-pay/	None	Politics	None	Bethania Palma	None	Is the Trump Administration Making Immigrants Pay $800 for DNA Tests to Get Their Children Back?	17 July 2018	None	['None']
snes-04422	Donald Trump and his children face charges of evading $250 million in taxes.	mostly false	https://www.snopes.com/fact-check/trump-and-children-face-250-million-tax-evasion-charges/	None	Politics	None	David Mikkelson	None	Trump and Children Face $250 Million Tax Evasion Charges	19 July 2016	None	['None']
snes-04232	A photograph shows Hillary Clinton wearing a defibrillator under her clothes at a campaign event.	false	https://www.snopes.com/fact-check/hillary-clinton-defibrillator/	None	Politicians	None	Dan Evon	None	Hillary Clinton Wears a Defibrillator?	16 August 2016	None	['None']
snes-01033	Did a Texas Teacher Named Heather Holland Die Because She Couldn't Afford Flu Medicine?	mostly false	https://www.snopes.com/fact-check/heather-holland-died-flu-medicine/	None	Medical	None	David Emery	None	Did a Texas Teacher Named Heather Holland Die Because She Couldn’t Afford Flu Medicine?	12 February 2018	None	['Texas']
snes-00263	In 2005, Senator Barack Obama expressed his opposition to "undetected, undocumented, unchecked" immigration.	true	https://www.snopes.com/fact-check/barack-obama-2005-immigration-quote/	None	Politics	None	Dan MacGuill	None	Did Barack Obama Express Opposition to ‘Undetected, Undocumented, Unchecked’ Immigration?	2 August 2018	None	['Barack_Obama']
snes-03455	KT McFarland, Trump's pick for his national security team, outed her gay brother as he was dying from AIDS.	unproven	https://www.snopes.com/fact-check/trumps-latest-staff-pick-outed-dying-gay-brother/	None	Politics	None	Bethania Palma	None	Trump’s Latest Staff Pick Outed Dying Gay Brother?	29 November 2016	None	['None']
snes-01710	A circulating list of nine historical "facts" about slavery accurately details the participation of non-whites in slave ownership and trade in America.	mixture	https://www.snopes.com/fact-check/facts-about-slavery/	None	History	None	David Emery	None	9 Facts About Slavery They Don’t Want You to Know	17 August 2016	None	['United_States']
snes-02257	Facebook revised its position on to female toplessness or nipple exposure in imagery as of May 2017.	false	https://www.snopes.com/fact-check/facebook-lifts-nipple-ban/	None	Technology	None	Kim LaCapria	None	Has Facebook Reversed Their ‘Nipple Ban’?	6 June 2017	None	['None']
snes-05428	Chipotle's 2015 outbreaks of foodborne illness were the work of pro-GMO bioterrorists.	unproven	https://www.snopes.com/fact-check/chipotle-gmo-bioterror/	None	Politics	None	Kim LaCapria	None	Chipotle Sabotaged by GMO Activists?	30 December 2015	None	['None']
snes-06204	The lyrics of James Taylor's "Fire and Rain" chronicle his reaction to the death of his girlfriend in a plane crash.	false	https://www.snopes.com/fact-check/fire-and-rain/	None	Entertainment	None	David Mikkelson	None	The Meaning of James Taylor’s Fire and Rain	14 December 2007	None	['None']
snes-01847	Ronald Reagan: 'If Fascism Ever Comes to America, It Will Come in the Name of Liberalism'	true	https://www.snopes.com/fact-check/ronald-reagan-fascism-liberalism/	None	Politics	None	Bethania Palma	None	Ronald Reagan: ‘If Fascism Ever Comes to America, It Will Come in the Name of Liberalism’	24 August 2017	None	['United_States', 'Ronald_Reagan']
snes-05313	Residents of Flint, Michigan have been threatened by CPS with removal of their children if they refuse to pay for contaminated water.	false	https://www.snopes.com/fact-check/flint-water-crisis-cps/	None	Legal	None	Kim LaCapria	None	Flint Residents Told That Their Children Could Be Taken Away If They Don’t Pay for City’s Poison Water?	26 January 2016	None	['Michigan', 'Flint,_Michigan']
snes-03528	Julian Assange asked President-Elect Donald Trump for a pardon in exchange for his help in defeating Hillary Clinton.	mostly false	https://www.snopes.com/fact-check/assange-asks-for-pardon/	None	Uncategorized	None	Kim LaCapria	None	WikiLeaks Asks President-Elect Trump to Pardon Julian Assange as Compensation?	17 November 2016	None	['Julian_Assange', 'Hillary_Rodham_Clinton', 'Donald_Trump']
snes-04696	A rare black rose grows naturally in Turkey.	false	https://www.snopes.com/fact-check/black-rose-village-turkey/	None	Fauxtography	None	Dan Evon	None	‘Rare Black Rose’ Only Grows in a Village in Turkey	27 May 2016	None	['None']
snes-00132	About 125 women took Mifepristone to terminate their pregnancies during a protest demanding the legalization of abortion in South Korea.	mixture	https://www.snopes.com/fact-check/pregnancies-protest-south-korea/	None	Politics	None	Dan Evon	None	Did 125 Women Terminate Their Pregnancies During a Protest in South Korea?	5 September 2018	None	['South_Korea']
snes-00328	Facebook users can receive a $150 coupon for Dollar General by liking and sharing a post.	false	https://www.snopes.com/fact-check/dollar-general-coupon/	None	Fraud & Scams	None	David Mikkelson	None	Dollar General $150 Coupon	18 July 2018	None	['None']
snes-02844	Is President Trump Sending $4,000 to People Over 65?	false	https://www.snopes.com/fact-check/trump-checks-to-retirees/	None	Junk News	None	Kim LaCapria	None	Is President Trump Sending $4,106 to Everyone Over Age 65?	3 March 2017	None	['None']
snes-05208	A Republican lawmaker proposed introducing "hunger tests" before issuing food stamps.	false	https://www.snopes.com/fact-check/food-stamp-hunger-tests/	None	Junk News	None	Kim LaCapria	None	Alabama Lawmaker Wants Food Stamp ‘Hunger Tests’?	16 February 2016	None	['Republican_Party_(United_States)']
snes-04472	Photograph shows eleven original staff members of Microsoft in 1978.	true	https://www.snopes.com/fact-check/would-you-have-invested/	None	Fauxtography	None	David Mikkelson	None	Would You Have Invested?	18 June 2006	None	['None']
snes-00228	Astronaut Mark Kelly said President Trump's proposed 'Space Force' military branch was a dumb idea.	correct attribution	https://www.snopes.com/fact-check/mark-kelly-space-force/	None	Politics	None	Dan Evon	None	Did Astronaut Mark Kelly Say the ‘Space Force’ Was a ‘Dumb Idea?’	13 August 2018	None	['None']
snes-02244	The word news is an acronym formed from the words north, east, west, and south.	false	https://www.snopes.com/fact-check/news-etymology/	None	Language	None	David Mikkelson	None	Etymology of ‘News’	26 April 2001	None	['None']
snes-01746	Hurricane Irma created a cloud formation that resembled an ominous face.	false	https://www.snopes.com/fact-check/did-hurricane-irma-create-a-cloud-face/	None	Viral Phenomena	None	Arturo Garcia	None	Did Hurricane Irma Create a ‘Cloud Face’?	11 September 2017	None	['None']
snes-06410	During an interview with CORE national spokesman Niger Innis, MSNBC displayed a graphic identifying him as “Nigger Innis.”	true	https://www.snopes.com/fact-check/niger-innis/	None	Humor	None	David Mikkelson	None	Niger Innis MSNBC Gaffe	8 February 2002	None	['MSNBC', 'Niger_Innis']
snes-04910	Former Republican candidate Dr. Ben Carson doesn't remember running for president.	false	https://www.snopes.com/fact-check/ben-carson-remember-president/	None	Junk News	None	Dan Evon	None	Ben Carson Doesn’t Remember Running for President	16 April 2016	None	['Republican_Party_(United_States)']
snes-04180	The state of California pays criminals not to kill and sends them on free vacations.	mixture	https://www.snopes.com/fact-check/california-government-pays-for-criminals-to-take-vacations/	None	Crime	None	Bethania Palma	None	California Government Pays for Criminals to Take Vacations?	24 August 2016	None	['California']
snes-05026	A photograph shows President Obama holding a Che Guevara t-shirt.	false	https://www.snopes.com/fact-check/false-obama-che-guevara-t-shirt/	None	Uncategorized	None	Dan Evon	None	Photograph Shows President Obama Holding Che Guevara T-Shirt	23 March 2016	None	['Barack_Obama', 'Che_Guevara']
snes-03142	Donald Trump revoked the press credentials of six major news outlets.	false	https://www.snopes.com/fact-check/trump-revokes-press-credentials-six-news-outlets/	None	Junk News	None	Dan Evon	None	Did Donald Trump Revoke Press Credentials for Six News Outlets?	13 January 2017	None	['None']
snes-02776	Is Farm-Raised Tilapia from China Dangerous to Eat?	mixture	https://www.snopes.com/fact-check/tilapia-consumption/	None	Food	None	David Mikkelson	None	Is Farm-Raised Tilapia from China Dangerous to Eat?	14 January 2014	None	['None']
snes-00028	After an off-duty police officer shot Brian Hundley, a jury found the officer had acted negligently and lied about the event, but Judge Brett Kavanaugh overturned the finding.	mixture	https://www.snopes.com/fact-check/kavanaugh-fatal-shooting-verdict/	None	Politics	None	Alex Kasprak	None	Did a Jury Find That a Cop Had Lied About a Fatal Shooting, But Brett Kavanaugh Threw Out the Verdict?	1 October 2018	None	['None']
snes-00545	The U.S. government lost track of some 1,475 immigrant children who were placed in sponsor homes.	true	https://www.snopes.com/fact-check/1475-immigrant-children-missing/	None	Politics	None	Bethania Palma	None	Did the U.S. Government Lose Track of 1,475 Migrant Children?	26 May 2018	None	['United_States']
snes-04144	A photograph shows three 'smiling' birds next to a 'smiling' sun.	false	https://www.snopes.com/fact-check/smile-sun-bird-photo/	None	Fauxtography	None	Dan Evon	None	‘Smiling’ Sun with ‘Smiling’ Birds	30 August 2016	None	['None']
snes-04297	Republican presidential candidate Donald Trump kicked a crying baby out of a political rally.	false	https://www.snopes.com/fact-check/donald-trump-crying-baby/	None	Politicians	None	Dan Evon	None	Donald Trump Kicked a Crying Baby Out of a Political Rally	8 August 2016	None	['Republican_Party_(United_States)', 'Donald_Trump']
snes-04885	NASA admitted to dosing Americans with airborne lithium.	false	https://www.snopes.com/fact-check/nasa-lithium-chemtrails-conspiracy/	None	Conspiracy Theories	None	Kim LaCapria	None	NASA Lithium Chemtrails Conspiracy	21 April 2016	None	['United_States']
snes-04237	In Case of Intruder, Should You Ask 911 for a Pizza?	legend	https://www.snopes.com/fact-check/case-intruder-ask-911-pizza/	None	Crime	None	Snopes Staff	None	In Case of Intruder, Should You Ask 911 for a Pizza?	3 February 2015	None	['None']
snes-02371	Marilyn Monroe's intelligence quotient was measured at 168.	unproven	https://www.snopes.com/fact-check/marilyn-monroe-iq/	None	Entertainment	None	Kim LaCapria	None	Did Marilyn Monroe Have an IQ of 168?	23 May 2017	None	['Marilyn_Monroe']
snes-03087	United We Can't Stand	mostly false	https://www.snopes.com/fact-check/us-pulling-out-of-un/	None	Politics	None	David Mikkelson	None	Is the U.S. Pulling Out of the United Nations?	22 January 2017	None	['None']
snes-06389	Photographs show a suicide bomber killed in Iraq's Green Zone	miscaptioned	https://www.snopes.com/fact-check/inside-the-green-zone/	None	Fauxtography	None	David Mikkelson	None	Inside the Green Zone	18 January 2005	None	['Iraq']
snes-01540	A photograph shows Sarah Huckabee Sanders wearing KKK robes for Halloween in 1993.	false	https://www.snopes.com/fact-check/sarah-huckabee-sanders-kkk-robe-halloween/	None	Fauxtography	None	Dan Evon	None	Did Sarah Huckabee Sanders Wear a KKK Halloween Costume in 1993?	23 October 2017	None	['Ku_Klux_Klan']
snes-03962	A photograph shows Donald Trump posing with his parents in Ku Klux Klan robes.	false	https://www.snopes.com/fact-check/donald-trumps-parents-kkk/	None	Fauxtography	None	Dan Evon	None	Donald Trump’s Parents Wore Ku Klux Klan Attire?	24 September 2016	None	['Donald_Trump', 'Ku_Klux_Klan']
snes-04209	PIctures show that Dodge is offering an elephant skin interior with their new Challenger SRT Hellcat.	mostly false	https://www.snopes.com/fact-check/dodge-challenger-elephant-skin/	None	Automobiles	None	Dan Evon	None	New Dodge Challenger Features Elephant Skin Interior	20 August 2016	None	['None']
snes-06067	A teenaged Laura Bush caused the death of a classmate in an automobile accident.	true	https://www.snopes.com/fact-check/laura-bush-car-accident/	None	Politicians	None	Snopes Staff	None	Laura Bush’s Fatal Accident	15 September 2004	None	['Laura_Bush']
snes-02114	Musician Kid Rock died in July 2017.	false	https://www.snopes.com/fact-check/kid-rock-death-hoax/	None	Junk News	None	Dan Evon	None	Kid Rock Death Hoax	4 July 2017	None	['None']
snes-04770	The Obama administration has proposed revising power guidelines that could affect eagles, but the President hasn't issued a "kill order" allowing the slaughter of thousands of bald eagles per year.	mixture	https://www.snopes.com/fact-check/obama-gives-kill-order-for-bald-eagles/	None	Politicians	None	Kim LaCapria	None	Obama Issues ‘Kill Order’ for Bald Eagles	13 May 2016	None	['Barack_Obama']
snes-02500	In just over a year, more than sixty holistic health practitioners have died suspicious deaths, and the media refuses to acknowledge that these deaths might be linked.	false	https://www.snopes.com/fact-check/holistic-doctor-death-conspiracy/	None	Medical	None	Alex Kasprak	None	Have Sixty Holistic Doctors Died Suspicious Deaths In the Past Year?	3 May 2017	None	['None']
snes-06312	The staff of snopes.com were arrested after a law enforcement raid.	false	https://www.snopes.com/fact-check/snopes-staff-members-arrested-law-enforcement-raid/	None	Uncategorized	None	David Mikkelson	None	Were Snopes Staff Members Arrested in a Law Enforcement Raid?	13 September 2010	None	['None']
snes-00192	A.A. Milne created the animal characters in 'Winnie-the-Pooh' to represent various mental disorders.	false	https://www.snopes.com/fact-check/winnie-the-pooh-mental-disorders/	None	Entertainment	None	Dan Evon	None	Were ‘Winnie-the-Pooh’ Characters Created to Represent Different Mental Disorders?	21 August 2018	None	['None']
snes-00537	Starbucks is giving away free coffee for a year to anyone who can damage their new "shatter-proof" windows.	false	https://www.snopes.com/fact-check/starbucks-shatter-proof-windows/	None	Junk News	None	Arturo Garcia	None	Is Starbucks Installing ‘Shatter-Proof Windows’?	29 May 2018	None	['None']
snes-01721	Hillary Clinton said women voted for Donald Trump because they "caved" to pressure from the men around them.	mostly false	https://www.snopes.com/fact-check/clinton-women-caved-voting/	None	Politics	None	Dan MacGuill	None	Hillary Clinton Says Women ‘Caved’ to Men in Voting Against Her?	15 September 2017	None	['Donald_Trump']
snes-02906	President Lyndon B. Johnson sent a letter to the Smothers Brothers for making Americans laugh by mocking him on their show.	true	https://www.snopes.com/fact-check/lbj-smothers-brothers/	None	History	None	Kim LaCapria	None	Did President Lyndon B. Johnson Applaud the Smothers Brothers for Mocking Him?	19 February 2017	None	['United_States', 'Smothers_Brothers', 'Lyndon_B._Johnson']
snes-03003	President Trump's White House dress code includes a requirement women wear dresses.	unproven	https://www.snopes.com/fact-check/white-house-dress-code/	None	Uncategorized	None	Kim LaCapria	None	Does President Trump’s White House Dress Code Mandate Dresses for Female Staffers?	3 February 2017	None	['None']
snes-04821	President Obama freed USS Cole bomber Mashur Abdallah Ahmed al Sabri from Guantánamo Bay.	mostly false	https://www.snopes.com/fact-check/obama-freed-uss-cole-terrorist/	None	Politicians	None	Kim LaCapria	None	Obama Freed USS Cole Terrorist?	3 May 2016	None	['Barack_Obama', 'USS_Cole_bombing']
snes-03101	Climate Ch-Ch-Ch-Changes	mixture	https://www.snopes.com/fact-check/white-house-web-site-trump-changes/	None	Politicians	None	Dan Evon	None	Did Donald Trump Remove the Terms ‘LGBT’ and ‘Climate Change’ from the White House Web Site?	20 January 2017	None	['None']
snes-06456	McDonald's beverages contain yucky non-food substances.	false	https://www.snopes.com/fact-check/a-fair-shake/	None	Automobiles	None	David Mikkelson	None	Do McDonald’s Shakes Contain Yucky Non-Food Substances?	31 January 2001	None	['None']
snes-06294	Jed Babbin said that "going to war without France is like going deer hunting without an accordion."	true	https://www.snopes.com/fact-check/jed-babbin-accordian-quote/	None	Uncategorized	None	David Mikkelson	None	Jed Babbin Accordian Quote	2 October 2003	None	['France']
snes-00964	The military has secretly drawn up plans to round up large numbers of privately-owned firearms from American gun owners.	false	https://www.snopes.com/fact-check/military-plans-gun-confiscations/	None	Junk News	None	David Mikkelson	None	Is the Military Drawing Up Plans for Nationwide Gun Confiscations?	26 February 2018	None	['United_States']
snes-02650	Donald Trump said that the United States should build a fence around New Mexico.	false	https://www.snopes.com/fact-check/donald-trump-new-mexico/	None	Junk News	None	Dan Evon	None	Trump: “Build a Fence Around New Mexico”?	17 August 2015	None	['United_States', 'New_Mexico', 'Donald_Trump']
snes-03272	The modern image of Santa Claus was created by the Coca-Cola Company.	false	https://www.snopes.com/fact-check/the-claus-that-refreshes/	None	Holidays	None	David Mikkelson	None	Did Coca-Cola Invent the Modern Image of Santa Claus?	18 December 2001	None	['The_Coca-Cola_Company']
snes-04086	George Soros said that he funded the Black Lives Matter movement because he wanted to 'bring down the United States' and 'the black community is the easiest to manipulate.'	false	https://www.snopes.com/fact-check/george-soros-bring-down-us/	None	Junk News	None	Dan Evon	None	George Soros Said: ‘I’m Going to Bring Down the U.S. by Funding Black Hate Groups’?	7 September 2016	None	['United_States', 'George_Soros']
snes-00171	An image shows a 'Time' cover featuring Colin Kaepernick as the magazine's 'Person of the Year' for 2018.	false	https://www.snopes.com/fact-check/colin-kaepernick-2018-person-of-the-year/	None	Fauxtography	None	Dan Evon	None	Is Colin Kaepernick on the Cover of Time Magazine as the 2018 ‘Person of the Year?’	24 August 2018	None	['None']
snes-06370	Swiffer WetJet Pet Danger	false	https://www.snopes.com/fact-check/swiffer-wetjet-pet-danger/	None	Critter Country	None	David Mikkelson	None	Swiffer WetJet Pet Danger	17 May 2004	None	['None']
snes-01385	Congress has a "slush fund" from which it has paid $17 million to women who accused members of sexual harassment or abuse	false	https://www.snopes.com/fact-check/congress-use-slush-fund-pay-17-million-women-sexually-harassed/	None	Politics	None	Bethania Palma	None	Did Congress Use a ‘Slush Fund’ to Pay $17 Million to Women They Sexually Harassed?	30 November 2017	None	['None']
snes-02647	Did President Trump Have Diarrhea on the Golf Course?	false	https://www.snopes.com/fact-check/trump-diarrhea-golf-course/	None	Fauxtography	None	Dan Evon	None	Did President Trump Have Diarrhea on the Golf Course?	10 April 2017	None	['None']
snes-00092	Did a Clerk Refuse to Sell Gas to a Man Fleeing a Hurricane Over a Trump Bumper Sticker?	false	https://www.snopes.com/fact-check/hurricane-gas-bumper-sticker/	None	Junk News	None	Dan Evon	None	Did a Clerk Refuse to Sell Gas to a Man Fleeing a Hurricane Over a Trump Bumper Sticker?	13 September 2018	None	['None']
snes-00002	Maya Angelou was raped when she was a child, and after the man responsible was found dead, she refused to speak for nearly 5 years.	true	https://www.snopes.com/fact-check/maya-angelou-assaulted-chlid/	None	Viral Phenomena	None	Arturo Garcia	None	Was Maya Angelou Sexually Assaulted as a Child?	5 October 2018	None	['None']
snes-03620	An FBI agent investigating Hillary Clinton's use of a private e-mail server killed himself after murdering his wife.	false	https://www.snopes.com/fact-check/fbi-agent-murder-suicide/	None	Junk News	None	David Mikkelson	None	FBI Agent Suspected in Hillary Email Leaks Found Dead in Apparent Murder-Suicide	5 November 2016	None	['Federal_Bureau_of_Investigation', 'Hillary_Rodham_Clinton']
