snes-05458	A driver in Las Vegas shouted "Allahu Akbar" as she deliberately struck multiple pedestrians with her vehicle, and police have been instructed to suppress that detail of the story.	false	https://www.snopes.com/fact-check/female-killer-las-vegas-shouted-allahu-akbar/	None	Religion	None	Kim LaCapria	None	FALSE: Female Killer in Las Vegas Shouted ‘Allahu Akbar’	21 December 2015	None	['Las_Vegas', 'Takbir']
snes-02472	President Trump signed an executive order permitting people to hunt the national bird.	false	https://www.snopes.com/fact-check/trump-hunting-bald-eagles/	None	Uncategorized	None	Dan Evon	None	President Trump Signs Executive Order Allowing the Hunting of Bald Eagles?	8 May 2017	None	['None']
snes-02075	Indonesian villagers performed a rite that brought a dead woman back to life after three years in the grave.	false	https://www.snopes.com/fact-check/woman-comes-out-of-grave/	None	Junk News	None	David Emery	None	Woman Comes Out of Grave and Walks After Being Dead for Three Years?	13 July 2017	None	['Indonesia']
snes-00671	An optical illusion allows a 3D arrow to appear as if it is always pointing in the same direction (with its mirror reflection showing the opposite direction), even when it is rotated 180 degrees.	true	https://www.snopes.com/fact-check/real-video-arrow-always-points-right/	None	Science	None	Alex Kasprak	None	Is This a Real Video of an Arrow That Always Points to the Right?	2 May 2018	None	['None']
snes-01255	A federal judge ruled that three items of Sharia law are now deemed to be legal in the state of Texas.	false	https://www.snopes.com/fact-check/shariah-law-legal-texas/	None	Junk News	None	David Mikkelson	None	Did a Federal Judge Rule Three Items of Sharia Law Are Now Legal in Texas?	7 January 2018	None	['Texas']
snes-05327	President Obama permitted the first-ever Satanic ceremony at a State Capitol.	mostly false	https://www.snopes.com/fact-check/obama-allows-satanic-ceremony/	None	Politicians	None	Kim LaCapria	None	Obama Allows Satanic Ceremony at State Capitol	22 January 2016	None	['Barack_Obama']
snes-01207	Motorists in Mexicali, Mexico, shot footage capturing an extraterrestrial spacecraft.	unproven	https://www.snopes.com/fact-check/ufo-footage-from-baja-california/	None	Fauxtography	None	Arturo Garcia	None	Does This Footage Show a ‘UFO’ in Mexico?	15 January 2018	None	['Mexico']
snes-00917	London closed 500 churches and opened 423 new mosques.	false	https://www.snopes.com/fact-check/london-closes-500-churches-opens-423-new-mosques/	None	Religion	None	Dan Evon	None	Did London Close 500 Churches and Open 423 New Mosques?	8 March 2018	None	['London']
snes-02938	Do Facebook 'Copy and Paste, Don't Share' Posts Make Your Account Hackable?	false	https://www.snopes.com/fact-check/facebook-copy-and-paste-dont-share-hackers/	None	Technology	None	Kim LaCapria	None	Do Facebook ‘Copy and Paste, Don’t Share’ Posts Make Your Account Hackable?	14 February 2017	None	['None']
snes-03118	The remains of a Nazi soldier were found in the belly of a giant catfish.	false	https://www.snopes.com/fact-check/nazi-remains-giant-catfish/	None	Fauxtography	None	Dan Evon	None	Were Nazi Remains Found in the Stomach of a Giant Catfish?	18 January 2017	None	['None']
snes-02130	The restaurant chain Whataburger announced that it was closing its doors.	false	https://www.snopes.com/fact-check/whataburger-closing-its-doors/	None	Junk News	None	Dan Evon	None	Whataburger Closing Its Doors?	28 June 2017	None	['None']
snes-05769	Numeric PLU codes used on produce stickers identify how food products were grown.	mixture	https://www.snopes.com/fact-check/plu-codes/	None	Food	None	David Mikkelson	None	PLU Codes	31 May 2012	None	['None']
snes-02629	Did Southwest Airlines Change Their Slogan After United Airlines Controversy?	false	https://www.snopes.com/fact-check/southwest-airlines-slogan/	None	Fauxtography	None	Dan Evon	None	Did Southwest Airlines Change Their Slogan After United Airlines Controversy?	12 April 2017	None	['None']
snes-05662	A photograph shows a biennial astronomical event in Ireland known as "Heaven’s Trail."	false	https://www.snopes.com/fact-check/fauxtography-space-heavens-trail/	None	Fauxtography	None	Dan Evon	None	Heaven’s Trail Viral Photo	9 June 2015	None	['Republic_of_Ireland']
snes-04644	A handful of 1970s quarters are worth a fortune, as they were minted on the back of a 1941 Canadian coin.	mixture	https://www.snopes.com/fact-check/1970-quarter-ebay-canada/	None	Business	None	Dan Evon	None	1970 U.S. Quarter Struck on 1941 Canadian Quarter	7 June 2016	None	['Canada']
snes-04046	The U.S. Bureau of Land Management (BLM) has voted to euthanize 44,000 wild horses.	mostly false	https://www.snopes.com/fact-check/blm-euthanize-44000-horses/	None	Critter Country	None	Kim LaCapria	None	Bureau of Land Management Votes to Slaughter 44,000 Wild Horses?	13 September 2016	None	['None']
snes-04753	Target has stopped selling the Bible.	false	https://www.snopes.com/fact-check/target-holy-bible-ban/	None	Junk News	None	Dan Evon	None	Target to Discontinue Sale of Holy Bible	18 May 2016	None	['None']
snes-02593	A United Airlines flight attendant slapped a 7 month-old baby in the face for crying during a flight.	false	https://www.snopes.com/fact-check/united-airlines-baby-slap/	None	Junk News	None	David Mikkelson	None	United Airlines Flight Attendant Slaps Crying Baby During Flight?	17 April 2017	None	['United_Airlines']
snes-06094	A Chinese coal miner was recently found alive in an abandoned mine 17 years after he had been trapped inside it by an earthquake.	false	https://www.snopes.com/fact-check/deep-underground/	None	Uncategorized	None	David Mikkelson	None	Chinese Miner Found Alive After 17 Years Underground	12 May 2014	None	['China']
snes-05102	Students at Bowdoin College in Maine were offered counseling because a party involved mini sombreros.	mostly false	https://www.snopes.com/fact-check/bowdoin-mini-sombrero-controversy/	None	Viral Phenomena	None	Kim LaCapria	None	Bowdoin Mini Sombrero Controversy	8 March 2016	None	['None']
snes-06380	The word 'fuck' derives from an acronymic phrase, either 'For Unlawful Carnal Knowledge' or 'Fornication Under Consent of the King.'	false	https://www.snopes.com/fact-check/what-the-fuck/	None	Language	None	David Mikkelson	None	Etymology of the the ‘F-Word’	13 July 1999	None	['None']
snes-05353	Powerball winners John and Lisa are giving away money on Facebook.	false	https://www.snopes.com/fact-check/john-and-lisa-hoax/	None	Junk News	None	Dan Evon	None	John and Lisa Robinson Powerball Giveaway Hoax	16 January 2016	None	['None']
snes-06170	The hooker sent to a john's room turns out to be his daughter.	legend	https://www.snopes.com/fact-check/call-girl-johns-daughter/	None	College	None	David Mikkelson	None	Call Girl John’s Daughter	8 August 1999	None	['None']
snes-02542	Scientists have discovered a fuel thousands of times more powerful than gasoline and just one company is positioned to own a vast majority of its market share.	false	https://www.snopes.com/fact-check/new-superfuel/	None	Science	None	Alex Kasprak	None	Have Researchers Discovered a New ‘Superfuel’ 1,693 Times More Powerful Than Gasoline?	26 April 2017	None	['None']
snes-00926	Did Target Issue an Easter Egg Recall?	outdated	https://www.snopes.com/fact-check/did-target-issue-an-easter-egg-recall/	None	Food	None	Arturo Garcia	None	Did Target Issue an Easter Egg Recall?	5 March 2018	None	['None']
snes-03206	Criminals at gas stations are handing out key rings with transmitters that enable them to track potential burglary or carjacking victims.	false	https://www.snopes.com/fact-check/key-crime/	None	Crime	None	Snopes Staff	None	Are Thieves Handing Out Key Rings at Gas Stations to Track Victims?	1 September 2008	None	['None']
snes-04517	Boogie Woogie Bugle Cloy	mixture	https://www.snopes.com/fact-check/last-surviving-wwii-veteran-marches-alone-in-memorial-day-parade/	None	Fauxtography	None	Kim LaCapria	None	Last Surviving WWII Veteran Marches Alone in Memorial Day Parade?	5 July 2016	None	['None']
snes-02198	An Indian man who was bitten by a snake then bit his wife because he wanted them to 'die together.'	unproven	https://www.snopes.com/fact-check/indian-man-snake-bite-wife/	None	Viral Phenomena	None	Arturo Garcia	None	Did an Indian Man Bite His Wife After a Snake Bit Him?	15 June 2017	None	['India']
snes-04133	A photograph shows members of the U.S. government sitting during the recitation of the Pledge of Allegiance.	mixture	https://www.snopes.com/fact-check/stand-pledge-of-allegiance-congress/	None	Fauxtography	None	Dan Evon	None	Members of Congress Sit During Pledge of Allegiance?	31 August 2016	None	['United_States']
snes-01407	Rep. Joe Barton said "wind is a finite resource and harnessing it would slow the winds down, which would cause the temperature to go up."	mixture	https://www.snopes.com/fact-check/barton-wind-finite/	None	Politics	None	David Mikkelson	None	Did Rep. Joe Barton Proclaim ‘Wind Is a Finite Resource’?	26 February 2015	None	['Joe_Barton']
snes-00056	Did Ann Coulter Tweet That ‘Men Have No Choice But to Rape …’?	correct attribution	https://www.snopes.com/fact-check/ann-coulter-men-no-choice/	None	Politics	None	Dan Evon	None	Did Ann Coulter Tweet That ‘Men Have No Choice But to Rape …’?	21 September 2018	None	['None']
snes-05555	Dr. Ben Carson said the "disintegration of the family unit and the welfare state are enslaving African-Americans and ruining their futures" but received help from such programs in his youth.	mixture	https://www.snopes.com/fact-check/ben-carson-welfare-meme/	None	Politics	None	Kim LaCapria	None	Did Ben Carson’s Family Benefit from Welfare?	29 October 2015	None	['None']
snes-01672	The Department of Health and Human Services has scheduled web site maintenance for Healthcare.gov on most Sundays during Obamacare open enrollment.	true	https://www.snopes.com/fact-check/healthcare-gov-maintenance/	None	Politics	None	Dan MacGuill	None	Is Healthcare.gov Scheduled for Maintenance During Obamacare Enrollment?	25 September 2017	None	['None']
snes-03254	Climate Scrubbing	true	https://www.snopes.com/fact-check/wisconsin-department-natural-resources-removes-references-climate-website/	None	Politics	None	Alex Kasprak	None	Wisconsin Department of Natural Resources Removes References to ‘Climate’ from Web Site	28 December 2016	None	['None']
snes-03915	Hillary Clinton once lauded the Trans-Pacific Partnership (which she later opposed) as setting the "gold standard" in trade agreements.	true	https://www.snopes.com/fact-check/hillary-clinton-called-trans-pacific-partnership-the-gold-standard/	None	Politics	None	David Emery	None	Did Hillary Clinton Call the Trans-Pacific Partnership the ‘Gold Standard’ in Trade Agreements?	29 September 2016	None	['None']
snes-03037	Transgender Offender	false	https://www.snopes.com/fact-check/trump-transgenders-on-notice/	None	Junk News	None	Kim LaCapria	None	Does President Donald Trump Plan to Make it Illegal to be Transgender?	31 January 2017	None	['None']
snes-00748	In April 2018, Suge Knight was stabbed to death in prison.	false	https://www.snopes.com/fact-check/suge-knight-dead/	None	Junk News	None	Dan MacGuill	None	Suge Knight Death Hoax	18 April 2018	None	['None']
snes-00224	The animated children's program 'VeggieTales' introduced a cannabis character in August 2018.	false	https://www.snopes.com/fact-check/veggietales-cannabis-character/	None	Junk News	None	Dan Evon	None	Did ‘VeggieTales’ Introduce a New Cannabis Character?	14 August 2018	None	['None']
snes-03664	Facebook users can assist Standing Rock protesters by "checking in" at the site to confuse the Morton County Sheriff's Department.	unproven	https://www.snopes.com/fact-check/facebook-check-in-at-standing-rock/	None	Conspiracy Theories	None	Kim LaCapria	None	Facebook Check-In at Standing Rock	31 October 2016	None	['None']
snes-05331	The animated show Darkwing Duck will return to television in 2018.	false	https://www.snopes.com/fact-check/darkwing-duck-returns-hoax/	None	Junk News	None	Dan Evon	None	‘Darkwing Duck’ April Fool’s Day Joke Recirculates	21 January 2016	None	['None']
snes-03195	Bob Denver died in January 2017.	false	https://www.snopes.com/fact-check/bob-denver-dead-again/	None	Junk News	None	Dan Evon	None	Bob Denver Dead (Again)	6 January 2017	None	['None']
snes-01771	In September 2017, the United States Treasury announced plans to produce a new $20 bill featuring the face of Confederate general Robert E. Lee.	false	https://www.snopes.com/fact-check/robert-e-lee-20-bill/	None	Junk News	None	Dan MacGuill	None	Did the United States Treasury Announce Plans to Put Robert E. Lee on the New $20 Bill?	7 September 2017	None	['United_States_Department_of_the_Treasury', 'Robert_E._Lee']
snes-01474	Did President Trump Impatiently Dump Fish Food in a Japanese Koi Pond?	miscaptioned	https://www.snopes.com/fact-check/did-trump-impatiently-dump-fish-food-in-japanese-koi-pond/	None	Fauxtography	None	Dan Evon	None	Did President Trump Impatiently Dump Fish Food in a Japanese Koi Pond?	6 November 2017	None	['None']
snes-03207	The American Dental Association said semen cuts plaque and tartar by 77%.	false	https://www.snopes.com/fact-check/semen-reduces-plaque-and-tartar/	None	Medical	None	Alex Kasprak	None	Did the ADA Say Semen Reduces Plaque and Tartar by 77%?	4 January 2017	None	['None']
snes-03842	A photograph shows a man who was diagnosed with eye cancer due to using his cell phone at night.	false	https://www.snopes.com/fact-check/phone-eye-cancer-photo/	None	Uncategorized	None	Dan Evon	None	Cell Phone Use at Night Causes Eye Cancer	21 March 2016	None	['None']
snes-01659	Michael Hayden said that he stood with Colin Kaepernick and other NFL Players in dispute over protests during the national anthem.	correct attribution	https://www.snopes.com/fact-check/cia-michael-hayden-put-me-down-with-kaepernick/	None	Junk News	None	Dan Evon	None	Michael Hayden Said of NFL Protest Dispute ‘Put Me Down with Kaepernick’?	27 September 2017	None	['Michael_Hayden_(general)', 'National_Football_League']
snes-03463	Jill Stein was arrested and charged with embezzling money raised for 2016 recount efforts in order to throw a "marijuana dinner party."	false	https://www.snopes.com/fact-check/jill-stein-caught-embezzling-recount-funds-for-marijuana-dinner-party/	None	Junk News	None	Kim LaCapria	None	Jill Stein Caught Embezzling Recount Funds for Marijuana Dinner Party	28 November 2016	None	['None']
snes-02526	Ayn Rand said, "The question isn’t who is going to let me; it's who is going to stop me."	mixture	https://www.snopes.com/fact-check/ayn-rand-quote/	None	Entertainment	None	Bethania Palma	None	Did Ayn Rand Say ‘The Question Isn’t Who Is Going to Let Me; It’s Who Is Going to Stop Me’?	28 April 2017	None	['Ayn_Rand']
snes-01455	An elderly woman trained her 65 cats to steal items, such as jewelry, from her neighbors.	false	https://www.snopes.com/fact-check/did-elderly-woman-train-cats-to-steal/	None	Junk News	None	Bethania Palma	None	Did an Elderly Woman Train 65 Cats to Steal from Her Neighbors?	9 November 2017	None	['None']
snes-05622	An ambush near Boston recently killed 72 National Guard troops.	false	https://www.snopes.com/fact-check/gun-confiscation-in-boston/	None	Uncategorized	None	David Mikkelson	None	Were 72 People Killed Resisting Gun Confiscation in Boston?	5 July 2013	None	['Boston', 'National_Guard_of_the_United_States']
snes-01387	A group supporting President Donald Trump is making "robocalls" threatening people who criticize him online.	false	https://www.snopes.com/fact-check/trump-threatening-robocalls/	None	Viral Phenomena	None	Arturo Garcia	None	Are People Getting Threatening ‘Robocalls’ for Criticizing President Trump Online?	30 November 2017	None	['None']
snes-05946	World War I Christmas Truce	true	https://www.snopes.com/fact-check/christmas-truce/	None	History	None	David Mikkelson	None	World War I Christmas Truce	24 December 2003	None	['None']
snes-01131	In January 2018, Ivanka Trump was shot and critically wounded in Washington, D.C.	false	https://www.snopes.com/fact-check/ivanka-trump-shot/	None	Junk News	None	Dan MacGuill	None	Was Ivanka Trump Critically Injured After Being Shot by a Sniper?	25 January 2018	None	['Washington,_D.C.', 'Ivanka_Trump']
snes-04585	Three Syrian refugees raped and murdered a 5-year-old girl at knifepoint in Idaho.	mostly false	https://www.snopes.com/fact-check/three-syrian-refugees-assault-5-year-old-girl-at-knifepoint/	None	Uncategorized	None	Kim LaCapria	None	Three Syrian Refugees Assault 5-Year-Old Girl at Knifepoint?	20 June 2016	None	['Syria', 'Idaho']
snes-02765	A video shows a monkey that was severely injured at a L'Oreal cosmetics testing facility.	false	https://www.snopes.com/fact-check/monkey-cosmetics-testing/	None	Critter Country	None	Dan Evon	None	Does a Video Show an Abused Monkey at a L’Oreal Animal Testing Facility?	16 March 2017	None	['None']
snes-05083	Singer Adele died in a car crash in March 2016.	false	https://www.snopes.com/fact-check/adele-death-hoax-rumors/	None	Uncategorized	None	Dan Evon	None	Death Hoax: Adele Didn’t Die in Car Crash	11 March 2016	None	['None']
snes-03923	An operative for Hillary Clinton "swooped in" and took answers to debate questions off her lectern after the conclusion of the event.	unproven	https://www.snopes.com/fact-check/clinton-secret-folder-debate/	None	Politicians	None	Bethania Palma	None	‘Clinton Operative’ Removed Secret Folder from Her Lectern After Debate?	28 September 2016	None	['None']
snes-03794	Tim Kaine threatened to ban the Catholic Church from the United States if they didn't change their stance on gay marriage.	false	https://www.snopes.com/fact-check/tim-kaine-ban-catholic-church/	None	Junk News	None	Dan Evon	None	Tim Kaine: ‘The Catholic Church Will Change Its Same-Sex Marriage Stance or It Will Be Banned from the U.S.’	15 October 2016	None	['United_States', 'Catholic_Church']
snes-04904	NC police tased and "brutally ejected" a woman from a ladies' restroom because they thought she was transgender.	false	https://www.snopes.com/fact-check/transgender-bathroom-arrest/	None	Junk News	None	Dan Evon	None	Woman Kicked Out of Ladies’ Bathroom by Police After Being Mistaken for Transgender	18 April 2016	None	['None']
snes-00593	Was Sarah Huckabee Sanders Voted Among the ‘Most Admired’ Women in the United States?	true	https://www.snopes.com/fact-check/sarah-huckabee-sanders-voted-among-admired-women-united-states/	None	Politics	None	Dan MacGuill	None	Was Sarah Huckabee Sanders Voted Among the ‘Most Admired’ Women in the United States?	15 May 2018	None	['None']
snes-00139	A photograph captured the injuries a man received when he set fire to the Nike shoes he was wearing.	false	https://www.snopes.com/fact-check/nike-shoes-boycott-burn/	None	Fauxtography	None	Dan Evon	None	Did a Man Injure Himself by Setting the Nike Shoes He Was Wearing on Fire?	4 September 2018	None	['None']
snes-03239	Mark Twain said that Its easier to fool people than to convince them that they have been fooled.	unproven	https://www.snopes.com/fact-check/did-mark-twain-say-its-easier-to-fool-people-than-to-convince-them-that-they-have-been-fooled/	None	Politics	None	Dan Evon	None	Did Mark Twain Say ‘It’s Easier to Fool People Than to Convince Them That They Have Been Fooled’?	29 December 2016	None	['None']
snes-05733	ABC banned on-air news personnel from wearing American flag pins after 9/11.	false	https://www.snopes.com/fact-check/abc-news-bans-flag-lapel-pins/	None	September 11th	None	Snopes Staff	None	Did ABC News Ban Flag Lapel Pins?	8 October 2001	None	['United_States']
snes-04408	An image shows that Democratic interns are much more diverse as a group than Republican interns.	mixture	https://www.snopes.com/fact-check/republican-and-democratic-interns/	None	Politicians	None	Dan Evon	None	Diversity Among Democratic and Republic Interns	20 July 2016	None	['Democratic_Party_(United_States)', 'Republican_Party_(United_States)']
snes-05943	A photograph shows a deadly 'snow snake' that has reportedly bitten and killed several people in the U.S., causing their blood to freeze.	false	https://www.snopes.com/fact-check/snow-snake/	None	Fauxtography	None	Snopes Staff	None	Is This a ‘Snow Snake’?	3 March 2014	None	['United_States']
snes-02469	Former Fox News host Bill O’Reilly was hospitalized in New York after being beaten by a group of "liberals."	false	https://www.snopes.com/fact-check/bill-oreilly-beaten/	None	Junk News	None	David Mikkelson	None	Bill O’Reilly in Critical Condition After Being Attacked by ‘Tolerant’ Liberals?	9 May 2017	None	['New_York_City', 'Fox_News_Channel']
snes-02685	An immigrant put peanut butter in a little girl's sandwich causing her to have an allergic reaction.	unproven	https://www.snopes.com/fact-check/immigrant-peanut-butter-sandwich/	None	Uncategorized	None	Bethania Palma	None	Did an Immigrant Make a Girl Sick by Putting Peanut Butter in Her Sandwich?	4 April 2017	None	['None']
snes-05765	Doctors have performed the first successful human head transplant.	false	https://www.snopes.com/fact-check/worlds-first-head-transplant-success-nineteen-hour-operation/	None	Media Matters	None	Snopes Staff	None	Was the World’s First Head Transplant a Success After a Nineteen-Hour Operation?	13 April 2015	None	['None']
snes-00629	The "Deodorant Challenge" is "sweeping" schools and playgrounds as of May 2018.	unproven	https://www.snopes.com/fact-check/deodorant-challenge-sweeping-schools-playgrounds/	None	Viral Phenomena	None	Kim LaCapria	None	Is the Deodorant Challenge ‘Sweeping’ Schools and Playgrounds?	9 May 2018	None	['None']
snes-01823	Katie Couric banished Hillary Clinton from her set in August 2017 after Clinton used a racist word to describe President Obama.	false	https://www.snopes.com/fact-check/hillary-trash-talk-obama/	None	Junk News	None	Kim LaCapria	None	Was Hillary Clinton Caught on a Hot Mic Trash-Talking Obama?	28 August 2017	None	['Bill_Clinton', 'Barack_Obama', 'Katie_Couric', 'Hillary_Rodham_Clinton']
snes-03822	WNBC received documents proving Donald Trump paid $40 million in federal income tax in 2013.	false	https://www.snopes.com/fact-check/trump-2013-taxes-leaked/	None	Junk News	None	Kim LaCapria	None	Leaked 2013 Trump Tax Return Shows He Paid Over 40 Million in Taxes	12 October 2016	None	['Donald_Trump', 'WNBC']
snes-02598	Al Gore predicted that Earth’s “ice caps” will melt away by 2014.	mixture	https://www.snopes.com/fact-check/ice-caps-melt-gore-2014/	None	Science	None	Alex Kasprak	None	Did Al Gore Predict Earth’s Ice Caps Would Melt by 2014?	17 April 2017	None	['None']
snes-02914	Did a Judge Rule that CNN is 'Fake News'?	mostly false	https://www.snopes.com/fact-check/cnn-fake-news/	None	Junk News	None	Kim LaCapria	None	Did a Judge Rule That CNN Is ‘Fake News’?	17 February 2017	None	['CNN']
snes-00142	Claims made in a widely-shared 2018 meme about the personal and family history of Congressman Beto O'Rourke are accurate.	mixture	https://www.snopes.com/fact-check/beto-orourke-reality-check/	None	Politics	None	Dan MacGuill	None	Beto O’Rourke’s ‘Reality Check’	1 September 2018	None	['None']
snes-01175	A photograph shows an actress in a revealing dress amidst protests against sexual harassment in Hollywood.	miscaptioned	https://www.snopes.com/fact-check/a-woman-in-a-revealing-dress-attended-a-hollywood-event-amidst-protests-against-sexual-harassment/	None	Fauxtography	None	Dan Evon	None	Did a Woman Wear This Revealing Dress to a Hollywood Event to Protest Sexual Harassment?	19 January 2018	None	['None']
snes-01789	Trump Saved Two Cats After Hurricane Harvey?	false	https://www.snopes.com/fact-check/trump-saved-two-cats-after-hurricane-harvey/	None	Fauxtography	None	Dan Evon	None	Did President Trump Save Two Cats After Hurricane Harvey?	5 September 2017	None	['None']
snes-00996	A viral Facebook video shows Prince George of Cambridge reciting the alphabet through Biblical verses.	false	https://www.snopes.com/fact-check/prince-george-bible-verses/	None	Viral Phenomena	None	Dan MacGuill	None	Does a Viral Video Show Prince George Reciting the Alphabet in Bible Verses?	19 February 2018	None	['Bible']
snes-05268	A Colorado school's female students were forced to adhere to "Sharia rules" when visiting a mosque on a field trip.	mostly false	https://www.snopes.com/fact-check/colorado-students-sharia-law/	None	Politics	None	Kim LaCapria	None	Colorado School District Forces Students to Follow Sharia Dress Code?	3 February 2016	None	['Colorado']
snes-02813	Left-handed people die younger than right-handed people.	false	https://www.snopes.com/fact-check/left-hand-right-hand-death/	None	Science	None	Alex Kasprak	None	Do Left Handed People Die Younger Than Right Handed People?	8 March 2017	None	['None']
snes-03478	Donald Trump's Christmas ornaments were all made in China.	unproven	https://www.snopes.com/fact-check/donald-trump-themed-ornaments-made-in-china/	None	Politicians	None	Dan Evon	None	Donald Trump-Themed Ornaments Made in China	26 November 2016	None	['China']
snes-00845	Far Right Blogs, Conspiracy Theorists Attack Parkland Mass Shooting Survivor	false	https://www.snopes.com/fact-check/david-hogg-attend-california-high-school/	None	Junk News	None	Bethania Palma	None	Did David Hogg Attend a California High School?	26 March 2018	None	['None']
snes-04908	Photograph depicts massive rally for Bernie Sanders in Washington Square Park in April 2016.	miscaptioned	https://www.snopes.com/fact-check/as-the-world-berned-picture/	None	Fauxtography	None	Kim LaCapria	None	‘As the World Berned’	15 April 2016	None	['Washington_Square_Park', 'Bernie_Sanders']
