afck-00240	“At the last analysis of the ratings of television programmes the parliamentary channel was rated as one of the most watched programmes.”	mostly-correct	https://africacheck.org/reports/fact-checking-the-sona2016-debates/	None	None	None	None	None	Fact-checking the #SoNA2016 debates	2016-02-16 02:07	None	['None']
afck-00244	“Recently the influential site Buzzfeed voted South Africa as the most beautiful country in the world.”	incorrect	https://africacheck.org/reports/fact-checking-the-sona2016-debates/	None	None	None	None	None	Fact-checking the #SoNA2016 debates	2016-02-16 02:07	None	['South_Africa']
afck-00198	“The key challenge [in South Africa] is that the majority of these people who are unemployed are young people.”	correct	https://africacheck.org/reports/sa-deputy-president-correct-on-countrys-unemployment/	None	None	None	None	None	SA deputy president correct on country’s unemployment	2016-10-11 10:06	None	['South_Africa']
afck-00193	The National Student Financial Aid Scheme (NSFAS) currently covers over 75% of students in tertiary institutions.	unproven	https://africacheck.org/reports/zumas-anc-birthday-speech-6-claims-fact-checked/	None	None	None	None	None	Zuma’s ANC birthday speech: 6 claims fact-checked	2017-01-12 09:06	None	['None']
afck-00384	“Since the end of 2012, South Africa’s unemployed population has grown by 121,000. In the Western Cape the unemployed population has shrunk by 48,000.”	correct	https://africacheck.org/reports/is-the-das-western-cape-story-a-good-story-to-tell-we-examine-the-claims/	None	None	None	None	None	Is the DA’s Western Cape Story a ‘good story to tell’? We examine the claims	2014-03-28 05:02	None	['South_Africa']
afck-00245	“Our government has also taken action to address the funding needs of the poorest as shown as having invested over R50 billion in loans and bursaries via the National Student Financial Aid Scheme (NSFAS).”	unproven	https://africacheck.org/reports/fact-checking-the-sona2016-debates/	None	None	None	None	None	Fact-checking the #SoNA2016 debates	2016-02-16 02:07	None	['None']
afck-00316	“South Africans have continued to trust government with their taxes. South Africa’s budget in 1994 was R135.1-billion; by 2004 this had doubled to R370-billion and R834-billion in 2009. The Minister of Finance recently announced a budget of R1.3-trillion. This means that since 2009 we have added more than the equivalent of the entire budget of 2004 and seen a 1,000% increase since 1994.”	incorrect	https://africacheck.org/reports/has-president-jacob-zumas-government-done-a-good-job/	None	None	None	None	None	Has President Jacob Zuma’s government done ‘a good job’?	2015-03-23 07:37	None	['None']
afck-00111	“17 million beneficiaries receive social grants”	mostly-correct	https://africacheck.org/reports/sas-secret-ballot-debate-6-anc-achievements-scrutinised/	None	None	None	None	None	SA’s secret-ballot debate: 6 ANC achievements scrutinised	2017-08-17 08:52	None	['None']
afck-00184	“Compliance levels with parole and probation conditions have improved to reach a historic mark of 98%.”	correct	https://africacheck.org/reports/facts-alternative-facts-zumas-10th-state-nation-address-checked/	None	None	None	None	None	Facts or alternative facts? Zuma’s 10th State of the Nation Address checked	2017-02-10 07:12	None	['None']
afck-00048	“You might also recall the expansion of Last-Mile Connectivity, which has brought electricity to 71% of households, up from 27% in 2013.”	incorrect	https://africacheck.org/reports/uhuru-kenyattas-2018-state-of-the-nation-address-fact-checked/	None	None	None	None	None	Uhuru Kenyatta’s 2018 State of The Nation Address fact-checked	2018-05-02 06:20	None	['None']
afck-00092	“Our tax-to-GDP ratio of about 6% is one of the lowest in the world.”	correct	https://africacheck.org/reports/hit-or-miss-taking-stock-of-5-claims-in-buharis-2018-budget-speech/	None	None	None	None	None	Hit or miss? Taking stock of 5 claims in Buhari’s 2018 budget speech	2017-11-29 11:15	None	['None']
afck-00086	“In 2 and a half years in power, Buhari has not even built one nursery school.”	misleading	https://africacheck.org/reports/nigerias-president-not-built-even-nursery-school-jonathan-aide-claimed/	None	None	None	None	None	Has Nigeria’s president not built even a nursery school, as Jonathan aide claimed?	2018-01-15 09:07	None	['None']
afck-00250	“…life expectancy of South Africans for both males and females has significantly improved and is currently 62 years across genders, which is an increase of eight and a half years since 2005.”	mostly-correct	https://africacheck.org/reports/did-zuma-get-his-sona2016-facts-straight/	None	None	None	None	None	Did Zuma get his #SoNA2016 facts straight?	2016-02-11 07:51	None	['None']
afck-00392	“The [South African] gap between the ‘haves’ & the ‘havenots’ is smallest in City of Cape Town. It has the highest level of equality in SA. #DAdelivers”	mostly-correct	https://africacheck.org/reports/does-south-africas-democratic-alliance-really-deliver-we-assess-their-claims/	None	None	None	None	None	Does South Africa’s Democratic Alliance really deliver? We assess their claims	2014-03-25 08:47	None	['South_Africa']
afck-00023	“30% of pupils drop out of primary school.”	understated	https://africacheck.org/reports/crisis-in-nigerian-schooling-grading-three-claims-by-presidential-hopeful/	None	None	None	None	None	Crisis in Nigerian schooling? Grading three claims by presidential hopeful	2018-07-31 09:43	None	['None']
afck-00351	Mmusi Maimane, Democratic Alliance parliamentary leader: “Since the end of 2012, South Africa’s unemployed population has grown by 121,000.”	incorrect	https://africacheck.org/reports/sona-unemployment-claims-unpacked/	None	None	None	None	None	SONA unemployment claims unpacked	2014-06-26 06:16	None	['Democratic_Alliance_(South_Africa)', 'South_Africa']
afck-00168	“Government also settled all debt owed by National Student Financial Aid Scheme (NSFAS) students.”	misleading	https://africacheck.org/reports/facts-alternative-facts-zumas-10th-state-nation-address-checked/	None	None	None	None	None	Facts or alternative facts? Zuma’s 10th State of the Nation Address checked	2017-02-10 07:12	None	['None']
afck-00166	“To date, nearly 7 million households have been connected to the grid and now have the electricity.”	correct	https://africacheck.org/reports/facts-alternative-facts-zumas-10th-state-nation-address-checked/	None	None	None	None	None	Facts or alternative facts? Zuma’s 10th State of the Nation Address checked	2017-02-10 07:12	None	['None']
afck-00073	“The Accelerated Schools Infrastructure Delivery Initiative programme continues to deliver modern facilities to our schools… with at least 187 schools being completed to date.“	correct	https://africacheck.org/reports/state-of-the-nation-address-1-president-cyril-ramaphosas-claims-weighed-up/	None	None	None	None	None	Fact-checked: Pres Cyril Ramaphosa’s first-ever State of the Nation Address	2018-02-16 06:36	None	['None']
afck-00421	South Africa is the country where the most car hijackings take place.	unproven	https://africacheck.org/reports/is-sa-worse-off-now-than-19-years-ago-the-facts-behind-that-facebook-post/	None	None	None	None	None	Is SA worse off now than 19 years ago? The facts behind THAT Facebook post	2013-11-28 05:16	None	['South_Africa']
afck-00003	“Only 3.2 million people actually pay PAYE.”	correct	https://africacheck.org/reports/is-top-ruling-jubilee-party-official-right-about-who-is-paying-income-tax-in-kenya/	None	None	None	None	None	Is top ruling Jubilee Party official right about who is paying income tax in Kenya?	2018-10-30 08:29	None	['None']
afck-00319	“The 17.5 million hectares of fertile soil in communal land areas must be unlocked for reform purposes. State-owned land must be fully audited and used to fast-track redistribution to deserving beneficiaries.”	incorrect	https://africacheck.org/reports/mmusi-maimane-sona-2015-response-fact-checked/	None	None	None	None	None	Mmusi Maimane’s SONA 2015 response fact-checked	2015-02-25 01:20	None	['None']
afck-00012	“Kenya spends 43% of its national budget on development.”	incorrect	https://africacheck.org/reports/tax-revenue-and-development-spend-does-kenyas-majority-leader-get-his-numbers-right/	None	None	None	None	None	Tax revenue & development spend: does Kenya’s majority leader get his numbers right?	2018-09-14 08:30	None	['Kenya']
afck-00436	“Five years ago, South Africa had such a low life expectancy that experts suggested that by 2015, our life expectancy would have been exactly where it was in 1955. It was with good reason that we were delighted when late last year, studies from the Medical Research Council, the Lancet medical journal and others began reporting a dramatic increase in life expectancy from an average baseline of 56 years in 2009 to 60 years in 2011. These reports also noted significant decreases in infant and under five mortality.”	unproven	https://africacheck.org/reports/the-state-of-the-nation-address-fact-checked/	None	None	None	None	None	The State of the Nation Address: fact-checked	2013-02-15 12:06	None	['The_Lancet', 'South_Africa']
afck-00153	“Kenya’s industrial power costs remain much higher than that of our competitors.”	mostly-correct	https://africacheck.org/reports/fact-checked-claims-from-kenyas-alternative-state-of-the-nation/	None	None	None	None	None	Fact-checked: Claims from Kenya’s ‘alternative’ State of the Nation	2017-03-31 06:08	None	['None']
afck-00339	“Since 1994, nearly 5,000 farms, comprising 4.2-million hectares, have been transferred to black people, benefiting over 200,000 families.”	unproven	https://africacheck.org/reports/2014-sona-claims-revisited-zuma-on-land-reform/	None	None	None	None	None	2014 SONA claims revisited: Zuma on land reform	2015-02-12 08:26	None	['None']
afck-00275	“…education continues to receive the biggest chunk of the national budget.”	correct	https://africacheck.org/reports/checked-sa-president-zumas-youth-day-claims/	None	None	None	None	None	SA President’s Youth Day claims examined	2015-06-17 10:35	None	['None']
afck-00022	“One doctor to less than 300 patients in South Africa’s private healthcare sector”	incorrect	https://africacheck.org/reports/does-one-sa-doctor-treat-over-4000-patients-in-public-care-but-less-than-300-privately/	None	None	None	None	None	Does one SA doctor treat 4,000 patients in public care, but fewer than 300 privately?	2018-08-07 11:47	None	['None']
afck-00406	“The tourism industry has grown dramatically. In 1993, South Africa received a mere 3 million foreign visitors. By 2012, the figure had grown to 13 million visitors.”	exaggerated	https://africacheck.org/reports/a-first-look-at-president-jacob-zumas-2014-state-of-the-nation-address/	None	None	None	None	None	President Jacob Zuma’s sixth State of the Nation address fact-checked	2014-02-14 12:39	None	['South_Africa']
afck-00286	“Of the total number of deaths due to assault and intentional self-harm in the country, 69% and 59% of them, respectively, occurred among those aged 15-34 years.”	correct	https://africacheck.org/reports/national-youth-policy-health-and-violence/	None	None	None	None	None	National Youth Policy: crime & health claims fact-checked	2015-06-11 11:46	None	['None']
afck-00162	“Today, we have connected an additional 3.7 million new homes to electricity.”	incorrect	https://africacheck.org/reports/fact-checked-kenyattas-2017-state-nation-address/	None	None	None	None	None	Fact-checked: Kenyatta’s 2017 State of the Nation Address	2017-03-17 08:39	None	['None']
afck-00097	“There are over 10,000 children working as prostitutes in Johannesburg at the moment.”	incorrect	https://africacheck.org/reports/fact-checked-2-claims-slavery-child-prostitutes-sa/	None	None	None	None	None	FACT-CHECKED: 2 claims about slavery & ‘child prostitutes’ in SA	2017-10-26 09:08	None	['Johannesburg']
afck-00010	“In 2002, when the National Rainbow Coalition took over power, Kenya Revenue Authority was collecting close to about KSh600 billion.”	incorrect	https://africacheck.org/reports/tax-revenue-and-development-spend-does-kenyas-majority-leader-get-his-numbers-right/	None	None	None	None	None	Tax revenue & development spend: does Kenya’s majority leader get his numbers right?	2018-09-14 08:30	None	['None']
afck-00419	South Africa is the rape capital of the world.	unproven	https://africacheck.org/reports/is-sa-worse-off-now-than-19-years-ago-the-facts-behind-that-facebook-post/	None	None	None	None	None	Is SA worse off now than 19 years ago? The facts behind THAT Facebook post	2013-11-28 05:16	None	['South_Africa']
afck-00020	“More than 10 million youth are unemployed.”	correct	https://africacheck.org/reports/nigerian-joblessness-at-all-time-high-checking-a-politicians-claims/	None	None	None	None	None	Nigerian joblessness at all-time high? Checking a politician’s claims	2018-08-13 08:34	None	['None']
afck-00132	“We have in the last 2 years added US$500 million to our sovereign wealth fund.”	unproven	https://africacheck.org/reports/nigerias-democracy-day-speech-fact-checking-government-savings-rice-imports-infrastructure-spend/	None	None	None	None	None	Nigeria’s Democracy Day speech: Fact-checking sovereign savings, rice imports & infrastructure spend	2017-06-14 11:15	None	['None']
afck-00220	“…the Drakenstein municipality managed to reduce annual water losses from 34.8% to 12.1% in little over a decade. The campaign also showcases how DA local governments can reverse the decline of a municipality by identifying problems and taking proactive steps to address them.”	incorrect	https://africacheck.org/reports/does-the-da-create-change-that-moves-sa-forward-we-weigh-up-key-claims/	None	None	None	None	None	Does the DA create ‘change that moves SA forward’? We weigh up key claims	2016-06-02 06:07	None	['None']
afck-00069	“[South Africa] is in debt of more than R2.3 trillion.”	correct	https://africacheck.org/reports/verifying-key-claims-in-the-2018-state-of-the-nation-debate/	None	None	None	None	None	Verifying key claims in SA’s 2018 State of the Nation address debate	2018-02-19 02:56	None	['South_Africa']
afck-00343	“Jobs are now being created again. There are now [in February 2014] 15-million people with jobs in the country, the highest ever in our history, and over 650,000 jobs were created last year, according to Stats SA.”	misleading	https://africacheck.org/reports/2014-sona-claims-revisited-zuma-on-the-economy/	None	None	None	None	None	2014 SONA claims revisited: Zuma on the economy	2015-02-11 04:31	None	['None']
afck-00054	“The Western Cape has the lowest unemployment rate of all provinces”	correct	https://africacheck.org/reports/verifying-key-claims-in-the-2018-state-of-the-nation-debate/	None	None	None	None	None	Verifying key claims in SA’s 2018 State of the Nation address debate	2018-02-19 02:56	None	['None']
afck-00186	The two men dressed in blue uniforms stationed inside the doors of the national assembly “must leave the house. They don’t belong here.”	incorrect	https://africacheck.org/reports/eff-correct-military-officers-sa-parliaments-door-dont-belong/	None	None	None	None	None	Ceremonial guards & criminal records: Checking EFF claims about SA parly	2017-02-10 06:59	None	['None']
afck-00274	“The Americans named a mini-planet after [Siyabulela Xuza] because of his achievements.”	correct	https://africacheck.org/reports/checked-sa-president-zumas-youth-day-claims/	None	None	None	None	None	SA President’s Youth Day claims examined	2015-06-17 10:35	None	['None']
afck-00008	“Over 40% of primary school teachers are unqualified”	incorrect	https://africacheck.org/reports/number-of-qualified-primary-school-teachers-and-grade-6-literacy-in-nigeria-higher-than-claimed/	None	None	None	None	None	Number of qualified primary school teachers and grade 6 literacy in Nigeria higher than claimed	2018-09-17 12:00	None	['None']
afck-00124	“Our holiday tourist arrivals have declined five years in a row from 1.1 million visitors a year in 2012 to 930,000 visitors in 2016.”	mostly-correct	https://africacheck.org/reports/checked-5-claims-kenya-nasa-opposition-manifesto/	None	None	None	None	None	Fact-checked: 5 claims in Kenya Nasa opposition manifesto	2017-07-07 06:32	None	['None']
afck-00304	“Up to 40% of South African women will be raped in their lifetime according to the South African Institute of Race Relations, but estimates vary widely due to underreporting.”	incorrect	https://africacheck.org/reports/british-paper-mangles-sa-rape-statistics/	None	None	None	None	None	British paper mangles SA rape statistics	2015-05-28 03:00	None	['South_Africa']
afck-00324	“Your own government in 2013 reported that ‘the number of children affected [by child labour] still remains… at an estimated 821,000’.”	unproven	https://africacheck.org/reports/julius-malemas-sona-2015-debate-speech-fact-checked/	None	None	None	None	None	Julius Malema’s SONA 2015 debate speech fact-checked	2015-02-25 01:19	None	['None']
afck-00364	“In 2013, more than 11-million households have access to electricity.”	correct	https://africacheck.org/reports/does-the-anc-have-a-good-story-to-tell-we-examine-key-election-claims/	None	None	None	None	None	Does the ANC have a ‘good story to tell’? We examine key election claims	2014-04-25 05:00	None	['None']
afck-00417	Unemployment in South Africa has increased by 60% in the past 19 years.	incorrect	https://africacheck.org/reports/is-sa-worse-off-now-than-19-years-ago-the-facts-behind-that-facebook-post/	None	None	None	None	None	Is SA worse off now than 19 years ago? The facts behind THAT Facebook post	2013-11-28 05:16	None	['None']
afck-00229	“Between 2004 and 2014, the EPWP created over 5 million work opportunities for poor and unemployed people.”	correct	https://africacheck.org/reports/is-the-anc-advancing-peoples-power-we-fact-check-key-election-claims/	None	None	None	None	None	Is the ANC ‘advancing people’s power’? We fact-check key election claims	2016-05-19 06:39	None	['None']
afck-00422	South Africa is one of the ‘top ten’ countries with the highest murder rates.	mostly-correct	https://africacheck.org/reports/is-sa-worse-off-now-than-19-years-ago-the-facts-behind-that-facebook-post/	None	None	None	None	None	Is SA worse off now than 19 years ago? The facts behind THAT Facebook post	2013-11-28 05:16	None	['South_Africa']
afck-00183	“Last year, I signed into law a provision to criminalise the cartels and collusion and it came into effect on 1 May. It carries jail sentences of up to 10 years.”	correct	https://africacheck.org/reports/facts-alternative-facts-zumas-10th-state-nation-address-checked/	None	None	None	None	None	Facts or alternative facts? Zuma’s 10th State of the Nation Address checked	2017-02-10 07:12	None	['None']
afck-00041	“From an allocation of KSh210 billion in the FY 2013/2014, we now stand at KSh327 billion for the FY 2017/2018, an increase of 56% in five years.”	understated	https://africacheck.org/reports/uhuru-kenyattas-2018-state-of-the-nation-address-fact-checked/	None	None	None	None	None	Uhuru Kenyatta’s 2018 State of The Nation Address fact-checked	2018-05-02 06:20	None	['Fiscal_year']
afck-00013	“Nigeria’s 2019 election budget is US$625 million [while] India’s 2014 poll cost US$600 million.”	mostly-correct	https://africacheck.org/reports/checked-two-claims-about-the-astronomical-cost-of-nigerias-election/	None	None	None	None	None	Checked: Two claims about the ‘astronomical’ cost of Nigeria’s election	2018-09-05 10:53	None	['India', 'Nigeria']
afck-00382	“In its first term in office, the DA built three brand new hospitals in Khayelitsha, Mitchells Plain and George and currently has 75 health care projects valued at R4.5 billion underway.”	exaggerated	https://africacheck.org/reports/is-the-das-western-cape-story-a-good-story-to-tell-we-examine-the-claims/	None	None	None	None	None	Is the DA’s Western Cape Story a ‘good story to tell’? We examine the claims	2014-03-28 05:02	None	['None']
afck-00094	“Nigeria has the highest incidence of diabetes in sub-Saharan Africa.”	unproven	https://africacheck.org/reports/nigeria-people-diabetes-sub-saharan-africa/	None	None	None	None	None	Does Nigeria have the most people with diabetes in sub-Saharan Africa?	2017-11-01 07:44	None	['Nigeria', 'Africa']
afck-00273	“Government… continues to build modern new schools to replace mud schools and other inappropriate structures.”	mostly-correct	https://africacheck.org/reports/checked-sa-president-zumas-youth-day-claims/	None	None	None	None	None	SA President’s Youth Day claims examined	2015-06-17 10:35	None	['None']
afck-00280	“The tuberculosis (TB) new client success rate improved from 79.7% to 83.3% and the TB cure rate from 73% to 77.1%.”	correct	https://africacheck.org/reports/crisis-what-crisis-africa-check-tests-free-state-health-claims/	None	None	None	None	None	Crisis? What crisis? Africa Check tests Free State health claims	2015-06-12 05:45	None	['None']
afck-00307	“Whilst jobs were lost [due to the recession], in 2014 South Africa has actually managed to employ even more people than were employed in the years when jobs were lost, implying that there is recovery.”	misleading	https://africacheck.org/reports/has-president-jacob-zumas-government-done-a-good-job/	None	None	None	None	None	Has President Jacob Zuma’s government done ‘a good job’?	2015-03-23 07:37	None	['South_Africa']
afck-00295	“Only 31% of young people completed their matric (Grade 12) education.”	mostly-correct	https://africacheck.org/reports/national-youth-policy-unemployment-and-education/	None	None	None	None	None	National Youth Policy: unemployment and education claims fact-checked	2015-06-10 01:12	None	['None']
afck-00066	“A black child is… 100 times more likely to grow up in poverty than a white child.”	incorrect	https://africacheck.org/reports/verifying-key-claims-in-the-2018-state-of-the-nation-debate/	None	None	None	None	None	Verifying key claims in SA’s 2018 State of the Nation address debate	2018-02-19 02:56	None	['None']
afck-00257	“Blacks in top management… doubled” [presumably from 2000 to the present]	mostly-correct	https://africacheck.org/reports/more-claims-of-south-africas-spectacular-transformation-fact-checked/	None	None	None	None	None	More claims of S. Africa’s ‘spectacular transformation’ fact-checked	2015-11-19 11:28	None	['None']
afck-00119	“South Africa’s femicide rate is 5 times more than the global rate.”	mostly-correct	https://africacheck.org/reports/femicide-sa-3-numbers-murdering-women-investigated/	None	None	None	None	None	Femicide in South Africa: 3 numbers about the murdering of women investigated	2017-07-13 08:08	None	['None']
afck-00211	“Estimates by the City [of Cape Town] found that 161,000 individuals, or 11.3% of the total workforce in Cape Town, were employed by the informal economy in 2015.”	mostly-correct	https://africacheck.org/reports/does-the-da-create-change-that-moves-sa-forward-we-weigh-up-key-claims/	None	None	None	None	None	Does the DA create ‘change that moves SA forward’? We weigh up key claims	2016-06-02 06:07	None	['Cape_Town']
afck-00051	Only 30% [of students] get the marks requires [sic] to get into [university]	incorrect	https://africacheck.org/reports/validating-the-truth-about-sas-education-system/	None	None	None	None	None	Validating ‘the truth’ about SA’s education system	2018-04-24 12:03	None	['None']
afck-00151	“Jubilee took over a nation of KSh1.5 trillion debt. That debt is now KSh4 trillion and rising.”	unproven	https://africacheck.org/reports/fact-checked-claims-from-kenyas-alternative-state-of-the-nation/	None	None	None	None	None	Fact-checked: Claims from Kenya’s ‘alternative’ State of the Nation	2017-03-31 06:08	None	['None']
afck-00080	Mining fatalities are rising	correct	https://africacheck.org/reports/state-of-the-nation-address-1-president-cyril-ramaphosas-claims-weighed-up/	None	None	None	None	None	Fact-checked: Pres Cyril Ramaphosa’s first-ever State of the Nation Address	2018-02-16 06:36	None	['None']
afck-00385	“Under-performing schools are schools where the matric pass rate is less than 60%. Under the ANC this went from 36 schools in 2006 to 85 in 2009. In just four years the DA brought the number of underperforming schools down to 23.”	mostly-correct	https://africacheck.org/reports/is-the-das-western-cape-story-a-good-story-to-tell-we-examine-the-claims/	None	None	None	None	None	Is the DA’s Western Cape Story a ‘good story to tell’? We examine the claims	2014-03-28 05:02	None	['None']
afck-00194	South Africa is “best or number one for” death rates	incorrect	https://africacheck.org/reports/sa-1-world-death-nigeria-scrabble-players-kenya-tea/	None	None	None	None	None	Is SA #1 in the world for death, Kenya for tea & Nigeria for scrabble players?	2016-12-07 02:15	None	['None']
afck-00310	“The percentage of households connected to piped water increased from 88% to 90%.”	mostly-correct	https://africacheck.org/reports/has-president-jacob-zumas-government-done-a-good-job/	None	None	None	None	None	Has President Jacob Zuma’s government done ‘a good job’?	2015-03-23 07:37	None	['None']
afck-00320	“But while our communities are being over-run by drug lords the President said nothing about crime! Where are the specialised anti-drug units? Drug crime has doubled since they were taken away.”	incorrect	https://africacheck.org/reports/mmusi-maimane-sona-2015-response-fact-checked/	None	None	None	None	None	Mmusi Maimane’s SONA 2015 response fact-checked	2015-02-25 01:20	None	['None']
