snes-01605	Hugh Hefner paid $75,000 to be interred next to Marilyn Monroe in a Los Angeles cemetery.	true	https://www.snopes.com/fact-check/did-hugh-hefner-pay-to-be-buried-next-to-marilyn-monroe/	None	Entertainment	None	Arturo Garcia	None	Did Hugh Hefner Pay to be Interred Next to Marilyn Monroe?	10 October 2017	None	['Los_Angeles', 'Hugh_Hefner', 'Marilyn_Monroe']
snes-04892	Multiple news outlets reported that primary voters in New York claimed their votes were switched from Bernie Sanders to Hillary Clinton.	false	https://www.snopes.com/fact-check/votes-switched-sanders-clinton/	None	Junk News	None	Kim LaCapria	None	The Fix Is In: Sanders Supporters in New York See Votes Switched to Hillary	19 April 2016	None	['Bernie_Sanders', 'New_York_City', 'Hillary_Rodham_Clinton']
snes-05628	In accordance with a requirement of their original Royal Charter, the Hudson's Bay Company of Canada makes annual payments of elk and beaver pelts to the Queen of England.	false	https://www.snopes.com/fact-check/fur-the-queen/	None	Business	None	David Mikkelson	None	Canada Company Makes Annual Fur Payments to the Queen	15 June 2001	None	['England', 'Canada']
snes-05696	Photograph shows a fisherman in Wisconsin holding a furry trout he'd caught.	false	https://www.snopes.com/fact-check/furry-trout/	None	Fauxtography	None	Dan Evon	None	Man Catches Furry Trout in Wisconsin?	18 May 2015	None	['Wisconsin']
snes-01154	The Pentagon has disavowed knowledge of a stranded Air Force pilot after he successfully intercepted a missile near North Korea.	false	https://www.snopes.com/fact-check/u-s-pilot-shot-down-after-destroying-korean-missile/	None	Junk News	None	Kim LaCapria	None	Was a U.S. Pilot Shot Down After Destroying a North Korean Missile?	22 January 2018	None	['United_States_Air_Force', 'The_Pentagon', 'North_Korea']
snes-01294	Wikileaks released a trove of "deep state files" in late December 2017.	false	https://www.snopes.com/fact-check/wikileaks-releases-deep-state-files-deepstatefiles/	None	Junk News	None	Kim LaCapria	None	Did WikiLeaks Release a Trove of ‘Deep State Files’?	27 December 2017	None	['None']
snes-01969	People in Brooklyn are refusing to vaccinate their pets based on fears created by the anti-vaccine movement.	unproven	https://www.snopes.com/fact-check/brooklyn-refusing-vaccinate-pets/	None	Medical	None	Alex Kasprak	None	Are People in Brooklyn Refusing to Vaccinate Their Pets Over Autism Fears?	2 August 2017	None	['Brooklyn']
snes-03146	Shot Through the Heart	false	https://www.snopes.com/fact-check/palestinian-boy-shot-photo/	None	Fauxtography	None	Dan Evon	None	Does a Photograph Show a Palestinian Boy Getting Shot by Israeli Soldiers?	13 January 2017	None	['None']
snes-04167	Kinking an electrical wire stops electricity flow like kinking a garden hose stops water.	false	https://www.snopes.com/fact-check/kinking-a-live-electrical-wire/	None	Science	None	Bethania Palma	None	Kinking a Live Electrical Wire Stops Electricity and Makes it Safe	26 August 2016	None	['None']
snes-01150	Did Sylvester Stallone Say Obama Is a ‘Closet Homosexual Living a Lie’?	false	https://www.snopes.com/fact-check/stallone-obama-living-lie/	None	Junk News	None	David Mikkelson	None	Did Sylvester Stallone Say Obama Is a ‘Closet Homosexual Living a Lie’?	23 January 2018	None	['None']
snes-05124	Cameron Diaz was cast to portray Maya Angelou in a new biographical film.	false	https://www.snopes.com/fact-check/cameron-diaz-maya-angelou/	None	Junk News	None	Kim LaCapria	None	No, Cameron Diaz Wasn’t Cast to Play Maya Angelou in a Biopic	3 March 2016	None	['Maya_Angelou', 'Cameron_Diaz']
snes-02101	Giant Hawaiian Cane Spider	false	https://www.snopes.com/fact-check/false-giant-hawaiian-cane-spider/	None	Fauxtography	None	David Mikkelson	None	Giant Hawaiian Cane Spider	8 February 2013	None	['None']
snes-04081	A viral video shows a newborn baby delivered inside an intact amniotic sac.	true	https://www.snopes.com/fact-check/baby-delivered-inside-amniotic-sac/	None	Medical	None	David Emery	None	Video Shows Baby Delivered Inside Intact Amniotic Sac	7 September 2016	None	['None']
snes-03490	Members of the alt-right group the National Policy Institute can be seen on video doing a Nazi-like salute as speaker Richard Spencer calls out "Hail Trump, hail our people, hail victory!"	true	https://www.snopes.com/fact-check/alt-right-hail-trump-salute/	None	Conspiracy Theories	None	David Emery	None	Video Shows Alt-Right Group Engaging in ‘Hail Trump’ Salute	23 November 2016	None	['None']
snes-01435	Did Muslims March in Favor of Sharia Law in England?	false	https://www.snopes.com/fact-check/video-muslims-sharia-ashoura/	None	Fauxtography	None	Dan Evon	None	Did Muslims March in Favor of Sharia Law in England?	15 November 2017	None	['None']
snes-04697	Hillary Clinton is disqualified from holding the office of President under the provisions of U.S. Code Title 18, Section 2071.	mostly false	https://www.snopes.com/fact-check/hillary-clinton-disqualified/	None	Politicians	None	Kim LaCapria	None	Hillary Clinton Disqualified by U.S. Code Title 18, Section 2071	27 May 2016	None	['None']
snes-04134	Pokémon Go developer Niantic is working on a Harry Potter version of the hugely popular augmented-reality game.	true	https://www.snopes.com/fact-check/pokemon-go-developer-niantic-to-develop-harry-potter-go/	None	Technology	None	Kim LaCapria	None	Pokémon Go Developer Niantic to Develop ‘Harry Potter Go’?	31 August 2016	None	['None']
snes-06283	An Arizona sheriff dismissed prisoners' bellyaching about the heat by pointing out that soldiers serving in Iraq cope with similar conditions.	true	https://www.snopes.com/fact-check/pinking-sheers/	None	Crime	None	Snopes Staff	None	Sheriff Joe Arpaio	14 August 2003	None	['Iraq', 'Arizona']
snes-01277	The United States government has secretly negotiated a deal to return the U.S. territory of Puerto Rico to Spain.	false	https://www.snopes.com/fact-check/us-returning-puerto-rico-to-spain/	None	Junk News	None	David Emery	None	Is the United States Returning Puerto Rico to Spain?	2 January 2018	None	['United_States', 'Spain', 'Puerto_Rico']
snes-03396	Ben Carson said abortions led to baby ghosts haunting hospitals, stealing medical supplies, and increasing healthcare costs.	false	https://www.snopes.com/fact-check/ben-carson-abortions-create-baby-ghosts-haunt-hospitals/	None	Politics	None	Kim LaCapria	None	Ben Carson: ‘Abortions Create Baby Ghosts that Haunt Hospitals’	7 December 2016	None	['None']
snes-06161	A photograph captures a rare seven-headed snake found in the Honduras.	false	https://www.snopes.com/fact-check/7-headed-snake/	None	Fauxtography	None	David Mikkelson	None	Does This Photograph Show a 7-Headed Snake?	26 November 2013	None	['Honduras']
snes-03141	Michelle Obama's Secret Service detail abruptly quit during her Hawaii vacation and left her on the street.	false	https://www.snopes.com/fact-check/michelle-obama-ditched-by-secret-service/	None	Junk News	None	Dan Evon	None	Did Michelle Obama Get Ditched by Secret Service?	14 January 2017	None	['Hawaii', 'Michelle_Obama', 'United_States_Secret_Service']
snes-03740	An Oregon ballot lists Democratic presidential candidates twice but no Republican candidates.	false	https://www.snopes.com/fact-check/oregon-ballot-omits-donald-trump/	None	Uncategorized	None	Snopes Staff	None	Oregon Ballot Omits Donald Trump	21 October 2016	None	['Republican_Party_(United_States)', 'Democratic_Party_(United_States)', 'Oregon']
snes-02391	Country star Willie Nelson has died.	false	https://www.snopes.com/fact-check/willie-nelson-death-hoax/	None	Junk News	None	David Mikkelson	None	Willie Nelson Death Hoax	23 February 2015	None	['Willie_Nelson']
snes-03697	Video depicts Democrats committing fraud during the 2016 primary.	false	https://www.snopes.com/fact-check/voter-fraud-in-2016-primary/	None	Fauxtography	None	Kim LaCapria	None	Video Shows Democrats Committing Voter Fraud in 2016 Primary	26 October 2016	None	['Democratic_Party_(United_States)']
snes-01052	A series of images show a Tesla vehicle in space.	true	https://www.snopes.com/fact-check/tesla-car-really-space/	None	Fauxtography	None	Dan Evon	None	Is This Car Really in Space?	7 February 2018	None	['None']
snes-00482	A photograph of children in orange jumpsuits depicts detained immigrant children.	false	https://www.snopes.com/fact-check/are-children-orange-jumpsuits/	None	Fauxtography	None	Kim LaCapria	None	Are These Immigrant Children in Orange Jumpsuits?	11 June 2018	None	['None']
snes-04793	Facebook routinely suppresses conservative news in favor of liberal content.	unproven	https://www.snopes.com/fact-check/is-facebook-censoring-conservative-news/	None	Media Matters	None	Kim LaCapria	None	Is Facebook Censoring Conservative News?	9 May 2016	None	['None']
snes-06048	Photograph shows boxes of Tyson "[inverted] boneless pork rectums."	mostly true	https://www.snopes.com/fact-check/pig-in-a-poke/	None	Fauxtography	None	David Mikkelson	None	Inverted Boneless Pork Rectums	1 July 2014	None	['None']
snes-04012	Comedian Jeff Foxworthy slammed Hillary Clinton and was attacked by liberals.	false	https://www.snopes.com/fact-check/jeff-foxworthy-slams-hillary-clinton/	None	Uncategorized	None	Snopes Staff	None	Jeff Foxworthy Gets Attacked by Liberals After Publicly SLAMMING Hillary Clinton	17 September 2016	None	['None']
snes-00067	A videos shows the step-by-step process of making a lemon-pomegranate hybrid fruit.	false	https://www.snopes.com/fact-check/lemon-pomegranate-hybrid/	None	Fauxtography	None	Dan Evon	None	Does This Video Show a Lemon-Pomegranate Hybrid Plant?	18 September 2018	None	['None']
snes-02157	A sign posted in the London Underground informed passengers that they all smelled and should wear deodorant.	false	https://www.snopes.com/fact-check/london-underground-sign/	None	Fauxtography	None	Dan Evon	None	Is This a Real London Underground Sign?	22 June 2017	None	['None']
snes-01688	A video shows a group of unidentified flying objects over Oklahoma City.	false	https://www.snopes.com/fact-check/ufos-spotted-oklahoma-city/	None	Viral Phenomena	None	Dan Evon	None	Were UFOs Spotted Over Oklahoma City?	22 September 2017	None	['Oklahoma_City']
snes-00551	Was a Muslim Educator Named Superintendent of Atlanta’s Schools?	false	https://www.snopes.com/fact-check/muslim-educator-named-superintendent-atlantas-schools/	None	Junk News	None	Arturo Garcia	None	Was a Muslim Educator Named Superintendent of Atlanta’s Schools?	24 May 2018	None	['None']
snes-01482	Was Tiger Woods Ordered to Take 137 Paternity Tests?	false	https://www.snopes.com/fact-check/tiger-woods-paternity/	None	Junk News	None	Dan MacGuill	None	Was Tiger Woods Ordered to Take 137 Paternity Tests?	3 November 2017	None	['None']
snes-04042	Charmin had introduced a Pumpkin Spice variety of toilet paper.	false	https://www.snopes.com/fact-check/pumpkin-spice-charmin/	None	Fauxtography	None	Kim LaCapria	None	Does Charmin make Pumpkin Spice Bathroom Tissue?	13 September 2016	None	['None']
snes-03308	Viral Venom	mixture	https://www.snopes.com/fact-check/bee-venom-kills-hiv/	None	Medical	None	Alex Kasprak	None	Bee Venom Kills HIV	19 December 2016	None	['None']
snes-05786	Michigan government offices provide information in Arabic and allow polygamous Muslim men to apply for public assistance benefits for up to four wives.	mixture	https://www.snopes.com/fact-check/muslim-men-can-4-wives-welfare-michigan/	None	Immigration	None	David Mikkelson	None	Muslim Men Can Have 4 Wives on Welfare in Michigan?	18 September 2014	None	['Michigan', 'Arabic_language', 'Islam']
snes-00877	Blue Buffalo pet food contains unsafe and higher-than-average levels of lead.	unproven	https://www.snopes.com/fact-check/does-blue-buffalo-contain-toxic-levels-lead/	None	Critter Country	None	Kim LaCapria	None	Does Blue Buffalo Dog Food Contain Toxic Levels of Lead?	19 March 2018	None	['None']
snes-02460	Joakim Noah gave the finger to US soldiers and refused to eat with them while training at West Point.	mixture	https://www.snopes.com/fact-check/joakim-noah-west-point/	None	Sports	None	Dan Evon	None	Joakim Noah Gives U.S. Soldiers the Finger, Refuses to Eat With Them?	9 May 2017	None	['Joakim_Noah']
snes-03956	A woman saved multiple lives by using her concealed carry pistol to take down a department store shooter in Virginia.	false	https://www.snopes.com/fact-check/concealed-carry-department-store-shooter/	None	Junk News	None	David Mikkelson	None	Woman with Concealed Carry Permit Saves Multiple Lives After Stopping Department Store Shooter	25 September 2016	None	['Virginia']
snes-04812	Medal of Honor recipient Kyle Carpenter was stripped of his award for failing to complete a minor driving course while on active duty.	false	https://www.snopes.com/fact-check/kyle-carpenters-medal-of-honor-rescinded/	None	Junk News	None	Kim LaCapria	None	Kyle Carpenter’s Medal of Honor Rescinded?	4 May 2016	None	['None']
snes-05000	Actor Gabourey Sidibe has died of an "apparent asthma attack."	false	https://www.snopes.com/fact-check/gabourey-sidibe-death-hoax/	None	Uncategorized	None	Kim LaCapria	None	Gabourey Sidibe Death Hoax	28 March 2016	None	['None']
snes-04379	Senator Ted Cruz is scheduled to speak at the 2016 Democratic National Convention.	false	https://www.snopes.com/fact-check/ted-cruz-speak-dnc/	None	Junk News	None	Dan Evon	None	Ted Cruz Will Speak at Democratic National Convention	25 July 2016	None	['Ted_Cruz', 'Democratic_National_Convention']
snes-02024	Chester Bennington and Chris Cornell were murdered because they were about to reveal a ring of pedophiles.	false	https://www.snopes.com/fact-check/chester-bennington-and-chris-cornell-murdered/	None	Uncategorized	None	Bethania Palma	None	Were Chester Bennington and Chris Cornell Murdered to Cover Up a Pedophile Ring?	21 July 2017	None	['None']
snes-05760	Various rumors about the Target chain of retail stores (see below).	mostly false	https://www.snopes.com/fact-check/rumors-about-target/	None	Uncategorized	None	David Mikkelson	None	Rumors About Target	4 November 2002	None	['None']
snes-04075	Hillary Clinton wore a 'secret earpiece' at NBC's Commander-In-Chief forum.	false	https://www.snopes.com/fact-check/hillary-clinton-secret-earpiece/	None	Fauxtography	None	Dan Evon	None	Hillary Clinton Wore ‘Secret Earpiece’ During Commander-in-Chief Forum	8 September 2016	None	['NBC']
snes-05292	Muslims were banned from immigrating to the United States in 1952 under the provisions of the Immigration and Nationality Act.	false	https://www.snopes.com/fact-check/islam-banned-u-s-1952/	None	Immigration	None	Kim LaCapria	None	Were Muslims Banned from the U.S. in 1952?	8 December 2015	None	['United_States']
snes-02032	A photograph shows a scarecrow made from a human corpse.	miscaptioned	https://www.snopes.com/fact-check/scarecrow-human-body/	None	Fauxtography	None	Dan Evon	None	Does This Photograph Show a Scarecrow Made from a Human Corpse?	20 July 2017	None	['None']
snes-01897	In August 2017, the owner of a hotel in Arosa, Switzerland posted signs imposing restrictions on Jewish guests, including asking them to shower before using the hotel swimming pool.	true	https://www.snopes.com/fact-check/switzerland-hotel-jewish-guests/	None	Racial Rumors	None	Dan MacGuill	None	Did a Hotel Owner in Switzerland Ask Jewish Guests to Shower Before Using the Pool?	15 August 2017	None	['Switzerland', 'Jews']
snes-03777	Donald Trump, Jr. said that if women can't handle harassment in the workplace, they should teach kindergarten.	true	https://www.snopes.com/fact-check/trump-jr-women-workforce/	None	Politics	None	Bethania Palma	None	Did Donald Trump Jr Say ‘Women Who Can’t Handle Workplace Harassment Shouldn’t Work’?	17 October 2016	None	['None']
snes-02044	DJ Khaled broke a horse's back while riding on it, causing the horse to be put down.	false	https://www.snopes.com/fact-check/dj-khaled-break-horses-back/	None	Uncategorized	None	Dan MacGuill	None	Did DJ Khaled Break a Horse’s Back By Riding on it?	18 July 2017	None	['None']
snes-01133	A Maryland man has been indicted in connection with the Uranium One investigation.	false	https://www.snopes.com/fact-check/has-indictment-been-issued-uranium-one/	None	Politics	None	Bethania Palma	None	Has an Indictment Been Issued in the Uranium One Investigation?	24 January 2018	None	['None']
snes-04880	An 18-year-old waitress in Texas received a $1,000 tip after a man overheard her discussing her college plans with a couple at another table.	true	https://www.snopes.com/fact-check/a-tip-for-education/	None	Luck	None	Stephanie Larsen	None	A Tip for Education	21 April 2016	None	['Texas']
snes-06285	Trumped Up	false	https://www.snopes.com/fact-check/trumped-up/	None	Politics	None	Snopes Staff	None	Did Donald Trump Pay Off a Good Samaritan’s Mortgage?	3 March 1998	None	['None']
snes-04970	Bernie Sanders said that "the heritage of Castro will be felt for generations to come" during a 1985 radio interview.	false	https://www.snopes.com/fact-check/sanders-america-embrace-socialism/	None	Uncategorized	None	Dan Evon	None	Bernie Sanders Said United States Would ‘Embrace Socialism’?	1 April 2016	None	['Bernie_Sanders']
snes-00842	Did David Hogg Lie About Being on Campus During Mass Shooting?	false	https://www.snopes.com/fact-check/david-hogg-on-campus-rumor-hoax/	None	Politics	None	Brooke Binkowski	None	Did David Hogg Lie About Being on Campus During Mass Shooting?	26 March 2018	None	['None']
snes-06121	Bill Clinton was the "first pardoned federal felon ever to serve as President of the U.S."	false	https://www.snopes.com/fact-check/clinton-draft-pardon/	None	Uncategorized	None	David Mikkelson	None	Was Bill Clinton a ‘Felonious Draft Dodger’?	6 January 2003	None	['Bill_Clinton', 'United_States']
snes-03731	The 1987 film Back to the Future II correctly predicted that the Florida Marlins would win the 1997 World Series and that the Cubs would play Florida in the 2015 World Series.	false	https://www.snopes.com/fact-check/back-to-the-future-prediction/	None	Entertainment	None	David Mikkelson	None	‘Back to the Future II’ Correctly Predicted Cubs World Series Win in 2015?	25 October 1997	None	['Miami_Marlins', 'Chicago_Cubs', 'World_Series']
snes-05708	Senator Dianne Feinstein said "when the gunman realizes that nobody else is armed, he will lay down his weapons and turn himself in, that's human nature."	false	https://www.snopes.com/fact-check/gunman-gambit/	None	Media Matters	None	David Mikkelson	None	Dianne Feinstein ‘Gunman’ Quote	8 January 2015	None	['Dianne_Feinstein']
snes-04706	A little-known painting entitled "Cat Prevents House Fire" was created by Norman Rockwell.	false	https://www.snopes.com/fact-check/norman-rockwell-cat-prevents-fire/	None	Fauxtography	None	Dan Evon	None	Little-Known Norman Rockwell Painting: ‘Cat Prevents House Fire’	26 May 2016	None	['Norman_Rockwell']
snes-06261	A fire in a three-apartment dwelling killed black and Mexican families living there but spared a white couple because they were the only ones at work when the blaze started.	false	https://www.snopes.com/fact-check/fire-kill-black-mexican-families-spare-white-couple/	None	Racial Rumors	None	Snopes Staff	None	Did a Fire Kill Black and Mexican Families But Spare a White Couple?	25 September 2008	None	['Mexico']
snes-03526	A Mexican supermarket chain is adding "donations" for a U.S.-Mexico border wall to its charges.	false	https://www.snopes.com/fact-check/mexican-supermarket-taking-donations-for-trump-border-wall/	None	Uncategorized	None	Arturo Garcia	None	Mexican Supermarket Taking ‘Donations’ for Trump Border Wall	17 November 2016	None	['Mexico', 'Mexico–United_States_border']
snes-02354	The remains of a woman who went missing in 1985 were found on the property of Bill and Hillary Clinton.	false	https://www.snopes.com/fact-check/miriam-loomis-found-dead-clinton-estate/	None	Junk News	None	Dan MacGuill	None	Woman Found on Clinton Estate Dead, Tortured, and Malnourished?	24 May 2017	None	['Hillary_Rodham_Clinton', 'Bill_Clinton']
snes-05282	Donald Trump paid Sarah Palin $10 million for her endorsement.	false	https://www.snopes.com/fact-check/trump-palin-endorsement/	None	Junk News	None	Dan Evon	None	Donald Trump Didn’t Pay Sarah Palin for Her Endorsement	1 February 2016	None	['Sarah_Palin', 'Donald_Trump']
snes-00803	Can Facebook Users Receive $17,500 Each Over a 'Data Breach'?	mostly false	https://www.snopes.com/fact-check/facebook-data-breach-cash/	None	Computers	None	Kim LaCapria	None	Can Facebook Users Receive $17,500 Each Over a ‘Data Breach’?	6 April 2018	None	['None']
snes-03599	Scientists say that largest the supermoon since 1948, occurring on 14 November 2016, will trigger tidal waves and catastrophic earthquakes, wreaking havoc across the planet.	false	https://www.snopes.com/fact-check/supermoon-tidal-waves-earthquakes/	None	Science	None	Alex Kasprak	None	Rare Supermoon Is Going to Unleash Tidal Waves and Massive Earthquakes	8 November 2016	None	['None']
snes-03955	A video shows Black Lives Matter protesters in Charlotte attacking and beating a homeless vet.	false	https://www.snopes.com/fact-check/black-lives-matter-protesters-beat-homeless-vet/	None	Politics	None	Kim LaCapria	None	Black Lives Matter Protesters Beat Homeless Veteran	26 September 2016	None	['None']
snes-05558	The mass-murdering Michael Myers character in the Halloween series of films sports what was originally a Captain Kirk mask.	true	https://www.snopes.com/fact-check/william-shatner-halloween-mask/	None	Entertainment	None	Dan Evon	None	Who Was Michael Myers?	27 October 2015	None	['James_T._Kirk', 'Michael_Myers_(Halloween)']
snes-00720	Did Jane Goodall Compare Donald Trump’s Actions to Primate Dominance Behavior?	mixture	https://www.snopes.com/fact-check/jane-goodall-trump-primate-behavior/	None	Politics	None	Kim LaCapria	None	Did Jane Goodall Compare Donald Trump’s Actions to Primate Dominance Behavior?	25 April 2018	None	['None']
snes-04773	A Texas man found a dead rat in a partially consumed bottle of Dr Pepper.	unproven	https://www.snopes.com/fact-check/rat-found-in-dr-pepper-bottle/	None	Fauxtography	None	Kim LaCapria	None	Rat Found in Dr Pepper Bottle	11 May 2016	None	['Texas', 'Dr_Pepper']
snes-05247	A photograph shows a pilot taking a selfie over a football stadium.	false	https://www.snopes.com/fact-check/jet-flyover-selfie/	None	Fauxtography	None	Dan Evon	None	Pilot Takes Selfie During Stadium Flyover?	9 February 2016	None	['None']
snes-00079	Photographs document CNN's Anderson Cooper faking the depths of Hurricane Florence floodwaters.	miscaptioned	https://www.snopes.com/fact-check/anderson-cooper-hurricane/	None	Fauxtography	None	David Mikkelson	None	Is This Anderson Cooper Standing in a Ditch While Reporting Hurricane Florence?	16 September 2018	None	['Anderson_Cooper', 'CNN']
snes-04838	Indiana Governor Mike Pence signed a law banning boys from wearing "gay" colors.	false	https://www.snopes.com/fact-check/gay-color-ban-indiana-fake/	None	Junk News	None	Dan Evon	None	Indiana Governor Bans Boys from Wearing Clothes with ‘Gay’ Colors	29 April 2016	None	['Mike_Pence', 'Indiana']
snes-03918	Former FBI director James Comey benefited financially from the Clinton Foundation and was therefore biased when he investigated Hillary Clinton's e-mail scandal.	unproven	https://www.snopes.com/fact-check/comey-clinton-foundation/	None	Politics	None	Bethania Palma	None	Did James Comey Take Millions from the Clinton Foundation?	29 September 2016	None	['Clinton_Foundation', 'Hillary_Rodham_Clinton', 'Federal_Bureau_of_Investigation']
snes-00321	The Cancer Act of 1939 makes it illegal to cure cancer.	false	https://www.snopes.com/fact-check/cancer-act-1939/	None	Medical	None	Alex Kasprak	None	Does the Cancer Act of 1939 Make It Illegal to Cure Cancer?	18 July 2018	None	['None']
snes-04797	Sarah Palin wants to ban "Arabic numerals" from American schools.	false	https://www.snopes.com/fact-check/sarah-palin-arabic-numerals/	None	Junk News	None	Brooke Binkowski	None	Sarah Palin Wants ‘Arabic Numerals’ Banned From America’s Schools	6 May 2016	None	['United_States', 'Sarah_Palin']
snes-06262	Patients should request the use of thyroid guards during x-ray procedures.to head off thyroid cancer.	mixture	https://www.snopes.com/fact-check/thyroid-guards/	None	Medical	None	David Mikkelson	None	Should Patients Request Thyroid Guards During X-Rays to Prevent Thyroid Cancer?	20 March 2011	None	['None']
snes-05400	According to a body language expert, a photograph of President Obama crying reveals he is a psychopath.	false	https://www.snopes.com/fact-check/obama-crying-like-a-psychopath-meme/	None	Politicians	None	Kim LaCapria	None	Obama Crying Like a Psychopath Meme	7 January 2016	None	['Barack_Obama']
snes-02372	Does Cooking with Aluminum Foil Put You at Risk for Alzheimer’s?	mostly false	https://www.snopes.com/fact-check/cooking-with-aluminum-foil-puts-you-at-risk-for-alzheimers/	None	Science	None	Alex Kasprak	None	Does Cooking with Aluminum Foil Put You at Risk for Alzheimer’s?	17 November 2016	None	['None']
snes-04641	An image serves as photographic proof that Hillary Clinton is incontinent.	false	https://www.snopes.com/fact-check/photograph-incontinent-hillary-clinton/	None	Fauxtography	None	Dan Evon	None	Photograph of ‘Incontinent’ Hillary Clinton	7 June 2016	None	['None']
snes-02057	A line from George Orwell's novel 1984 predicts the power of smartphones.	false	https://www.snopes.com/fact-check/orwell-1984-smartphone-screens/	None	Questionable Quotes	None	Dan MacGuill	None	Did George Orwell’s ‘1984’ Predict the Power of Smartphones?	17 July 2017	None	['None']
snes-05368	A Florida man was emasculated during an attempt to engage in sexual relations with a pit bull.	false	https://www.snopes.com/fact-check/florida-man-pit-bull/	None	Junk News	None	Kim LaCapria	None	Was a Florida Man Emasculated During a Pit Bull Sex Assault?	13 January 2016	None	['None']
