snes-05007	Maricopa County Recorder Helen Purcell was married to Joe Purcell, a former Lieutenant Governor of Arkansas who served under Bill Clinton.	false	https://www.snopes.com/fact-check/helen-purcell-clinton-connection/	None	Uncategorized	None	Dan Evon	None	Maricopa County Recorder Has a Personal Clinton Connection?	25 March 2016	None	['Bill_Clinton', 'Joe_Purcell', 'Arkansas', 'Maricopa_County,_Arizona']
snes-03841	Bees have been classified as an endangered species.	mixture	https://www.snopes.com/fact-check/bee-species-endangered/	None	Critter Country	None	Dan Evon	None	Were Bees Added to the Endangered Species List?	8 October 2016	None	['None']
snes-00443	Does a Specific Law Mandate Family Separation and Detention of Minors?	false	https://www.snopes.com/fact-check/does-law-family-separation-detention-minors/	None	Politics	None	Kim LaCapria	None	Does a Specific Law Mandate Family Separation and Detention of Minors?	19 June 2018	None	['None']
snes-00373	A lunar eclipse occurring on 27 July 2018 will be the longest duration total lunar eclipse of the 21st century.	true	https://www.snopes.com/fact-check/longest-lunar-eclipse/	None	Science	None	Alex Kasprak	None	The Longest Total Lunar Eclipse of the 21st Century Will Occur on July 27	5 July 2018	None	['None']
snes-02384	President Trump praised KFC founder Colonel Sanders, who wasn't born until 1890, for his service during the Civil War.	false	https://www.snopes.com/fact-check/donald-trump-praises-colonel-sanders/	None	Junk News	None	David Emery	None	Donald Trump Praises Colonel Sanders for His Service in the Civil War?	22 May 2017	None	['None']
snes-03607	A daughter expressed her not-so-warm feelings about her deceased mother by running a scathing and caustic obituary.	true	https://www.snopes.com/fact-check/death-penalty/	None	Humor	None	David Mikkelson	None	Death Be Not Proud	20 August 2008	None	['None']
snes-03681	A photograph shows Hillary Clinton and her college roommate walking topless in the 1960s.	false	https://www.snopes.com/fact-check/hillary-clinton-topless-1960s/	None	Fauxtography	None	Dan Evon	None	Hillary Clinton Went Topless in the 1960s?	28 October 2016	None	['None']
snes-01334	A billionaire avoided jail despite raping his infant daughter, while another man was sentenced to 50 years in jail for stealing a rack of ribs.	mostly true	https://www.snopes.com/fact-check/50-years-ribs-theft/	None	Crime	None	Dan MacGuill	None	Probation for Child Rape Vs. Prison for Stealing Ribs?	13 December 2017	None	['None']
snes-04174	During a radio interview, Rosie O'Donnell said, "I'd like to take my period blood and smear it all over Christians' [or pro-life people's] faces."	mixture	https://www.snopes.com/fact-check/rosie-odonnell-period-blood/	None	Questionable Quotes	None	David Emery	None	What Rosie O’Donnell Really Said She’d Like to Do with Her Period Blood	25 August 2016	None	['None']
snes-03233	Two handfuls of cashews are equivalent to one dose of Prozac in treating depression, and can be safely substituted for prescribed drugs.	false	https://www.snopes.com/fact-check/cashews-equivalent-to-a-dose-of-prozac/	None	Medical	None	Kim LaCapria	None	Are Two Handfuls of Cashews Equivalent to a Dose of Prozac for Depression?	30 December 2016	None	['None']
snes-02640	White House Press Secretary Sean Spicer said that the United States was "absolutely ready for World War III" under President Donald Trump's strong leadership.	false	https://www.snopes.com/fact-check/spicer-trump-ready-wwiii/	None	Junk News	None	Dan Evon	None	Did Sean Spicer Say ‘We’re Absolutely Ready for WWIII’ Under Trump?	11 April 2017	None	['United_States', 'White_House', 'Donald_Trump']
snes-01344	A video shows a man demonstrating an invisibility cloak.	false	https://www.snopes.com/fact-check/is-this-invisibility-cloak-video-real/	None	Fauxtography	None	Dan Evon	None	Is This ‘Invisibility Cloak’ Video Real?	11 December 2017	None	['None']
snes-05038	An image depicts rare purple ladybugs found only in Hawaii.	false	https://www.snopes.com/fact-check/purple-ladybugs/	None	Uncategorized	None	Kim LaCapria	None	Purple Ladybugs	21 March 2016	None	['Hawaii']
snes-04987	After unlocking an iPhone belonging to one of the people involved in the San Bernardino shooting, the FBI ruined the device by spilling water on it.	false	https://www.snopes.com/fact-check/fbi-spills-water-iphone/	None	Uncategorized	None	Dan Evon	None	FBI Spilled Water on San Bernardino iPhone	30 March 2016	None	['San_Bernardino,_California', 'Federal_Bureau_of_Investigation']
snes-00211	Ohio's 12th Congressional District recorded 170 fraudulent votes cast in August 2018 by persons with birthdates earlier than 1902.	mostly false	https://www.snopes.com/fact-check/ohio-voter-fraud/	None	Politics	None	Dan MacGuill	None	Did Ohio’s 12th Congressional District Have 170 Fraudulent ‘Voters’ Over 116 Years Old?	16 August 2018	None	['Ohio', 'Congressional_district']
snes-03176	A man was sentenced to 22 years in prison for stealing a remote control.	mixture	https://www.snopes.com/fact-check/man-sentenced-22-years-remote/	None	Crime	None	Dan Evon	None	Was a Man Sentenced to 22 Years in Prison Just for Stealing a Remote?	9 January 2017	None	['None']
snes-04241	A video captures African-American protesters targeting white people for mob violence during unrest in Milwaukee over the weekend of 13 August 2016.	mixture	https://www.snopes.com/fact-check/black-protesters-targeted-whites-in-milwaukee/	None	Uncategorized	None	Bethania Palma	None	Video: Black Protesters Targeted Whites in Milwaukee?	15 August 2016	None	['Milwaukee']
snes-00980	Donald Trump registered his "Make America Great Again" slogan in November 2012.	true	https://www.snopes.com/fact-check/trump-patent-maga-2012/	None	Politics	None	Alex Kasprak	None	Did Donald Trump Register ‘Make America Great Again’ in 2012?	21 February 2018	None	['None']
snes-02772	After releasing a music video in which he fires a prank "Bang!" flag gun at a clown resembling Donald Trump, rapper Snoop Dogg was arrested for conspiracy by the Secret Service for suggesting that "someone should do what I did with a real gun."	false	https://www.snopes.com/fact-check/snoop-dogg-arrested-conspiracy/	None	Junk News	None	David Emery	None	Snoop Dogg Arrested for Conspiracy After Talking About ‘Murder Trump’ Video?	15 March 2017	None	['Snoop_Dogg', 'Donald_Trump', 'United_States_Secret_Service']
snes-05600	The NAACP is calling for the removal of an historical Civil War carving from Stone Mountain, Georgia.	mixture	https://www.snopes.com/fact-check/naacp-wants-stone-mountain-sandblasted/	None	Politics	None	Kim LaCapria	None	Does the NAACP Want to Sandblast Confederate Figures Off Stone Mountain?	10 August 2015	None	['Stone_Mountain', 'Georgia_(U.S._state)', 'National_Association_for_the_Advancement_of_Colored_People', 'American_Civil_War']
snes-02717	Sweden has the highest rate of rape among European countries.	false	https://www.snopes.com/fact-check/crime-sweden-rape-capital-europe/	None	Uncategorized	None	Bethania Palma	None	Crime In Sweden, Part I: Is Sweden the ‘Rape Capital’ of Europe?	29 March 2017	None	['Sweden', 'Europe']
snes-05900	Senator Dianne Feinstein said that "All vets are mentally ill and the government should prevent them from owning firearms."	false	https://www.snopes.com/fact-check/feinstein-veterans-firearms/	None	Guns	None	David Mikkelson	None	Did Senator Dianne Feinstein Say ‘All Vets Are Mentally Ill’?	4 April 2013	None	['Dianne_Feinstein']
snes-05911	All of the reindeer that pull Santa's sleigh are female.	legend	https://www.snopes.com/fact-check/reindeer-games/	None	Holidays	None	David Mikkelson	None	Are Santa’s Reindeer All Female?	20 December 2012	None	['None']
snes-05803	A photograph shows an insect spy drone that can take photographs and DNA samples.	mixture	https://www.snopes.com/fact-check/insect-spy-drone/	None	Technology	None	David Mikkelson	None	Insect Spy Drone	14 August 2012	None	['None']
snes-05599	According to Thomas Homer-Dixon, wind turbines never recoup the energy it takes to build them.	mixture	https://www.snopes.com/fact-check/wind-idiot-power/	None	Politics	None	Dan Evon	None	Do Windmills Create More Energy to Build Than They Ever Produce?	17 August 2015	None	['None']
snes-05290	'Making a Murderer' subject Steven Avery was found unresponsive in his prison cell.	false	https://www.snopes.com/fact-check/steven-avery-unresponsive/	None	Junk News	None	David Mikkelson	None	FALSE: Steven Avery, 53, Found Unresponsive in His Prison Cell	31 January 2016	None	['None']
snes-02078	Did Donald Trump Assault a Marine Then Rip Off His Cover?	false	https://www.snopes.com/fact-check/trump-marines-hat/	None	Fauxtography	None	Dan Evon	None	Did Donald Trump Assault a Marine Then Rip Off His Cover?	13 July 2017	None	['None']
snes-01414	Glen Eagles hospital issued an urgent warning because seven women have died after sniffing perfume samples received in the mail.	false	https://www.snopes.com/fact-check/charnel-no-5/	None	September 11th	None	David Mikkelson	None	Women Killed by Poisoned Perfume Samples?	3 November 2001	None	['None']
snes-01118	Mississippi House Bill 1100 would force public school teachers to recite the Ten Commandments at the start of each school day.	unproven	https://www.snopes.com/fact-check/ten-commandments-mississippi/	None	Politics	None	Dan MacGuill	None	Did a Mississippi Democrat Propose a Law to Force Teachers to Recite the Ten Commandments?	25 January 2018	None	['None']
snes-00018	At least 260 members of the U.S. Congress have settled sexual assault charges.	false	https://www.snopes.com/fact-check/congress-sexual-assault-charges/	None	None	None	Dan Evon	None	Have 260 Out of 535 Members of Congress Settled Sexual Assault Charges?	3 October 2018	None	['United_States_Congress', 'United_States']
snes-03529	A photograph of a nude young man pictures Judge William Pryor, a potential Supreme Court nominee.	unproven	https://www.snopes.com/fact-check/william-pryor-nude/	None	Fauxtography	None	Dan Evon	None	Judge William Pryor Posed Nude for a Gay Magazine?	17 November 2016	None	['None']
snes-04001	The discovery of a vaccine for the autoimmune disease diabetes has been announced.	false	https://www.snopes.com/fact-check/diabetes-vaccine/	None	Junk News	None	Bethania Palma	None	Diabetes Vaccine Announced?	19 September 2016	None	['None']
snes-01927	Singer Lana Del Rey banned the American flag from her concerts because she can't stand to see it with President Trump in office.	mostly false	https://www.snopes.com/fact-check/did-singer-lana-del-rey-ban-american-flags-at-her-concerts/	None	Uncategorized	None	Bethania Palma	None	Did Singer Lana Del Rey Ban American Flags at Her Concerts?	10 August 2017	None	['United_States']
snes-01079	Did Nikki Haley 'Accidentally Confess' to an Affair with Donald Trump?	false	https://www.snopes.com/fact-check/nikki-haley-affair-accidentally/	None	Politics	None	David Mikkelson	None	Did Nikki Haley ‘Accidentally Confess’ to an Affair with Donald Trump?	1 February 2018	None	['None']
snes-01754	On 11 September 2017, Florida Governor Rick Scott was taken to hospital after being injured during a Hurricane Irma cleanup operation.	false	https://www.snopes.com/fact-check/rick-scott-critical-condition/	None	Junk News	None	Dan MacGuill	None	Florida Governor Rick Scott Critically Injured During Hurricane Irma Cleanup?	11 September 2017	None	['None']
snes-03952	Image depicts police in Danville, Virginia, purposely obstructing dash cams by lifting the hoods of their vehicles.	mostly false	https://www.snopes.com/fact-check/police-pop-hoods/	None	Fauxtography	None	Kim LaCapria	None	Police Allowed to ‘Pop Hoods’ to Block Dash Cams	26 September 2016	None	['Virginia', 'Danville,_Virginia']
snes-06445	Photograph shows a C-130 transport dropping anti-missile flares.	true	https://www.snopes.com/fact-check/c-130/	None	Uncategorized	None	David Mikkelson	None	C-130 Flares	15 July 2003	None	['None']
snes-05903	Singer Bobby Shmurda was stabbed to death at Rikers Island by his cellmate.	false	https://www.snopes.com/fact-check/bobby-shmurda-death/	None	Junk News	None	Dan Evon	None	Was Bobby Shmurda Stabbed to Death in Rikers Island Jail by His Cell Mate?	27 December 2014	None	['Rikers_Island']
snes-01569	President Obama Awarded the Presidential Medal of Freedom to Weinstein, Weiner, Clinton, and Cosby?	mostly false	https://www.snopes.com/fact-check/obama-medal-of-freedom-weinstein-clinton-cosby-weiner/	None	Fauxtography	None	Dan Evon	None	President Obama Awarded the Presidential Medal of Freedom to Weinstein, Weiner, Clinton, and Cosby?	17 October 2017	None	['Bill_Clinton', 'Barack_Obama', 'Presidential_Medal_of_Freedom']
snes-01227	Animated series "The Boondocks" had a scene about Oprah Winfrey's becoming president in 2020.	true	https://www.snopes.com/fact-check/did-the-boondocks-forecast-oprah-winfrey-becoming-president/	None	Politics	None	Arturo Garcia	None	Did ‘The Boondocks’ Forecast Oprah Winfrey’s Becoming President?	10 January 2018	None	['Oprah_Winfrey']
snes-02962	Decorated Vermont state trooper Arcot Ramathorn, an Iraqi Muslim, would be denied entry under proposed U.S. travel restrictions.	false	https://www.snopes.com/fact-check/arcot-ramathorn-restriction/	None	Humor	None	Kim LaCapria	None	Would Decorated Vermont State Trooper Arcot Ramathorn Be Affected by U.S. Entry Restrictions?	10 February 2017	None	['United_States']
snes-05374	Does a Photograph Show Pigs Forced Into Tiny Cages?	mixture	https://www.snopes.com/fact-check/pig-cage-photo/	None	Fauxtography	None	Dan Evon	None	Does a Photograph Show Pigs Forced Into Tiny Cages?	13 January 2016	None	['None']
snes-03493	The Department of Justice (DOJ)'s switchboard is tallying "Audit the Vote" calls and if enough people call, 2016 election results can be overturned.	false	https://www.snopes.com/fact-check/audit-the-vote/	None	Conspiracy Theories	None	Kim LaCapria	None	Audit the Vote	22 November 2016	None	['None']
snes-02031	A photograph shows a woman who mistakenly used expanding foam insulation on her hair instead of hair mousse.	unproven	https://www.snopes.com/fact-check/builders-foam-hair/	None	Fauxtography	None	Kim LaCapria	None	Woman Confuses Spray Foam Insulation for Mousse?	30 September 2015	None	['None']
snes-02992	A video shows Anderson Cooper laughing uncontrollably after Kellyanne Conway used the phrase "alternative facts."	false	https://www.snopes.com/fact-check/anderson-cooper-laughing-at-kellyanne-conway/	None	Fauxtography	None	Dan Evon	None	Is Anderson Cooper Laughing at Kellyanne Conway?	6 February 2017	None	['None']
snes-01840	Mariah Carey recorded a cover of Dead Kennedys song "Nazi Punks Fuck Off," with proceeds going to support Antifa.	false	https://www.snopes.com/fact-check/mariah-carey-dead-kennedys-antifa/	None	Junk News	None	Kim LaCapria	None	Did Mariah Carey Cover a Dead Kennedys Song to Support Antifa?	25 August 2017	None	['Anti-fascism', 'Dead_Kennedys', 'Mariah_Carey']
snes-04985	A video shows a 10-year-old Amy Winehouse singing "What A Difference A Day Makes."	false	https://www.snopes.com/fact-check/amy-winehouse-angelina-jordan/	None	Viral Phenomena	None	Dan Evon	None	Video Shows Amy Winehouse Singing at Age 10?	30 March 2016	None	['Amy_Winehouse']
snes-03941	An image depicts a Tiffany-made slave collar on display at the National Museum of African American History and Culture in Washington, D.C.	mostly false	https://www.snopes.com/fact-check/tiffany-chokers-slave-collars/	None	Fauxtography	None	Kim LaCapria	None	Did Tiffany Chokers Originate as Slave Collars?	27 September 2016	None	['Washington,_D.C.']
snes-00953	Senator Marco Rubio said both that felons should not be allowed to vote and that they should be allowed to own guns.	false	https://www.snopes.com/fact-check/marco-rubio-said-felons-get-guns-back-not-voting-rights/	None	Junk News	None	Dan Evon	None	Does Marco Rubio Want to Give Felons Right to Own Guns, But Not to Vote?	27 February 2018	None	['Marco_Rubio']
snes-04724	A white teen girl claimed she was entitled to tribal benefits because she identifies as a Native American elder.	false	https://www.snopes.com/fact-check/white-teen-girl-identifies-as-indian-chief-demands-tribal-benefits/	None	Junk News	None	Kim LaCapria	None	White Teen Girl Identifies as Indian Chief, Demands Tribal Benefits	24 May 2016	None	['None']
snes-05719	A species of cephalopod known as the Pacific Northwest Tree Octopus, that can live on both land and water, is endangered.	false	https://www.snopes.com/fact-check/tree-octopus/	None	Fauxtography	None	Snopes Staff	None	Is the Pacific Northwest Tree Octopus Endangered?	16 October 2014	None	['None']
snes-01106	A woman posing as a "sex robot" became pregnant and filed a child support claim against her unsuspecting customer.	false	https://www.snopes.com/fact-check/robot-child-support/	None	Junk News	None	David Mikkelson	None	Did a Woman Pretending to Be a Sex Robot File for Child Support?	29 January 2018	None	['None']
snes-05507	Atheists are trying to ban Bibles from all hotel rooms.	mixture	https://www.snopes.com/fact-check/angry-atheists-ban-bible/	None	Politics	None	Kim LaCapria	None	Angry Atheists Ban the Bible?	10 December 2015	None	['None']
snes-04387	A woman who grabbed a baseball away from a child at an Astros game was identified as child psychologist Grennele Brashkowitz.	false	https://www.snopes.com/fact-check/baseball-stealing-woman-identified/	None	Fauxtography	None	Dan Evon	None	Was the Identity of a Baseball-Stealing Woman Revealed?	24 July 2016	None	['None']
snes-00033	A photograph captures Donald Trump hanging out with musician Tupac Shakur.	false	https://www.snopes.com/fact-check/donald-trump-tupac-photo/	None	Fauxtography	None	Dan Evon	None	Is This a Photograph of Donald Trump with Tupac Shakur?	1 October 2018	None	['Tupac_Shakur', 'Donald_Trump']
snes-00592	Fisher-Price manufactured a "Tiny Toker" toyset featuring a toy bong and other marijuana paraphernalia.	false	https://www.snopes.com/fact-check/did-fisher-price-release-tiny-toker/	None	Fauxtography	None	Dan Evon	None	Did Fisher-Price Release a ‘Tiny Toker’ Toy?	15 May 2018	None	['None']
snes-00620	In May 2018, the Colorado House of Representatives passed a "gun confiscation" bill.	mixture	https://www.snopes.com/fact-check/colorado-gun-confiscation/	None	Politics	None	Dan MacGuill	None	Did Colorado Democrats Pass a ‘Gun Confiscation’ Bill?	9 May 2018	None	['Colorado_House_of_Representatives']
snes-05104	Police in Collin County, Texas have quietly warned of serial kidnappings at local Target and Walmart locations.	false	https://www.snopes.com/fact-check/collin-county-serial-kidnapping/	None	Crime	None	Kim LaCapria	None	Collin County Serial Kidnapping Warning	8 March 2016	None	['Texas', 'Collin_County,_Texas', 'Walmart', 'Target_Corporation']
snes-01685	A July 1990 comic strip in Heavy Metal magazine featured a controversial wall in New York City, built by Donald Trump, and a populist "rise to power" by the future president.	true	https://www.snopes.com/fact-check/trump-wall-comic-strip/	None	Politics	None	Dan MacGuill	None	Did a 1990 Comic Depict Trump Coming to Power and Building a Wall?	22 September 2017	None	['New_York_City', 'Donald_Trump']
snes-00492	Pope Francis was part of a group condemned in an international court of killing and trafficking children.	false	https://www.snopes.com/fact-check/was-pope-guilty-trafficking-murder/	None	Junk News	None	Arturo Garcia	None	Was Pope Francis ‘Found Guilty’ of Child Trafficking and Murder?	8 June 2018	None	['None']
snes-04801	An Obamacare questionnaire asked respondents whether they'd ever been in an accident resulting in their own deaths.	mostly false	https://www.snopes.com/fact-check/have-you-ever-been-in-an-accident-resulting-in-your-death/	None	Fauxtography	None	Kim LaCapria	None	Have You Ever Been in an Accident Resulting in Your Death?	6 May 2016	None	['None']
snes-02117	A photograph shows Norwegian police officers in their skintight Summer uniforms.	false	https://www.snopes.com/fact-check/norwegian-police-officers/	None	Fauxtography	None	Dan Evon	None	Is This What Police Uniforms in Norway Look Like?	3 July 2017	None	['Norway']
snes-01652	Some horses can grow mustaches.	true	https://www.snopes.com/fact-check/can-horses-grow-mustaches/	None	Science	None	Alex Kasprak	None	Can Some Horses Grow Mustaches?	28 September 2017	None	['None']
snes-03674	Hillary Clinton's campaign manager Robby Mook deleted most of his tweets due to an FBI investigation.	false	https://www.snopes.com/fact-check/spooked-clinton-campaign-manager-deleted-tweets/	None	Politicians	None	Dan Evon	None	‘Spooked’ Clinton Campaign Manager Deleted Tweets	29 October 2016	None	['Federal_Bureau_of_Investigation']
snes-05597	A Home Depot manager in Spokane Valley, WA, rudely refused to provide a veterans discount to a customer.	unproven	https://www.snopes.com/fact-check/home-depot-veteran/	None	Politics	None	Snopes Staff	None	Did a Home Depot Manager Refuse to Provide a Veterans Discount?	20 August 2015	None	['Spokane_River', 'The_Home_Depot']
snes-02852	Trump’s Unsecured Android Device Source of Recent White House Leaks	false	https://www.snopes.com/fact-check/trumps-cell-phone-leaks/	None	Technology	None	Arturo Garcia	None	Trump’s Unsecured Android Device Source of Recent White House Leaks?	2 March 2017	None	['None']
snes-04183	Rush Limbaugh accused President Obama and the Democrats of recruiting lesbian farmers to "attack" conservative rural areas of the U.S.	true	https://www.snopes.com/fact-check/limbaugh-obama-sending-lesbian-farmers/	None	Conspiracy Theories	None	David Emery	None	Rush Limbaugh: Obama Sending Lesbian Farmers to Invade Red States	24 August 2016	None	['United_States', 'Barack_Obama', 'Democratic_Party_(United_States)', 'Rush_Limbaugh']
snes-00054	A video shows a priest aggressively dunking a baby underwater during a baptism ceremony.	mixture	https://www.snopes.com/fact-check/baby-dunking-video/	None	Fauxtography	None	Dan Evon	None	Is This Video of a Baby Being Violently Dunked in Water Real?	21 September 2018	None	['None']
snes-04190	A photograph of a 'My Daddy's Life Matters' sign included text explaining why its OK for police officers to shoot black men.	false	https://www.snopes.com/fact-check/my-daddys-life-matters-sign/	None	Fauxtography	None	Dan Evon	None	‘My Daddy’s Life Matters’	24 August 2016	None	['None']
snes-04189	A United States Army training slide labeled Hillary Clinton as an insider threat.	mixture	https://www.snopes.com/fact-check/hillary-clinton-security-threat-slide/	None	Politicians	None	Dan Evon	None	Hillary Clinton Listed As Threat in Army Training Slide	24 August 2016	None	['United_States_Army', 'Hillary_Rodham_Clinton']
snes-01937	A jewelry company is making jewelry out of unwanted human embryos.	mostly true	https://www.snopes.com/fact-check/is-company-turning-human-embryos-into-jewelry/	None	Uncategorized	None	Bethania Palma	None	Is an Australian Company Turning Human Embryos Into Jewelry?	9 August 2017	None	['None']
snes-04043	A zoo in China named a baby gorilla Harambe McHarambeface.	false	https://www.snopes.com/fact-check/baby-gorilla-harambe-mcharambeface/	None	Junk News	None	Dan Evon	None	China’s Jinhua Zoo Names Baby Gorilla Harambe McHarambeface?	13 September 2016	None	['China']
snes-02168	Complaints about the lack of transparency behind the creation of a bill to repeal Obamacare were hypocritical because the Democrats were just as bad when they passed Obamacare.	false	https://www.snopes.com/fact-check/aca-versus-ahca/	None	Politics	None	Alex Kasprak	None	Was the Passage of Obamacare Just as Secretive as GOP Efforts to Repeal It?	20 June 2017	None	['Democratic_Party_(United_States)', 'Patient_Protection_and_Affordable_Care_Act']
snes-01400	Authorities in Kenya warned of a new outbreak of HPV that spreads through kissing and is deadlier than HIV/Aids.	false	https://www.snopes.com/fact-check/hpv-kissing-aids/	None	Medical	None	Dan MacGuill	None	Is There a ‘New Outbreak’ of HPV That ‘Kills Faster than AIDS’?	27 November 2017	None	['Kenya', 'HIV/AIDS']
snes-03495	Jellyfish and lobsters are considered biologically immortal, meaning they don’t age and will never die unless they are killed.	mixture	https://www.snopes.com/fact-check/are-jellyfish-and-lobsters-biologically-immortal/	None	Science	None	Alex Kasprak	None	Are Jellyfish and Lobsters Biologically Immortal?	21 November 2016	None	['None']
snes-05928	Video shows a man jumping from an airplane without a parachute and surviving by landing on a trampoline.	false	https://www.snopes.com/fact-check/scared-chuteless/	None	Fauxtography	None	Dan Evon	None	Man Jumps Out of Airplane without Parachute onto Trampoline	4 December 2014	None	['None']
snes-02277	The soft drink Mountain Dew is being discontinued by Pepsico.	false	https://www.snopes.com/fact-check/mountain-dew-discontinued/	None	Junk News	None	Dan Evon	None	Mountain Dew to Be Discontinued?	4 August 2015	None	['PepsiCo', 'Mountain_Dew']
snes-01791	During a speech in which he declared Jesus Christ his "redeemer," Muslim leader Louis Farrakhan gave indications that he was breaking with Islam in favor of following Christianity.	false	https://www.snopes.com/fact-check/louis-farrakhan-jesus-redeemer/	None	Religion	None	David Emery	None	Did Louis Farrakhan Renounce Islam and Convert to Christianity?	4 September 2017	None	['Islam', 'Jesus', 'Christianity', 'Louis_Farrakhan']
snes-01465	The family of a terminally ill boy is asking people to send him Christmas cards.	outdated	https://www.snopes.com/fact-check/jacob-thompson-xmas-cards/	None	Viral Phenomena	None	Kim LaCapria	None	Terminally Ill Nine-Year-Old Hopes for Christmas Cards?	8 November 2017	None	['None']
